ffff88005b9333c0 1719643483 S Ci:2:010:0 s 80 06 0300 0000 0004 4 <
ffff88005b9333c0 1719644060 C Ci:2:010:0 0 4 = 04030904
ffff88005b9333c0 1719644122 S Ci:2:010:0 s 80 06 0301 0409 00fe 254 <
ffff88005b9333c0 1719644542 C Ci:2:010:0 0 22 = 16034100 70007000 6c006500 20004900 6e006300 2e00
ffff88005b933900 1719644677 S Ci:2:010:0 s 80 06 0300 0000 0004 4 <
ffff88005b933900 1719644969 C Ci:2:010:0 0 4 = 04030904
ffff88005b933900 1719645029 S Ci:2:010:0 s 80 06 0302 0409 00fe 254 <
ffff88005b933900 1719645300 C Ci:2:010:0 0 14 = 0e036900 50006800 6f006e00 6500
ffff88005b933900 1719645365 S Ci:2:010:0 s 80 06 0300 0000 0004 4 <
ffff88005b933900 1719645653 C Ci:2:010:0 0 4 = 04030904
ffff88005b933900 1719645709 S Ci:2:010:0 s 80 06 0303 0409 00fe 254 <
ffff88005b933900 1719646037 C Ci:2:010:0 0 82 = 52033600 30003500 61006600 35003000 63003200 61003500 33006500 64003300
ffff88005b933900 1719646110 S Ci:2:010:0 s 80 06 0300 0000 0004 4 <
ffff88005b933900 1719647574 C Ci:2:010:0 0 4 = 04030904
ffff88005b933900 1719647632 S Ci:2:010:0 s 80 06 0305 0409 00fe 254 <
ffff88005b933900 1719647902 C Ci:2:010:0 0 8 = 08035000 54005000
ffff88005b933900 1719647984 S Ci:2:010:0 s 80 06 0300 0000 0004 4 <
ffff88005b933900 1719648282 C Ci:2:010:0 0 4 = 04030904
ffff88005b933900 1719648342 S Ci:2:010:0 s 80 06 0306 0409 00fe 254 <
ffff88005b933900 1719648595 C Ci:2:010:0 0 38 = 26036900 50006f00 64002000 55005300 42002000 49006e00 74006500 72006600
ffff88005b933900 1719648702 S Ci:2:010:0 s 80 06 0300 0000 0004 4 <
ffff88005b933900 1719648945 C Ci:2:010:0 0 4 = 04030904
ffff88005b933900 1719649001 S Ci:2:010:0 s 80 06 0307 0409 00fe 254 <
ffff88005b933900 1719649229 C Ci:2:010:0 0 52 = 34035000 54005000 20002b00 20004100 70007000 6c006500 20004d00 6f006200
ffff88005b933900 1719649314 S Ci:2:010:0 s 80 06 0300 0000 0004 4 <
ffff88005b933900 1719649571 C Ci:2:010:0 0 4 = 04030904
ffff88005b933900 1719649627 S Ci:2:010:0 s 80 06 0308 0409 00fe 254 <
ffff88005b933900 1719649962 C Ci:2:010:0 0 94 = 5e035000 54005000 20002b00 20004100 70007000 6c006500 20004d00 6f006200
ffff88005b933900 1719650046 S Ci:2:010:0 s 80 06 0600 0000 000a 10 <
ffff88005b933900 1719650309 C Ci:2:010:0 0 10 = 0a060002 00000040 0400
ffff88005b933900 1719650367 S Ci:2:010:0 s 80 06 0a00 0000 0004 4 <
ffff88005b933900 1719650619 C Ci:2:010:0 -32 0
ffff88005b933900 1719650674 S Ci:2:010:0 s 80 00 0000 0000 0002 2 <
ffff88005b933900 1719650990 C Ci:2:010:0 0 2 = 0000
ffff88005b90ce40 1729668753 S Ci:2:010:0 s 80 06 0300 0000 00ff 255 <
ffff88005b90ce40 1729669243 C Ci:2:010:0 0 4 = 04030904
ffff88005b90ce40 1729669365 S Ci:2:010:0 s 80 06 0303 0409 00ff 255 <
ffff88005b90ce40 1729669718 C Ci:2:010:0 0 82 = 52033600 30003500 61006600 35003000 63003200 61003500 33006500 64003300
ffff88005b90ce40 1729669868 S Bo:2:010:4 -115 20 = 00000000 00000014 00000001 00000000 00000000
ffff88006d3f5480 1729669880 S Bi:2:010:5 -115 16384 <
ffff88005b90ce40 1729669919 C Bo:2:010:4 0 20 >
ffff88006d3f5480 1729670958 C Bi:2:010:5 0 20 = 00000000 00000014 00000001 00000000 5c8842cc
ffff88005b99b6c0 1729671059 S Bi:2:010:5 -115 16384 <
ffff8800367176c0 1729685902 S Co:2:010:0 s 01 0b 0001 0002 0000 0
ffff8800367176c0 1729686534 C Co:2:010:0 0 0
ffff88005b90ce40 1729686625 S Ci:2:010:0 s c0 45 0000 0002 0040 64 <
ffff88005b90ce40 1729686935 C Ci:2:010:0 0 1 = 03
ffff88005300aa80 1729686982 S Bi:2:010:6 -115 1516 <
ffff8800368f2540 1730672444 S Bo:2:010:4 -115 28 = 00000006 0000001c 0001f27e 00000000 00000000 50020200 00000000
ffff8800368f2540 1730672491 C Bo:2:010:4 0 28 >
ffff8800368f2540 1730674155 S Bo:2:010:4 -115 28 = 00000006 0000001c 0002f27e 00000000 00000000 50020200 00000000
ffff8800368f2540 1730674188 C Bo:2:010:4 0 28 >
ffff88005b99b6c0 1730675663 C Bi:2:010:5 0 28 = 00000006 0000001c f27e0001 00000000 00000001 5b120200 50779bfd
ffff8800368f2540 1730675728 S Bo:2:010:4 -115 28 = 00000006 0000001c 0001f27e 00000001 00000001 50100200 00000000
ffff8800368f23c0 1730675753 S Bi:2:010:5 -115 16384 <
ffff8800368f2540 1730675761 C Bo:2:010:4 0 28 >
ffff8800368f2540 1730675950 S Bo:2:010:4 -115 372 = 00000006 00000174 0001f27e 00000001 00000001 50100200 00000000 00000154
ffff8800368f2540 1730676046 C Bo:2:010:4 0 372 >
ffff8800368f23c0 1730677799 C Bi:2:010:5 0 28 = 00000006 0000001c f27e0002 00000000 00000001 5c120200 40060000
ffff8800368f23c0 1730677835 S Bo:2:010:4 -115 28 = 00000006 0000001c 0002f27e 00000001 00000001 50100200 00000000
ffff8800368f2540 1730677844 S Bi:2:010:5 -115 16384 <
ffff8800368f23c0 1730677869 C Bo:2:010:4 0 28 >
ffff8800368f23c0 1730677973 S Bo:2:010:4 -115 311 = 00000006 00000137 0002f27e 00000001 00000001 50100200 00000000 00000117
ffff8800368f23c0 1730678189 C Bo:2:010:4 0 311 >
ffff8800368f2540 1730683740 C Bi:2:010:5 0 32 = 00000006 00000020 f27e0001 00000001 00000159 5b100200 1967a6bd 0000014a
ffff8800368f2540 1730683796 S Bi:2:010:5 -115 16384 <
ffff8800368f2540 1730684139 C Bi:2:010:5 0 358 = 00000006 00000166 f27e0001 00000005 00000159 5b100200 1967a6bd 3c3f786d
ffff88004b2b5540 1730684175 S Bi:2:010:5 -115 16384 <
ffff8800368f2540 1730684389 S Bo:2:010:4 -115 373 = 00000006 00000175 0001f27e 00000159 0000014f 50100200 00000000 00000155
ffff8800368f2540 1730684439 C Bo:2:010:4 0 373 >
ffff88004b2b5540 1730686226 C Bi:2:010:5 0 32 = 00000006 00000020 f27e0001 0000014f 000002b2 5b100200 1967a6bd 00000144
ffff88005bb6a480 1730686269 S Bi:2:010:5 -115 16384 <
ffff88005bb6a480 1730686564 C Bi:2:010:5 0 352 = 00000006 00000160 f27e0001 00000153 000002b2 5b100200 1967a6bd 3c3f786d
ffff88005bb6a480 1730686609 S Bi:2:010:5 -115 16384 <
ffff8800368f2f00 1730687174 S Bo:2:010:4 -115 28 = 00000006 0000001c 0001f27e 000002b2 00000297 50040200 00000000
ffff8800368f2f00 1730687213 C Bo:2:010:4 0 28 >
ffff88005bb6a480 1730689538 C Bi:2:010:5 0 32 = 00000006 00000020 f27e0002 00000001 0000011c 5b100200 1967a6bd 00000129
ffff88007b578a80 1730689626 S Bi:2:010:5 -115 16384 <
ffff88007b578a80 1730689936 C Bi:2:010:5 0 325 = 00000006 00000145 f27e0002 00000005 0000011c 5b100200 1967a6bd 3c3f786d
ffff88007b578a80 1730690113 S Bi:2:010:5 -115 16384 <
ffff88007b578000 1730691409 S Bo:2:010:4 -115 4618 = 00000006 0000120a 0002f27e 0000011c 0000012e 50100200 00000000 000011ea
ffff88007b578000 1730691534 C Bo:2:010:4 0 4618 >
ffff88007b578a80 1730694539 C Bi:2:010:5 0 32 = 00000006 00000020 f27e0002 0000012e 0000130a 5b100200 1967a6bd 000000ef
ffff88007ae699c0 1730694614 S Bi:2:010:5 -115 16384 <
ffff88007ae699c0 1730694932 C Bi:2:010:5 0 267 = 00000006 0000010b f27e0002 00000132 0000130a 5b100200 1967a6bd 3c3f786d
ffff88007ae699c0 1730695023 S Bi:2:010:5 -115 16384 <
ffff88007ae69240 1730695324 S Bo:2:010:4 -115 466 = 00000006 000001d2 0002f27e 0000130a 00000221 50100200 00000000 000001b2
ffff88007ae69240 1730695371 C Bo:2:010:4 0 466 >
ffff88007ae699c0 1730697683 C Bi:2:010:5 0 32 = 00000006 00000020 f27e0002 00000221 000014c0 5b100200 1967a6bd 00000162
ffff880079188240 1730697725 S Bi:2:010:5 -115 16384 <
ffff880079188240 1730698101 C Bi:2:010:5 0 382 = 00000006 0000017e f27e0002 00000225 000014c0 5b100200 1967a6bd 3c3f786d
ffff880079188240 1730698139 S Bi:2:010:5 -115 16384 <
ffff880079188300 1730702768 S Bo:2:010:4 -115 82 = 00000006 00000052 0002f27e 000014c0 00000387 50100200 00000000 16030000
ffff880079188300 1730702803 C Bo:2:010:4 0 82 >
ffff880079188240 1730763273 C Bi:2:010:5 0 107 = 00000006 0000006b f27e0002 00000387 000014f6 5b100200 1967a6bd 16030000
ffff8800530f8000 1730763377 S Bi:2:010:5 -115 16384 <
ffff8800530f80c0 1730763399 S Bo:2:010:4 -115 28 = 00000006 0000001c 0002f27e 000014f6 000003d6 50100200 00000000
ffff8800530f80c0 1730763413 C Bo:2:010:4 0 28 >
ffff8800530f8000 1730763983 C Bi:2:010:5 0 614 = 00000006 00000266 f27e0002 000003d6 000014f6 5b100200 1967a6bd 16030002
ffff8800530f8000 1730764030 S Bi:2:010:5 -115 16384 <
ffff8800530f8000 1730764280 C Bi:2:010:5 0 42 = 00000006 0000002a f27e0002 00000620 000014f6 5b100200 1967a6bd 16030000
ffff8800530f8000 1730764300 S Bi:2:010:5 -115 16384 <
ffff8800530f8000 1730764643 C Bi:2:010:5 0 37 = 00000006 00000025 f27e0002 0000062e 000014f6 5b100200 1967a6bd 16030000
ffff8800530f8000 1730764685 S Bi:2:010:5 -115 16384 <
ffff8800530f80c0 1730769358 S Bo:2:010:4 -115 1194 = 00000006 000004aa 0002f27e 000014f6 00000637 50100200 00000000 16030002
ffff8800530f80c0 1730769430 C Bo:2:010:4 0 1194 >
ffff8800530f8000 1730818945 C Bi:2:010:5 0 34 = 00000006 00000022 f27e0002 00000637 00001984 5b100200 1967a6bd 14030000
ffff8800530f8000 1730819657 S Bi:2:010:5 -115 16384 <
ffff8800530f8000 1730819689 C Bi:2:010:5 0 97 = 00000006 00000061 f27e0002 0000063d 00001984 5b100200 1967a6bd 16030000
ffff8800530f8000 1730819702 S Bi:2:010:5 -115 16384 <
ffff8800530f80c0 1730819724 S Bo:2:010:4 -115 28 = 00000006 0000001c 0002f27e 00001984 00000682 50100200 00000000
ffff8800530f80c0 1730819764 C Bo:2:010:4 0 28 >
ffff8800530f80c0 1730820557 S Bo:2:010:4 -115 486 = 00000006 000001e6 0002f27e 00001984 00000682 50100200 00000000 17030000
ffff8800530f80c0 1730820654 C Bo:2:010:4 0 486 >
ffff8800530f8000 1730825783 C Bi:2:010:5 0 65 = 00000006 00000041 f27e0002 00000682 00001b4e 58100200 a84cb7f2 17030000
ffff8800530f8000 1730825864 S Bi:2:010:5 -115 16384 <
ffff8800530f8000 1730826802 C Bi:2:010:5 0 449 = 00000006 000001c1 f27e0002 000006a7 00001b4e 58100200 a84cb7f2 17030001
ffff8800530f8000 1730826859 S Bi:2:010:5 -115 16384 <
ffff8800530f80c0 1730827126 S Bo:2:010:4 -115 438 = 00000006 000001b6 0002f27e 00001b4e 0000084c 50100200 00000000 17030000
ffff8800530f80c0 1730827172 C Bo:2:010:4 0 438 >
ffff8800530f8000 1730841998 C Bi:2:010:5 0 65 = 00000006 00000041 f27e0002 0000084c 00001ce8 58100200 a84cb7f2 17030000
ffff8800530f8000 1730842057 S Bi:2:010:5 -115 16384 <
ffff8800530f8000 1730842627 C Bi:2:010:5 0 625 = 00000006 00000271 f27e0002 00000871 00001ce8 58100200 a84cb7f2 17030002
ffff8800530f8000 1730842662 S Bi:2:010:5 -115 16384 <
ffff8800530f80c0 1730843137 S Bo:2:010:4 -115 454 = 00000006 000001c6 0002f27e 00001ce8 00000ac6 50100200 00000000 17030000
ffff8800530f80c0 1730843174 C Bo:2:010:4 0 454 >
ffff8800530f8000 1730847194 C Bi:2:010:5 0 65 = 00000006 00000041 f27e0002 00000ac6 00001e92 58100200 a84cb7f2 17030000
ffff8800530f8000 1730853239 S Bi:2:010:5 -115 16384 <
ffff8800530f8000 1730853276 C Bi:2:010:5 0 305 = 00000006 00000131 f27e0002 00000aeb 00001e92 58100200 a84cb7f2 17030001
ffff8800530f8000 1730853293 S Bi:2:010:5 -115 16384 <
ffff8800530f80c0 1730853531 S Bo:2:010:4 -115 65 = 00000006 00000041 0002f27e 00001e92 00000c00 50100200 00000000 15030000
ffff8800530f80c0 1730853559 C Bo:2:010:4 0 65 >
ffff8800530f8000 1730855581 C Bi:2:010:5 0 65 = 00000006 00000041 f27e0002 00000c00 00001eb7 58100200 a84cb7f2 15030000
ffff880036a4d9c0 1730855692 S Bi:2:010:5 -115 16384 <
ffff880036a4d480 1730856006 S Bo:2:010:4 -115 28 = 00000006 0000001c 0002f27e 00001eb7 00000c25 50040200 00000000
ffff880036a4d480 1730856024 C Bo:2:010:4 0 28 >
ffff880036a4d480 1730856070 S Bo:2:010:4 -115 28 = 00000006 0000001c 0003f27e 00000000 00000000 50020200 00000000
ffff880036a4d480 1730856330 C Bo:2:010:4 0 28 >
ffff880036a4d9c0 1730858750 C Bi:2:010:5 0 28 = 00000006 0000001c f27e0003 00000000 00000001 5d120200 40060000
ffff880036a4d9c0 1730858820 S Bo:2:010:4 -115 28 = 00000006 0000001c 0003f27e 00000001 00000001 50100200 00000000
ffff880036a4d480 1730858834 S Bi:2:010:5 -115 16384 <
ffff880036a4d9c0 1730858835 C Bo:2:010:4 0 28 >
ffff880036a4d9c0 1730858944 S Bo:2:010:4 -115 311 = 00000006 00000137 0003f27e 00000001 00000001 50100200 00000000 00000117
ffff880036a4d9c0 1730859163 C Bo:2:010:4 0 311 >
ffff880036a4d480 1730864107 C Bi:2:010:5 0 32 = 00000006 00000020 f27e0003 00000001 0000011c 58100200 a84cb7f2 00000129
ffff880036a4d480 1730864180 S Bi:2:010:5 -115 16384 <
ffff880036a4d480 1730864488 C Bi:2:010:5 0 325 = 00000006 00000145 f27e0003 00000005 0000011c 58100200 a84cb7f2 3c3f786d
ffff880036a4d480 1730864557 S Bi:2:010:5 -115 16384 <
ffff880036a4d9c0 1730865514 S Bo:2:010:4 -115 4618 = 00000006 0000120a 0003f27e 0000011c 0000012e 50100200 00000000 000011ea
ffff880036a4d9c0 1730865631 C Bo:2:010:4 0 4618 >
ffff880036a4d480 1730868603 C Bi:2:010:5 0 32 = 00000006 00000020 f27e0003 0000012e 0000130a 58100200 a84cb7f2 000000ef
ffff880036a4d480 1730868672 S Bi:2:010:5 -115 16384 <
ffff880036a4d480 1730869028 C Bi:2:010:5 0 267 = 00000006 0000010b f27e0003 00000132 0000130a 58100200 a84cb7f2 3c3f786d
ffff880036a4d480 1730869079 S Bi:2:010:5 -115 16384 <
ffff880036a4d9c0 1730869209 S Bo:2:010:4 -115 466 = 00000006 000001d2 0003f27e 0000130a 00000221 50100200 00000000 000001b2
ffff880036a4d9c0 1730869230 C Bo:2:010:4 0 466 >
ffff880036a4d480 1730871373 C Bi:2:010:5 0 32 = 00000006 00000020 f27e0003 00000221 000014c0 58100200 a84cb7f2 00000162
ffff880036a4d480 1730871424 S Bi:2:010:5 -115 16384 <
ffff880036a4d480 1730871754 C Bi:2:010:5 0 382 = 00000006 0000017e f27e0003 00000225 000014c0 58100200 a84cb7f2 3c3f786d
ffff880036a4d480 1730871805 S Bi:2:010:5 -115 16384 <
ffff880036a4d9c0 1730873397 S Bo:2:010:4 -115 82 = 00000006 00000052 0003f27e 000014c0 00000387 50100200 00000000 16030000
ffff880036a4d9c0 1730873411 C Bo:2:010:4 0 82 >
ffff880036a4d480 1730881228 C Bi:2:010:5 0 107 = 00000006 0000006b f27e0003 00000387 000014f6 58100200 a84cb7f2 16030000
ffff880036a4d480 1730881283 S Bi:2:010:5 -115 16384 <
ffff880036a4d480 1730881660 C Bi:2:010:5 0 614 = 00000006 00000266 f27e0003 000003d6 000014f6 58100200 a84cb7f2 16030002
ffff880036a4d480 1730881712 S Bi:2:010:5 -115 16384 <
ffff880036a4d480 1730882044 C Bi:2:010:5 0 42 = 00000006 0000002a f27e0003 00000620 000014f6 58100200 a84cb7f2 16030000
ffff880036a4d480 1730882095 S Bi:2:010:5 -115 16384 <
ffff880036a4d480 1730882396 C Bi:2:010:5 0 37 = 00000006 00000025 f27e0003 0000062e 000014f6 58100200 a84cb7f2 16030000
ffff880036a4d480 1730882447 S Bi:2:010:5 -115 16384 <
ffff880036a4d9c0 1730885978 S Bo:2:010:4 -115 715 = 00000006 000002cb 0003f27e 000014f6 00000637 50100200 00000000 16030002
ffff880036a4d9c0 1730886008 C Bo:2:010:4 0 715 >
ffff880036a4d9c0 1730886022 S Bo:2:010:4 -115 165 = 00000006 000000a5 0003f27e 000017a5 00000637 50100200 00000000 16030000
ffff880036a4df00 1730886042 S Bo:2:010:4 -115 295 = 00000006 00000127 0003f27e 0000182e 00000637 50100200 00000000 16030001
ffff880036a4d780 1730886061 S Bo:2:010:4 -115 34 = 00000006 00000022 0003f27e 00001939 00000637 50100200 00000000 14030000
ffff880036a4d000 1730886251 S Bo:2:010:4 -115 97 = 00000006 00000061 0003f27e 0000193f 00000637 50100200 00000000 16030000
ffff880036a4d9c0 1730886551 C Bo:2:010:4 0 165 >
ffff880036a4df00 1730887383 C Bo:2:010:4 0 295 >
ffff880036a4d780 1730887953 C Bo:2:010:4 0 34 >
ffff880036a4d000 1730888480 C Bo:2:010:4 0 97 >
ffff880036a4d480 1730936245 C Bi:2:010:5 0 34 = 00000006 00000022 f27e0003 00000637 00001984 58100200 a84cb7f2 14030000
ffff880036a4d480 1730936367 S Bi:2:010:5 -115 16384 <
ffff880036a4d780 1730936404 S Bo:2:010:4 -115 28 = 00000006 0000001c 0003f27e 00001984 0000063d 50100200 00000000
ffff880036a4d780 1730936424 C Bo:2:010:4 0 28 >
ffff880036a4d480 1730936931 C Bi:2:010:5 0 97 = 00000006 00000061 f27e0003 0000063d 00001984 58100200 a84cb7f2 16030000
ffff880036a4d480 1730937029 S Bi:2:010:5 -115 16384 <
ffff880036a4d780 1730937382 S Bo:2:010:4 -115 65 = 00000006 00000041 0003f27e 00001984 00000682 50100200 00000000 17030000
ffff880036a4d780 1730937408 C Bo:2:010:4 0 65 >
ffff880036a4d780 1730937528 S Bo:2:010:4 -115 401 = 00000006 00000191 0003f27e 000019a9 00000682 50100200 00000000 17030001
ffff880036a4d780 1730938072 C Bo:2:010:4 0 401 >
ffff880036a4d480 1730953039 C Bi:2:010:5 0 65 = 00000006 00000041 f27e0003 00000682 00001b1e 58100200 a84cb7f2 17030000
ffff880036a4d480 1730953164 S Bi:2:010:5 -115 16384 <
ffff880036a4d480 1730953619 C Bi:2:010:5 0 625 = 00000006 00000271 f27e0003 000006a7 00001b1e 58100200 a84cb7f2 17030002
ffff880036a4d480 1730953702 S Bi:2:010:5 -115 16384 <
ffff880036a4d780 1730953982 S Bo:2:010:4 -115 65 = 00000006 00000041 0003f27e 00001b1e 000008fc 50100200 00000000 17030000
ffff880036a4d780 1730953999 C Bo:2:010:4 0 65 >
ffff880036a4d780 1730954050 S Bo:2:010:4 -115 417 = 00000006 000001a1 0003f27e 00001b43 000008fc 50100200 00000000 17030001
ffff880036a4d780 1730954183 C Bo:2:010:4 0 417 >
ffff880036a4d480 1730956162 C Bi:2:010:5 0 65 = 00000006 00000041 f27e0003 000008fc 00001cc8 58100200 a84cb7f2 17030000
ffff880036a4d480 1730956279 S Bi:2:010:5 -115 16384 <
ffff880036a4d480 1730956661 C Bi:2:010:5 0 305 = 00000006 00000131 f27e0003 00000921 00001cc8 58100200 a84cb7f2 17030001
ffff880036a4d480 1730956741 S Bi:2:010:5 -115 16384 <
ffff880036a4d780 1730956898 S Bo:2:010:4 -115 65 = 00000006 00000041 0003f27e 00001cc8 00000a36 50100200 00000000 15030000
ffff880036a4d780 1730956944 C Bo:2:010:4 0 65 >
ffff880036a4d480 1730959410 C Bi:2:010:5 0 65 = 00000006 00000041 f27e0003 00000a36 00001ced 58100200 a84cb7f2 15030000
ffff880036a4d480 1730959466 S Bi:2:010:5 -115 16384 <
ffff880036a4d780 1730960426 S Bo:2:010:4 -115 28 = 00000006 0000001c 0003f27e 00001ced 00000a5b 50040200 00000000
ffff880036a4d780 1730960470 C Bo:2:010:4 0 28 >
ffff88005b81d480 1731107414 S Ci:2:010:0 s c0 45 0000 0002 0040 64 <
ffff88005b81d480 1731107910 C Ci:2:010:0 0 1 = 03
ffff880036a4d540 1731688468 S Bo:2:010:4 -115 28 = 00000006 0000001c 0004f27e 00000000 00000000 50020200 00000000
ffff880036a4d540 1731688527 C Bo:2:010:4 0 28 >
ffff880036a4d480 1731690819 C Bi:2:010:5 0 28 = 00000006 0000001c f27e0004 00000000 00000001 5e120200 40060000
ffff880036a4d480 1731690922 S Bo:2:010:4 -115 28 = 00000006 0000001c 0004f27e 00000001 00000001 50100200 00000000
ffff880036a4d540 1731690950 S Bi:2:010:5 -115 16384 <
ffff880036a4d480 1731690984 C Bo:2:010:4 0 28 >
ffff880036a4d480 1731691085 S Bo:2:010:4 -115 328 = 00000006 00000148 0004f27e 00000001 00000001 50100200 00000000 00000128
ffff880036a4d480 1731691372 C Bo:2:010:4 0 328 >
ffff880036a4d540 1731696634 C Bi:2:010:5 0 32 = 00000006 00000020 f27e0004 00000001 0000012d 58100200 a84cb7f2 00000129
ffff880036a4d540 1731696730 S Bi:2:010:5 -115 16384 <
ffff880036a4d540 1731697349 C Bi:2:010:5 0 325 = 00000006 00000145 f27e0004 00000005 0000012d 58100200 a84cb7f2 3c3f786d
ffff880036a4d540 1731697460 S Bi:2:010:5 -115 16384 <
ffff880036a4d480 1731698108 S Bo:2:010:4 -115 4635 = 00000006 0000121b 0004f27e 0000012d 0000012e 50100200 00000000 000011fb
ffff880036a4d480 1731698278 C Bo:2:010:4 0 4635 >
ffff880036a4d540 1731701725 C Bi:2:010:5 0 32 = 00000006 00000020 f27e0004 0000012e 0000132c 58100200 a84cb7f2 000000ef
ffff880036a4d540 1731701845 S Bi:2:010:5 -115 16384 <
ffff880036a4d540 1731702081 C Bi:2:010:5 0 267 = 00000006 0000010b f27e0004 00000132 0000132c 58100200 a84cb7f2 3c3f786d
ffff880036a4d540 1731702192 S Bi:2:010:5 -115 16384 <
ffff880036a4d480 1731702344 S Bo:2:010:4 -115 483 = 00000006 000001e3 0004f27e 0000132c 00000221 50100200 00000000 000001c3
ffff880036a4d480 1731702410 C Bo:2:010:4 0 483 >
ffff880036a4d540 1731704637 C Bi:2:010:5 0 32 = 00000006 00000020 f27e0004 00000221 000014f3 58100200 a84cb7f2 00000162
ffff880036a4d540 1731704724 S Bi:2:010:5 -115 16384 <
ffff880036a4d540 1731704980 C Bi:2:010:5 0 382 = 00000006 0000017e f27e0004 00000225 000014f3 58100200 a84cb7f2 3c3f786d
ffff880036a4d540 1731705090 S Bi:2:010:5 -115 16384 <
ffff880036a4d480 1731708753 S Bo:2:010:4 -115 82 = 00000006 00000052 0004f27e 000014f3 00000387 50100200 00000000 16030000
ffff880036a4d480 1731708843 C Bo:2:010:4 0 82 >
ffff880036a4d540 1731714774 C Bi:2:010:5 0 107 = 00000006 0000006b f27e0004 00000387 00001529 58100200 a84cb7f2 16030000
ffff880036a4d540 1731714880 S Bi:2:010:5 -115 16384 <
ffff880036a4d540 1731715212 C Bi:2:010:5 0 614 = 00000006 00000266 f27e0004 000003d6 00001529 58100200 a84cb7f2 16030002
ffff880036a4d540 1731715298 S Bi:2:010:5 -115 16384 <
ffff880036a4d540 1731715579 C Bi:2:010:5 0 42 = 00000006 0000002a f27e0004 00000620 00001529 58100200 a84cb7f2 16030000
ffff880036a4d540 1731715662 S Bi:2:010:5 -115 16384 <
ffff880036a4d540 1731715916 C Bi:2:010:5 0 37 = 00000006 00000025 f27e0004 0000062e 00001529 58100200 a84cb7f2 16030000
ffff880036a4d540 1731715998 S Bi:2:010:5 -115 16384 <
ffff880036a4d480 1731720773 S Bo:2:010:4 -115 715 = 00000006 000002cb 0004f27e 00001529 00000637 50100200 00000000 16030002
ffff880036a4dc00 1731720814 S Bo:2:010:4 -115 165 = 00000006 000000a5 0004f27e 000017d8 00000637 50100200 00000000 16030000
ffff880036a4da80 1731720833 S Bo:2:010:4 -115 295 = 00000006 00000127 0004f27e 00001861 00000637 50100200 00000000 16030001
ffff880036a4d480 1731720841 C Bo:2:010:4 0 715 >
ffff880036a4d480 1731720883 S Bo:2:010:4 -115 34 = 00000006 00000022 0004f27e 0000196c 00000637 50100200 00000000 14030000
ffff880036a4dd80 1731721268 S Bo:2:010:4 -115 97 = 00000006 00000061 0004f27e 00001972 00000637 50100200 00000000 16030000
ffff880036a4dc00 1731721375 C Bo:2:010:4 0 165 >
ffff880036a4da80 1731722281 C Bo:2:010:4 0 295 >
ffff880036a4d480 1731722765 C Bo:2:010:4 0 34 >
ffff880036a4dd80 1731723348 C Bo:2:010:4 0 97 >
ffff880036a4d540 1731772399 C Bi:2:010:5 0 34 = 00000006 00000022 f27e0004 00000637 000019b7 58100200 a84cb7f2 14030000
ffff88007ba0d180 1731772490 S Bi:2:010:5 -115 16384 <
ffff88007ba0d780 1731772519 S Bo:2:010:4 -115 28 = 00000006 0000001c 0004f27e 000019b7 0000063d 50100200 00000000
ffff88007ba0d780 1731772553 C Bo:2:010:4 0 28 >
ffff88007ba0d180 1731773074 C Bi:2:010:5 0 97 = 00000006 00000061 f27e0004 0000063d 000019b7 58100200 a84cb7f2 16030000
ffff88007ba0d180 1731773124 S Bi:2:010:5 -115 16384 <
ffff88007ba0d780 1731773529 S Bo:2:010:4 -115 438 = 00000006 000001b6 0004f27e 000019b7 00000682 50100200 00000000 17030000
ffff88007ba0d780 1731773624 C Bo:2:010:4 0 438 >
ffff88007ba0d180 1731777400 C Bi:2:010:5 0 65 = 00000006 00000041 f27e0004 00000682 00001b51 58100200 a84cb7f2 17030000
ffff88007ba0d180 1731777457 S Bi:2:010:5 -115 16384 <
ffff88007ba0d180 1731778338 C Bi:2:010:5 0 385 = 00000006 00000181 f27e0004 000006a7 00001b51 58100200 a84cb7f2 17030001
ffff88007b47d6c0 1731778433 S Bi:2:010:5 -115 16384 <
ffff88007b47d300 1731778974 S Bo:2:010:4 -115 470 = 00000006 000001d6 0004f27e 00001b51 0000080c 50100200 00000000 17030000
ffff88007b47d300 1731779048 C Bo:2:010:4 0 470 >
ffff88007b47d6c0 1731826298 C Bi:2:010:5 0 65 = 00000006 00000041 f27e0004 0000080c 00001d0b 58100200 a84cb7f2 17030000
ffff88005b9336c0 1731826376 S Bi:2:010:5 -115 16384 <
ffff88005b933000 1731826405 S Bo:2:010:4 -115 28 = 00000006 0000001c 0004f27e 00001d0b 00000831 50100200 00000000
ffff88005b933000 1731826422 C Bo:2:010:4 0 28 >
ffff88005b9336c0 1731827225 C Bi:2:010:5 0 417 = 00000006 000001a1 f27e0004 00000831 00001d0b 58100200 a84cb7f2 17030001
ffff88007ae696c0 1731827288 S Bi:2:010:5 -115 16384 <
ffff88007ae69300 1731827504 S Bo:2:010:4 -115 438 = 00000006 000001b6 0004f27e 00001d0b 000009b6 50100200 00000000 17030000
ffff88007ae69300 1731827531 C Bo:2:010:4 0 438 >
ffff88007ae696c0 1731829454 C Bi:2:010:5 0 65 = 00000006 00000041 f27e0004 000009b6 00001ea5 58100200 a84cb7f2 17030000
ffff88005b8dc780 1731829494 S Bi:2:010:5 -115 16384 <
ffff88005b8dc780 1731830246 C Bi:2:010:5 0 385 = 00000006 00000181 f27e0004 000009db 00001ea5 58100200 a84cb7f2 17030001
ffff88007b42c180 1731830266 S Bi:2:010:5 -115 16384 <
ffff88007b42ccc0 1731830441 S Bo:2:010:4 -115 438 = 00000006 000001b6 0004f27e 00001ea5 00000b40 50100200 00000000 17030000
ffff88007b42ccc0 1731830469 C Bo:2:010:4 0 438 >
ffff88007b42c180 1731832272 C Bi:2:010:5 0 65 = 00000006 00000041 f27e0004 00000b40 0000203f 58100200 a84cb7f2 17030000
ffff88007a14ec00 1731832302 S Bi:2:010:5 -115 16384 <
ffff88007a14ec00 1731832753 C Bi:2:010:5 0 385 = 00000006 00000181 f27e0004 00000b65 0000203f 58100200 a84cb7f2 17030001
ffff88007a14ec00 1731832778 S Bi:2:010:5 -115 16384 <
ffff88007a14ecc0 1731832949 S Bo:2:010:4 -115 470 = 00000006 000001d6 0004f27e 0000203f 00000cca 50100200 00000000 17030000
ffff88007a14ecc0 1731832980 C Bo:2:010:4 0 470 >
ffff88007a14ec00 1731835039 C Bi:2:010:5 0 65 = 00000006 00000041 f27e0004 00000cca 000021f9 58100200 a84cb7f2 17030000
ffff88007a14ec00 1731835074 S Bi:2:010:5 -115 16384 <
ffff88007a14ec00 1731835544 C Bi:2:010:5 0 305 = 00000006 00000131 f27e0004 00000cef 000021f9 58100200 a84cb7f2 17030001
ffff88007a14ec00 1731835564 S Bi:2:010:5 -115 16384 <
ffff88007a14e300 1731835660 S Bo:2:010:4 -115 65 = 00000006 00000041 0004f27e 000021f9 00000e04 50100200 00000000 15030000
ffff88007a14e300 1731835698 C Bo:2:010:4 0 65 >
ffff88007a14ec00 1731837162 C Bi:2:010:5 0 65 = 00000006 00000041 f27e0004 00000e04 0000221e 58100200 a84cb7f2 15030000
ffff88007a14ec00 1731837210 S Bi:2:010:5 -115 16384 <
ffff880036a6fe40 1731839535 S Bo:2:010:4 -115 28 = 00000006 0000001c 0004f27e 0000221e 00000e29 50040200 00000000
ffff880036a6fe40 1731839564 C Bo:2:010:4 0 28 >
ffff8800531a2840 1732103417 S Ci:2:010:0 s c0 45 0000 0002 0040 64 <
ffff8800531a2840 1732103919 C Ci:2:010:0 0 1 = 03
ffff8800530f4240 1733103414 S Ci:2:010:0 s c0 45 0000 0002 0040 64 <
ffff8800530f4240 1733103894 C Ci:2:010:0 0 1 = 03
ffff8800531f0d80 1734103350 S Ci:2:010:0 s c0 45 0000 0002 0040 64 <
ffff8800531f0d80 1734103812 C Ci:2:010:0 0 1 = 03
ffff88004b088180 1735103451 S Ci:2:010:0 s c0 45 0000 0002 0040 64 <
ffff88004b088180 1735103995 C Ci:2:010:0 0 1 = 03
ffff880078781240 1736103415 S Ci:2:010:0 s c0 45 0000 0002 0040 64 <
ffff880078781240 1736103971 C Ci:2:010:0 0 1 = 03
ffff8800796e7b40 1737103456 S Ci:2:010:0 s c0 45 0000 0002 0040 64 <
ffff8800796e7b40 1737103946 C Ci:2:010:0 0 1 = 03
ffff88007b484240 1738103393 S Ci:2:010:0 s c0 45 0000 0002 0040 64 <
ffff88007b484240 1738103897 C Ci:2:010:0 0 1 = 03
ffff88005308a180 1739106611 S Ci:2:010:0 s c0 45 0000 0002 0040 64 <
ffff88005308a180 1739107319 C Ci:2:010:0 0 1 = 03
ffff88003669ed80 1740103423 S Ci:2:010:0 s c0 45 0000 0002 0040 64 <
ffff88003669ed80 1740103929 C Ci:2:010:0 0 1 = 03
ffff88007a5a5b40 1741113283 S Ci:2:010:0 s c0 45 0000 0002 0040 64 <
ffff88007a5a5b40 1741113811 C Ci:2:010:0 0 1 = 03
ffff880078a73600 1742103469 S Ci:2:010:0 s c0 45 0000 0002 0040 64 <
ffff880078a73600 1742103975 C Ci:2:010:0 0 1 = 03
ffff88003658d600 1743103368 S Ci:2:010:0 s c0 45 0000 0002 0040 64 <
ffff88003658d600 1743103867 C Ci:2:010:0 0 1 = 03
ffff88007b3156c0 1744103371 S Ci:2:010:0 s c0 45 0000 0002 0040 64 <
ffff88007b3156c0 1744103845 C Ci:2:010:0 0 1 = 03
ffff88007b315300 1745103424 S Ci:2:010:0 s c0 45 0000 0002 0040 64 <
ffff88007b315300 1745103925 C Ci:2:010:0 0 1 = 03
ffff88007b315300 1746103441 S Ci:2:010:0 s c0 45 0000 0002 0040 64 <
ffff88007b315300 1746103928 C Ci:2:010:0 0 1 = 03
ffff88007b315900 1747103355 S Ci:2:010:0 s c0 45 0000 0002 0040 64 <
ffff88007b315900 1747103846 C Ci:2:010:0 0 1 = 03
ffff88007b315900 1748103448 S Ci:2:010:0 s c0 45 0000 0002 0040 64 <
ffff88007b315900 1748103939 C Ci:2:010:0 0 1 = 03
ffff88007b315240 1749103420 S Ci:2:010:0 s c0 45 0000 0002 0040 64 <
ffff88007b315240 1749103931 C Ci:2:010:0 0 1 = 03
ffff88007b315240 1750103355 S Ci:2:010:0 s c0 45 0000 0002 0040 64 <
ffff88007b315240 1750103828 C Ci:2:010:0 0 1 = 03
ffff88007b315240 1751103425 S Ci:2:010:0 s c0 45 0000 0002 0040 64 <
ffff88007b315240 1751103934 C Ci:2:010:0 0 1 = 03
ffff88007b315240 1752103442 S Ci:2:010:0 s c0 45 0000 0002 0040 64 <
ffff88007b315240 1752103914 C Ci:2:010:0 0 1 = 03
ffff88007b315240 1753103362 S Ci:2:010:0 s c0 45 0000 0002 0040 64 <
ffff88007b315240 1753103865 C Ci:2:010:0 0 1 = 03
ffff88007b315240 1754103442 S Ci:2:010:0 s c0 45 0000 0002 0040 64 <
ffff88007b315240 1754103943 C Ci:2:010:0 0 1 = 03
ffff88007b315240 1755103436 S Ci:2:010:0 s c0 45 0000 0002 0040 64 <
ffff88007b315240 1755103929 C Ci:2:010:0 0 1 = 03
ffff88007b315240 1756103442 S Ci:2:010:0 s c0 45 0000 0002 0040 64 <
ffff88007b315240 1756103946 C Ci:2:010:0 0 1 = 03
ffff88007b315240 1757103467 S Ci:2:010:0 s c0 45 0000 0002 0040 64 <
ffff88007b315240 1757103946 C Ci:2:010:0 0 1 = 03
ffff88007b315240 1758103437 S Ci:2:010:0 s c0 45 0000 0002 0040 64 <
ffff88007b315240 1758104000 C Ci:2:010:0 0 1 = 03
ffff88007b315240 1759103398 S Ci:2:010:0 s c0 45 0000 0002 0040 64 <
ffff88007b315240 1759103874 C Ci:2:010:0 0 1 = 03
ffff88007b315240 1760103409 S Ci:2:010:0 s c0 45 0000 0002 0040 64 <
ffff88007b315240 1760103932 C Ci:2:010:0 0 1 = 03
ffff88007b315900 1761103370 S Ci:2:010:0 s c0 45 0000 0002 0040 64 <
ffff88007b315900 1761103823 C Ci:2:010:0 0 1 = 03
ffff88007b315900 1762103358 S Ci:2:010:0 s c0 45 0000 0002 0040 64 <
ffff88007b315900 1762103844 C Ci:2:010:0 0 1 = 03
ffff88007b315300 1763103439 S Ci:2:010:0 s c0 45 0000 0002 0040 64 <
ffff88007b315300 1763103914 C Ci:2:010:0 0 1 = 03
ffff88007b315300 1764103443 S Ci:2:010:0 s c0 45 0000 0002 0040 64 <
ffff88007b315300 1764103952 C Ci:2:010:0 0 1 = 03
ffff88007b3156c0 1765136649 S Ci:2:010:0 s c0 45 0000 0002 0040 64 <
ffff88007b3156c0 1765137182 C Ci:2:010:0 0 1 = 03
ffff88007b3156c0 1766103437 S Ci:2:010:0 s c0 45 0000 0002 0040 64 <
ffff88007b3156c0 1766103983 C Ci:2:010:0 0 1 = 03
ffff88007b315d80 1767103423 S Ci:2:010:0 s c0 45 0000 0002 0040 64 <
ffff88007b315d80 1767103993 C Ci:2:010:0 0 1 = 03
ffff88007b315d80 1768103530 S Ci:2:010:0 s c0 45 0000 0002 0040 64 <
ffff88007b315d80 1768104040 C Ci:2:010:0 0 1 = 03
ffff88007b315600 1769103438 S Ci:2:010:0 s c0 45 0000 0002 0040 64 <
ffff88007b315600 1769103936 C Ci:2:010:0 0 1 = 03
ffff88007b315600 1770103396 S Ci:2:010:0 s c0 45 0000 0002 0040 64 <
ffff88007b315600 1770103888 C Ci:2:010:0 0 1 = 03
ffff88007b315600 1771110198 S Ci:2:010:0 s c0 45 0000 0002 0040 64 <
ffff88007b315600 1771110764 C Ci:2:010:0 0 1 = 03
ffff88007b315600 1772103437 S Ci:2:010:0 s c0 45 0000 0002 0040 64 <
ffff88007b315600 1772103975 C Ci:2:010:0 0 1 = 03
ffff88007b315600 1773103411 S Ci:2:010:0 s c0 45 0000 0002 0040 64 <
ffff88007b315600 1773103891 C Ci:2:010:0 0 1 = 03
ffff88007b315600 1774104009 S Ci:2:010:0 s c0 45 0000 0002 0040 64 <
ffff88007b315600 1774104504 C Ci:2:010:0 0 1 = 03
ffff88007b315600 1775103394 S Ci:2:010:0 s c0 45 0000 0002 0040 64 <
ffff88007b315600 1775103885 C Ci:2:010:0 0 1 = 03
ffff88007b315600 1776103436 S Ci:2:010:0 s c0 45 0000 0002 0040 64 <
ffff88007b315600 1776103909 C Ci:2:010:0 0 1 = 03
ffff88007b315600 1777103388 S Ci:2:010:0 s c0 45 0000 0002 0040 64 <
ffff88007b315600 1777103846 C Ci:2:010:0 0 1 = 03
ffff88007c385780 1778103369 S Ci:2:010:0 s c0 45 0000 0002 0040 64 <
ffff88007c385780 1778103845 C Ci:2:010:0 0 1 = 03
ffff88007c385780 1779103458 S Ci:2:010:0 s c0 45 0000 0002 0040 64 <
ffff88007c385780 1779103935 C Ci:2:010:0 0 1 = 03
ffff88007c385780 1780103467 S Ci:2:010:0 s c0 45 0000 0002 0040 64 <
ffff88007c385780 1780104017 C Ci:2:010:0 0 1 = 03
ffff88007c385900 1781103448 S Ci:2:010:0 s c0 45 0000 0002 0040 64 <
ffff88007c385900 1781103998 C Ci:2:010:0 0 1 = 03
ffff88007c385900 1782103427 S Ci:2:010:0 s c0 45 0000 0002 0040 64 <
ffff88007c385900 1782103918 C Ci:2:010:0 0 1 = 03
ffff88007c3859c0 1783103446 S Ci:2:010:0 s c0 45 0000 0002 0040 64 <
ffff88007c3859c0 1783103977 C Ci:2:010:0 0 1 = 03
ffff88007c3859c0 1784103469 S Ci:2:010:0 s c0 45 0000 0002 0040 64 <
ffff88007c3859c0 1784103950 C Ci:2:010:0 0 1 = 03
ffff88007c3859c0 1785103441 S Ci:2:010:0 s c0 45 0000 0002 0040 64 <
ffff88007c3859c0 1785103922 C Ci:2:010:0 0 1 = 03
ffff88007c3859c0 1786103429 S Ci:2:010:0 s c0 45 0000 0002 0040 64 <
ffff88007c3859c0 1786103917 C Ci:2:010:0 0 1 = 03
ffff88007c3859c0 1787103435 S Ci:2:010:0 s c0 45 0000 0002 0040 64 <
ffff88007c3859c0 1787103943 C Ci:2:010:0 0 1 = 03
ffff88007c3859c0 1788103426 S Ci:2:010:0 s c0 45 0000 0002 0040 64 <
ffff88007c3859c0 1788103929 C Ci:2:010:0 0 1 = 03
ffff88007c3859c0 1789103432 S Ci:2:010:0 s c0 45 0000 0002 0040 64 <
ffff88007c3859c0 1789103906 C Ci:2:010:0 0 1 = 03
ffff88007c385a80 1790103435 S Ci:2:010:0 s c0 45 0000 0002 0040 64 <
ffff88007c385a80 1790103910 C Ci:2:010:0 0 1 = 03
ffff88007c385a80 1791103441 S Ci:2:010:0 s c0 45 0000 0002 0040 64 <
ffff88007c385a80 1791103925 C Ci:2:010:0 0 1 = 03
ffff88007c385c00 1791319572 S Bo:2:010:4 -115 28 = 00000006 0000001c 0005f27e 00000000 00000000 50020200 00000000
ffff88007c385c00 1791319668 C Bo:2:010:4 0 28 >
ffff88007a14ec00 1791321893 C Bi:2:010:5 0 28 = 00000006 0000001c f27e0005 00000000 00000001 56120200 40060000
ffff8800530db900 1791321932 S Bo:2:010:4 -115 28 = 00000006 0000001c 0005f27e 00000001 00000001 50100200 00000000
ffff8800530db900 1791321951 C Bo:2:010:4 0 28 >
ffff8800530db480 1791321956 S Bi:2:010:5 -115 16384 <
ffff88007c385000 1791322230 S Bo:2:010:4 -115 311 = 00000006 00000137 0005f27e 00000001 00000001 50100200 00000000 00000117
ffff88007c385000 1791322307 C Bo:2:010:4 0 311 >
ffff8800530db480 1791328155 C Bi:2:010:5 0 32 = 00000006 00000020 f27e0005 00000001 0000011c 58100200 a84cb7f2 00000129
ffff8800530db480 1791328213 S Bi:2:010:5 -115 16384 <
ffff8800530db480 1791329012 C Bi:2:010:5 0 325 = 00000006 00000145 f27e0005 00000005 0000011c 58100200 a84cb7f2 3c3f786d
ffff8800530db480 1791329067 S Bi:2:010:5 -115 16384 <
ffff88007c385540 1791330548 S Bo:2:010:4 -115 4618 = 00000006 0000120a 0005f27e 0000011c 0000012e 50100200 00000000 000011ea
ffff88007c385540 1791330738 C Bo:2:010:4 0 4618 >
ffff8800530db480 1791334091 C Bi:2:010:5 0 32 = 00000006 00000020 f27e0005 0000012e 0000130a 58100200 a84cb7f2 000000ef
ffff88007c385540 1791334200 S Bi:2:010:5 -115 16384 <
ffff88007c385540 1791334451 C Bi:2:010:5 0 267 = 00000006 0000010b f27e0005 00000132 0000130a 58100200 a84cb7f2 3c3f786d
ffff88007c385540 1791334549 S Bi:2:010:5 -115 16384 <
ffff88007c385240 1791334874 S Bo:2:010:4 -115 466 = 00000006 000001d2 0005f27e 0000130a 00000221 50100200 00000000 000001b2
ffff88007c385240 1791334943 C Bo:2:010:4 0 466 >
ffff88007c385540 1791337273 C Bi:2:010:5 0 32 = 00000006 00000020 f27e0005 00000221 000014c0 58100200 a84cb7f2 00000162
ffff88007c385540 1791337381 S Bi:2:010:5 -115 16384 <
ffff88007c385540 1791337661 C Bi:2:010:5 0 382 = 00000006 0000017e f27e0005 00000225 000014c0 58100200 a84cb7f2 3c3f786d
ffff88007c385540 1791337758 S Bi:2:010:5 -115 16384 <
ffff88007c385240 1791341356 S Bo:2:010:4 -115 82 = 00000006 00000052 0005f27e 000014c0 00000387 50100200 00000000 16030000
ffff88007c385240 1791341426 C Bo:2:010:4 0 82 >
ffff88007c385540 1791400868 C Bi:2:010:5 0 107 = 00000006 0000006b f27e0005 00000387 000014f6 58100200 a84cb7f2 16030000
ffff88007c385540 1791401000 S Bi:2:010:5 -115 16384 <
ffff88007c385240 1791401052 S Bo:2:010:4 -115 28 = 00000006 0000001c 0005f27e 000014f6 000003d6 50100200 00000000
ffff88007c385240 1791401090 C Bo:2:010:4 0 28 >
ffff88007c385540 1791401598 C Bi:2:010:5 0 614 = 00000006 00000266 f27e0005 000003d6 000014f6 58100200 a84cb7f2 16030002
ffff88007c385540 1791401707 S Bi:2:010:5 -115 16384 <
ffff88007c385540 1791401956 C Bi:2:010:5 0 42 = 00000006 0000002a f27e0005 00000620 000014f6 58100200 a84cb7f2 16030000
ffff88007c385540 1791401997 S Bi:2:010:5 -115 16384 <
ffff88007c385540 1791402278 C Bi:2:010:5 0 37 = 00000006 00000025 f27e0005 0000062e 000014f6 58100200 a84cb7f2 16030000
ffff88007c385540 1791402382 S Bi:2:010:5 -115 16384 <
ffff88007c385240 1791410557 S Bo:2:010:4 -115 715 = 00000006 000002cb 0005f27e 000014f6 00000637 50100200 00000000 16030002
ffff88007c385180 1791410597 S Bo:2:010:4 -115 165 = 00000006 000000a5 0005f27e 000017a5 00000637 50100200 00000000 16030000
ffff88007c385480 1791410616 S Bo:2:010:4 -115 295 = 00000006 00000127 0005f27e 0000182e 00000637 50100200 00000000 16030001
ffff88007c385240 1791410632 C Bo:2:010:4 0 715 >
ffff88007c385d80 1791410639 S Bo:2:010:4 -115 34 = 00000006 00000022 0005f27e 00001939 00000637 50100200 00000000 14030000
ffff88007c385240 1791411092 S Bo:2:010:4 -115 97 = 00000006 00000061 0005f27e 0000193f 00000637 50100200 00000000 16030000
ffff88007c385180 1791411166 C Bo:2:010:4 0 165 >
ffff88007c385480 1791411983 C Bo:2:010:4 0 295 >
ffff88007c385d80 1791412530 C Bo:2:010:4 0 34 >
ffff88007c385240 1791413069 C Bo:2:010:4 0 97 >
ffff88007c385540 1791461359 C Bi:2:010:5 0 34 = 00000006 00000022 f27e0005 00000637 00001984 58100200 a84cb7f2 14030000
ffff88007c385540 1791461515 S Bi:2:010:5 -115 16384 <
ffff88007c385240 1791461566 S Bo:2:010:4 -115 28 = 00000006 0000001c 0005f27e 00001984 0000063d 50100200 00000000
ffff88007c385240 1791461592 C Bo:2:010:4 0 28 >
ffff88007c385540 1791462043 C Bi:2:010:5 0 97 = 00000006 00000061 f27e0005 0000063d 00001984 58100200 a84cb7f2 16030000
ffff88007c385540 1791462181 S Bi:2:010:5 -115 16384 <
ffff88007c385240 1791462528 S Bo:2:010:4 -115 65 = 00000006 00000041 0005f27e 00001984 00000682 50100200 00000000 17030000
ffff88007c385240 1791462616 C Bo:2:010:4 0 65 >
ffff88007c385240 1791462640 S Bo:2:010:4 -115 401 = 00000006 00000191 0005f27e 000019a9 00000682 50100200 00000000 17030001
ffff88007c385240 1791463128 C Bo:2:010:4 0 401 >
ffff88007c385540 1791477959 C Bi:2:010:5 0 65 = 00000006 00000041 f27e0005 00000682 00001b1e 58100200 a84cb7f2 17030000
ffff88007c385540 1791478099 S Bi:2:010:5 -115 16384 <
ffff88007c385540 1791478538 C Bi:2:010:5 0 625 = 00000006 00000271 f27e0005 000006a7 00001b1e 58100200 a84cb7f2 17030002
ffff88007c385540 1791478614 S Bi:2:010:5 -115 16384 <
ffff88007c385240 1791480663 S Bo:2:010:4 -115 65 = 00000006 00000041 0005f27e 00001b1e 000008fc 50100200 00000000 17030000
ffff88007c385240 1791480734 C Bo:2:010:4 0 65 >
ffff88007c385d80 1791480746 S Bo:2:010:4 -115 417 = 00000006 000001a1 0005f27e 00001b43 000008fc 50100200 00000000 17030001
ffff88007c385d80 1791481243 C Bo:2:010:4 0 417 >
ffff88007c385540 1791485221 C Bi:2:010:5 0 65 = 00000006 00000041 f27e0005 000008fc 00001cc8 58100200 a84cb7f2 17030000
ffff88007c385540 1791485325 S Bi:2:010:5 -115 16384 <
ffff88007c385540 1791486128 C Bi:2:010:5 0 305 = 00000006 00000131 f27e0005 00000921 00001cc8 58100200 a84cb7f2 17030001
ffff88007c385540 1791486221 S Bi:2:010:5 -115 16384 <
ffff88007c385d80 1791486449 S Bo:2:010:4 -115 65 = 00000006 00000041 0005f27e 00001cc8 00000a36 50100200 00000000 15030000
ffff88007c385d80 1791486491 C Bo:2:010:4 0 65 >
ffff88007c385540 1791489058 C Bi:2:010:5 0 65 = 00000006 00000041 f27e0005 00000a36 00001ced 58100200 a84cb7f2 15030000
ffff88007c385540 1791489130 S Bi:2:010:5 -115 16384 <
ffff88007c385d80 1791489340 S Bo:2:010:4 -115 28 = 00000006 0000001c 0005f27e 00001ced 00000a5b 50040200 00000000
ffff88007c385d80 1791489384 C Bo:2:010:4 0 28 >
ffff88007c385d80 1792103420 S Ci:2:010:0 s c0 45 0000 0002 0040 64 <
ffff88007c385d80 1792103917 C Ci:2:010:0 0 1 = 03
ffff88007c385d80 1793103439 S Ci:2:010:0 s c0 45 0000 0002 0040 64 <
ffff88007c385d80 1793103934 C Ci:2:010:0 0 1 = 03
ffff88007c385d80 1794103434 S Ci:2:010:0 s c0 45 0000 0002 0040 64 <
ffff88007c385d80 1794103918 C Ci:2:010:0 0 1 = 03
ffff88007c385d80 1795103424 S Ci:2:010:0 s c0 45 0000 0002 0040 64 <
ffff88007c385d80 1795103911 C Ci:2:010:0 0 1 = 03
ffff88007c385d80 1796103487 S Ci:2:010:0 s c0 45 0000 0002 0040 64 <
ffff88007c385d80 1796103966 C Ci:2:010:0 0 1 = 03
ffff88007c385d80 1797103440 S Ci:2:010:0 s c0 45 0000 0002 0040 64 <
ffff88007c385d80 1797103955 C Ci:2:010:0 0 1 = 03
ffff88007c385d80 1798103473 S Ci:2:010:0 s c0 45 0000 0002 0040 64 <
ffff88007c385d80 1798104032 C Ci:2:010:0 0 1 = 03
ffff88007c385d80 1799103436 S Ci:2:010:0 s c0 45 0000 0002 0040 64 <
ffff88007c385d80 1799103930 C Ci:2:010:0 0 1 = 03
ffff88007c385d80 1800103460 S Ci:2:010:0 s c0 45 0000 0002 0040 64 <
ffff88007c385d80 1800103955 C Ci:2:010:0 0 1 = 03
ffff88007c385d80 1801103425 S Ci:2:010:0 s c0 45 0000 0002 0040 64 <
ffff88007c385d80 1801103921 C Ci:2:010:0 0 1 = 03
ffff88007c385d80 1802103456 S Ci:2:010:0 s c0 45 0000 0002 0040 64 <
ffff88007c385d80 1802103971 C Ci:2:010:0 0 1 = 03
ffff88007c385d80 1803103439 S Ci:2:010:0 s c0 45 0000 0002 0040 64 <
ffff88007c385d80 1803103940 C Ci:2:010:0 0 1 = 03
ffff88007c385d80 1804103497 S Ci:2:010:0 s c0 45 0000 0002 0040 64 <
ffff88007c385d80 1804104024 C Ci:2:010:0 0 1 = 03
ffff88007c385d80 1805103442 S Ci:2:010:0 s c0 45 0000 0002 0040 64 <
ffff88007c385d80 1805103943 C Ci:2:010:0 0 1 = 03
ffff88007c385d80 1806103405 S Ci:2:010:0 s c0 45 0000 0002 0040 64 <
ffff88007c385d80 1806103881 C Ci:2:010:0 0 1 = 03
ffff88007c385d80 1807103450 S Ci:2:010:0 s c0 45 0000 0002 0040 64 <
ffff88007c385d80 1807103936 C Ci:2:010:0 0 1 = 03
ffff88007c385d80 1808103435 S Ci:2:010:0 s c0 45 0000 0002 0040 64 <
ffff88007c385d80 1808103930 C Ci:2:010:0 0 1 = 03
ffff88007c385d80 1809103414 S Ci:2:010:0 s c0 45 0000 0002 0040 64 <
ffff88007c385d80 1809103891 C Ci:2:010:0 0 1 = 03
ffff88007c385240 1810103433 S Ci:2:010:0 s c0 45 0000 0002 0040 64 <
ffff88007c385240 1810103990 C Ci:2:010:0 0 1 = 03
ffff88007c385240 1811103415 S Ci:2:010:0 s c0 45 0000 0002 0040 64 <
ffff88007c385240 1811103898 C Ci:2:010:0 0 1 = 03
ffff88007c385480 1812103441 S Ci:2:010:0 s c0 45 0000 0002 0040 64 <
ffff88007c385480 1812103923 C Ci:2:010:0 0 1 = 03
ffff88007c385480 1813103450 S Ci:2:010:0 s c0 45 0000 0002 0040 64 <
ffff88007c385480 1813103919 C Ci:2:010:0 0 1 = 03
ffff88007c385180 1814103473 S Ci:2:010:0 s c0 45 0000 0002 0040 64 <
ffff88007c385180 1814103939 C Ci:2:010:0 0 1 = 03
ffff88007c385180 1815103444 S Ci:2:010:0 s c0 45 0000 0002 0040 64 <
ffff88007c385180 1815103921 C Ci:2:010:0 0 1 = 03
ffff88007c385180 1816103410 S Ci:2:010:0 s c0 45 0000 0002 0040 64 <
ffff88007c385180 1816103875 C Ci:2:010:0 0 1 = 03
ffff88004b0cfb40 1817103468 S Ci:2:010:0 s c0 45 0000 0002 0040 64 <
ffff88004b0cfb40 1817104008 C Ci:2:010:0 0 1 = 03
ffff88004b0cfb40 1818103438 S Ci:2:010:0 s c0 45 0000 0002 0040 64 <
ffff88004b0cfb40 1818103986 C Ci:2:010:0 0 1 = 03
ffff88004b0cfb40 1819103446 S Ci:2:010:0 s c0 45 0000 0002 0040 64 <
ffff88004b0cfb40 1819103925 C Ci:2:010:0 0 1 = 03
ffff88004b0cfb40 1820103479 S Ci:2:010:0 s c0 45 0000 0002 0040 64 <
ffff88004b0cfb40 1820103986 C Ci:2:010:0 0 1 = 03
ffff88004b0cfb40 1821103447 S Ci:2:010:0 s c0 45 0000 0002 0040 64 <
ffff88004b0cfb40 1821103946 C Ci:2:010:0 0 1 = 03
ffff88004b0cf000 1822103353 S Ci:2:010:0 s c0 45 0000 0002 0040 64 <
ffff88004b0cf000 1822103845 C Ci:2:010:0 0 1 = 03
ffff88004b0cf000 1823103491 S Ci:2:010:0 s c0 45 0000 0002 0040 64 <
ffff88004b0cf000 1823103988 C Ci:2:010:0 0 1 = 03
ffff88004b0cf000 1824103475 S Ci:2:010:0 s c0 45 0000 0002 0040 64 <
ffff88004b0cf000 1824104714 C Ci:2:010:0 0 1 = 03
ffff88004b0cf000 1825103386 S Ci:2:010:0 s c0 45 0000 0002 0040 64 <
ffff88004b0cf000 1825103923 C Ci:2:010:0 0 1 = 03
ffff88004b0cf000 1826103458 S Ci:2:010:0 s c0 45 0000 0002 0040 64 <
ffff88004b0cf000 1826103969 C Ci:2:010:0 0 1 = 03
ffff88004b0cf000 1827103512 S Ci:2:010:0 s c0 45 0000 0002 0040 64 <
ffff88004b0cf000 1827104027 C Ci:2:010:0 0 1 = 03
ffff88004b0cf000 1828103406 S Ci:2:010:0 s c0 45 0000 0002 0040 64 <
ffff88004b0cf000 1828103888 C Ci:2:010:0 0 1 = 03
ffff88007c385540 1829100032 C Bi:2:010:5 -71 0
ffff88005300aa80 1829100053 C Bi:2:010:6 -71 0
ffff8800786a3900 1829100287 C Ii:2:001:1 0:2048 1 = 04
ffff8800786a3900 1829100294 S Ii:2:001:1 -115:2048 4 <
ffff880036a6fa80 1829100452 S Ci:2:001:0 s a3 00 0000 0002 0004 4 <
ffff880036a6fa80 1829100498 C Ci:2:001:0 0 4 = 00010100
ffff880036a6fa80 1829100502 S Co:2:001:0 s 23 01 0010 0002 0000 0
ffff880036a6fa80 1829100507 C Co:2:001:0 0 0
ffff880036a6fc00 1829139784 S Ci:2:001:0 s a3 00 0000 0002 0004 4 <
ffff880036a6fc00 1829139817 C Ci:2:001:0 0 4 = 00010000
ffff880036a6f180 1829171366 S Ci:2:001:0 s a3 00 0000 0002 0004 4 <
ffff880036a6f180 1829171376 C Ci:2:001:0 0 4 = 00010000
ffff880036a6f180 1829207370 S Ci:2:001:0 s a3 00 0000 0002 0004 4 <
ffff880036a6f180 1829207408 C Ci:2:001:0 0 4 = 00010000
ffff880036a6f180 1829235370 S Ci:2:001:0 s a3 00 0000 0002 0004 4 <
ffff880036a6f180 1829235381 C Ci:2:001:0 0 4 = 00010000
ffff880036a6f180 1829267428 S Ci:2:001:0 s a3 00 0000 0002 0004 4 <
ffff880036a6f180 1829267482 C Ci:2:001:0 0 4 = 00010000
ffff8800786a3900 1829267503 C Ii:2:001:1 -2:2048 0
