ffff880053085a80 3449679553 S Ci:2:003:0 s 80 06 0300 0000 0004 4 <
ffff880053085a80 3449679688 C Ci:2:003:0 0 4 = 04030904
ffff880053085a80 3449679740 S Ci:2:003:0 s 80 06 0301 0409 00fe 254 <
ffff880053085a80 3449679829 C Ci:2:003:0 0 8 = 08034c00 47004500
ffff880053085000 3449679918 S Ci:2:003:0 s 80 06 0300 0000 0004 4 <
ffff880053085000 3449680004 C Ci:2:003:0 0 4 = 04030904
ffff880053085000 3449680043 S Ci:2:003:0 s 80 06 0302 0409 00fe 254 <
ffff880053085000 3449680152 C Ci:2:003:0 0 16 = 10034e00 65007800 75007300 20003500
ffff880053085000 3449680185 S Ci:2:003:0 s 80 06 0300 0000 0004 4 <
ffff880053085000 3449680252 C Ci:2:003:0 0 4 = 04030904
ffff880053085000 3449680269 S Ci:2:003:0 s 80 06 0303 0409 00fe 254 <
ffff880053085000 3449680350 C Ci:2:003:0 0 34 = 22033000 34003200 61003000 35006100 35003000 30003200 65003800 66006100
ffff880053085000 3449680382 S Ci:2:003:0 s 80 06 0300 0000 0004 4 <
ffff880053085000 3449680450 C Ci:2:003:0 0 4 = 04030904
ffff880053085000 3449680466 S Ci:2:003:0 s 80 06 0304 0409 00fe 254 <
ffff880053085000 3449680547 C Ci:2:003:0 0 8 = 08034d00 54005000
ffff880053085000 3449680573 S Ci:2:003:0 s 80 06 0600 0000 000a 10 <
ffff880053085000 3449680645 C Ci:2:003:0 0 10 = 0a060002 00000040 0100
ffff880053085000 3449680665 S Ci:2:003:0 s 80 06 0a00 0000 0004 4 <
ffff880053085000 3449680713 C Ci:2:003:0 -32 0
ffff880053085000 3449680729 S Ci:2:003:0 s 80 00 0000 0000 0002 2 <
ffff880053085000 3449680812 C Ci:2:003:0 0 2 = 0000
ffff88004b10df00 3459701043 S Bo:2:003:1 -115 16 = 10000000 01000210 00000000 01000000
ffff88004b10df00 3459701097 C Bo:2:003:1 0 16 >
ffff88004b10df00 3459701392 S Bi:2:003:1 -115 512 <
ffff88004b10df00 3459703109 C Bi:2:003:1 0 12 = 0c000000 03000120 00000000
ffff88004b0fecc0 3459703400 S Bo:2:003:1 -115 12 = 0c000000 01000110 01000000
ffff88004b0fecc0 3459703439 C Bo:2:003:1 0 12 >
ffff88004b0fecc0 3459703478 S Bi:2:003:1 -115 512 <
ffff88004b0fecc0 3459703929 C Bi:2:003:1 0 319 = 3f010000 02000110 01000000 64000600 00006400 266d0069 00630072 006f0073
ffff88004b0fecc0 3459703975 S Bi:2:003:1 -115 512 <
ffff88004b0fecc0 3459704007 C Bi:2:003:1 0 12 = 0c000000 03000120 01000000
ffff88004b0fe540 3459704065 S Bo:2:003:1 -115 20 = 14000000 01000298 02000000 04dc0000 00300000
ffff88004b0fe540 3459704103 C Bo:2:003:1 0 20 >
ffff88004b0fe540 3459704138 S Bi:2:003:1 -115 512 <
ffff88004b0fe540 3459704191 C Bi:2:003:1 0 30 = 1e000000 02000298 02000000 04dc0800 00000000 00000000 00000000 0000
ffff88004b0fe540 3459704227 S Bi:2:003:1 -115 512 <
ffff88004b0fe540 3459704276 C Bi:2:003:1 0 12 = 0c000000 03000120 02000000
ffff88004b0fe540 3459704298 S Bo:2:003:1 -115 20 = 14000000 01000298 03000000 04dc0000 01300000
ffff88004b0fe540 3459704338 C Bo:2:003:1 0 20 >
ffff88004b0fe540 3459704355 S Bi:2:003:1 -115 512 <
ffff88004b0fe540 3459704421 C Bi:2:003:1 0 30 = 1e000000 02000298 03000000 04dc0800 00000000 00000000 00000000 0000
ffff88004b0fe540 3459704439 S Bi:2:003:1 -115 512 <
ffff88004b0fe540 3459704474 C Bi:2:003:1 0 12 = 0c000000 03000120 03000000
ffff88004b0fe540 3459704494 S Bo:2:003:1 -115 20 = 14000000 01000298 04000000 04dc0000 04300000
ffff88004b0fe540 3459704533 C Bo:2:003:1 0 20 >
ffff88004b0fe540 3459704550 S Bi:2:003:1 -115 512 <
ffff88004b0fe540 3459704604 C Bi:2:003:1 0 30 = 1e000000 02000298 04000000 04dc0800 00000000 00000000 00000000 0000
ffff88004b0fe540 3459704665 S Bi:2:003:1 -115 512 <
ffff88004b0fe540 3459704698 C Bi:2:003:1 0 12 = 0c000000 03000120 04000000
ffff88004b0fe540 3459704718 S Bo:2:003:1 -115 20 = 14000000 01000298 05000000 04dc0000 05300000
ffff88004b0fe540 3459704758 C Bo:2:003:1 0 20 >
ffff88004b0fe540 3459704775 S Bi:2:003:1 -115 512 <
ffff88004b0fe540 3459704899 C Bi:2:003:1 0 30 = 1e000000 02000298 05000000 04dc0800 00000000 00000000 00000000 0000
ffff88004b0fe540 3459704916 S Bi:2:003:1 -115 512 <
ffff88004b0fe540 3459704948 C Bi:2:003:1 0 12 = 0c000000 03000120 05000000
ffff88004b0fe540 3459704960 S Bo:2:003:1 -115 20 = 14000000 01000298 06000000 04dc0000 08300000
ffff88004b0fe540 3459704998 C Bo:2:003:1 0 20 >
ffff88004b23b0c0 3459705280 S Bi:2:003:1 -115 512 <
ffff88004b23b0c0 3459705314 C Bi:2:003:1 0 30 = 1e000000 02000298 06000000 04dc0800 00000000 00000000 00000000 0000
ffff88004b23b0c0 3459705381 S Bi:2:003:1 -115 512 <
ffff88004b23b0c0 3459705399 C Bi:2:003:1 0 12 = 0c000000 03000120 06000000
ffff8800647b9f00 3459705548 S Bo:2:003:1 -115 20 = 14000000 01000298 07000000 04dc0000 09300000
ffff8800647b9f00 3459705588 C Bo:2:003:1 0 20 >
ffff8800647b9f00 3459705607 S Bi:2:003:1 -115 512 <
ffff8800647b9f00 3459705669 C Bi:2:003:1 0 30 = 1e000000 02000298 07000000 04dc0800 00000000 00000000 00000000 0000
ffff8800647b9f00 3459705687 S Bi:2:003:1 -115 512 <
ffff8800647b9f00 3459705721 C Bi:2:003:1 0 12 = 0c000000 03000120 07000000
ffff8800647b9f00 3459705740 S Bo:2:003:1 -115 20 = 14000000 01000298 08000000 04dc0000 0b300000
ffff8800647b9f00 3459705777 C Bo:2:003:1 0 20 >
ffff8800647b9f00 3459705794 S Bi:2:003:1 -115 512 <
ffff8800647b9f00 3459705871 C Bi:2:003:1 0 30 = 1e000000 02000298 08000000 04dc0800 00000000 00000000 00000000 0000
ffff8800647b9f00 3459705888 S Bi:2:003:1 -115 512 <
ffff8800647b9f00 3459705919 C Bi:2:003:1 0 12 = 0c000000 03000120 08000000
ffff8800647b9f00 3459705938 S Bo:2:003:1 -115 20 = 14000000 01000298 09000000 04dc0000 01380000
ffff8800647b9f00 3459705975 C Bo:2:003:1 0 20 >
ffff8800647b9f00 3459705992 S Bi:2:003:1 -115 512 <
ffff8800647b9f00 3459706107 C Bi:2:003:1 0 30 = 1e000000 02000298 09000000 04dc0800 00000000 00000000 00000000 0000
ffff8800647b9f00 3459706249 S Bi:2:003:1 -115 512 <
ffff8800647b9f00 3459706295 C Bi:2:003:1 0 12 = 0c000000 03000120 09000000
ffff8800647b9f00 3459706315 S Bo:2:003:1 -115 20 = 14000000 01000298 0a000000 04dc0000 02380000
ffff8800647b9f00 3459706354 C Bo:2:003:1 0 20 >
ffff8800647b9f00 3459706371 S Bi:2:003:1 -115 512 <
ffff8800647b9f00 3459706445 C Bi:2:003:1 0 30 = 1e000000 02000298 0a000000 04dc0800 00000000 00000000 00000000 0000
ffff8800647b9f00 3459706463 S Bi:2:003:1 -115 512 <
ffff8800647b9f00 3459706496 C Bi:2:003:1 0 12 = 0c000000 03000120 0a000000
ffff8800647b9f00 3459706514 S Bo:2:003:1 -115 20 = 14000000 01000298 0b000000 04dc0000 04380000
ffff8800647b9f00 3459706549 C Bo:2:003:1 0 20 >
ffff8800647b9f00 3459706566 S Bi:2:003:1 -115 512 <
ffff8800647b9f00 3459706618 C Bi:2:003:1 0 30 = 1e000000 02000298 0b000000 04dc0800 00000000 00000000 00000000 0000
ffff8800647b9f00 3459706635 S Bi:2:003:1 -115 512 <
ffff8800647b9f00 3459706669 C Bi:2:003:1 0 12 = 0c000000 03000120 0b000000
ffff8800647b9f00 3459706688 S Bo:2:003:1 -115 20 = 14000000 01000298 0c000000 04dc0000 07380000
ffff8800647b9f00 3459706726 C Bo:2:003:1 0 20 >
ffff8800647b9f00 3459706776 S Bi:2:003:1 -115 512 <
ffff8800647b9f00 3459706810 C Bi:2:003:1 0 30 = 1e000000 02000298 0c000000 04dc0800 00000000 00000000 00000000 0000
ffff8800647b9f00 3459706837 S Bi:2:003:1 -115 512 <
ffff8800647b9f00 3459706872 C Bi:2:003:1 0 12 = 0c000000 03000120 0c000000
ffff8800647b9f00 3459706909 S Bo:2:003:1 -115 20 = 14000000 01000298 0d000000 04dc0000 08380000
ffff8800647b9f00 3459706945 C Bo:2:003:1 0 20 >
ffff8800647b9f00 3459706965 S Bi:2:003:1 -115 512 <
ffff8800647b9f00 3459707087 C Bi:2:003:1 0 30 = 1e000000 02000298 0d000000 04dc0800 00000000 00000000 00000000 0000
ffff8800647b9f00 3459707105 S Bi:2:003:1 -115 512 <
ffff8800647b9f00 3459707148 C Bi:2:003:1 0 12 = 0c000000 03000120 0d000000
ffff8800647b9f00 3459707168 S Bo:2:003:1 -115 20 = 14000000 01000298 0e000000 04dc0000 0b380000
ffff8800647b9f00 3459707205 C Bo:2:003:1 0 20 >
ffff8800647b9f00 3459707222 S Bi:2:003:1 -115 512 <
ffff8800647b9f00 3459707380 C Bi:2:003:1 0 30 = 1e000000 02000298 0e000000 04dc0800 00000000 00000000 00000000 0000
ffff8800647b9f00 3459707397 S Bi:2:003:1 -115 512 <
ffff8800647b9f00 3459707433 C Bi:2:003:1 0 12 = 0c000000 03000120 0e000000
ffff8800647b9f00 3459707452 S Bo:2:003:1 -115 20 = 14000000 01000298 0f000000 04dc0000 0d380000
ffff8800647b9f00 3459707486 C Bo:2:003:1 0 20 >
ffff8800647b9f00 3459707504 S Bi:2:003:1 -115 512 <
ffff8800647b9f00 3459707631 C Bi:2:003:1 0 30 = 1e000000 02000298 0f000000 04dc0800 00000000 00000000 00000000 0000
ffff8800647b9f00 3459707648 S Bi:2:003:1 -115 512 <
ffff8800647b9f00 3459707684 C Bi:2:003:1 0 12 = 0c000000 03000120 0f000000
ffff8800647b9f00 3459707703 S Bo:2:003:1 -115 20 = 14000000 01000298 10000000 04dc0000 01b90000
ffff8800647b9f00 3459707739 C Bo:2:003:1 0 20 >
ffff8800647b9f00 3459707865 S Bi:2:003:1 -115 512 <
ffff8800647b9f00 3459707899 C Bi:2:003:1 0 30 = 1e000000 02000298 10000000 04dc0800 00000000 00000000 00000000 0000
ffff8800647b9f00 3459707918 S Bi:2:003:1 -115 512 <
ffff8800647b9f00 3459707940 C Bi:2:003:1 0 12 = 0c000000 03000120 10000000
ffff8800647b9f00 3459707959 S Bo:2:003:1 -115 20 = 14000000 01000298 11000000 04dc0000 02b90000
ffff8800647b9f00 3459707997 C Bo:2:003:1 0 20 >
ffff8800647b9f00 3459708015 S Bi:2:003:1 -115 512 <
ffff8800647b9f00 3459708068 C Bi:2:003:1 0 30 = 1e000000 02000298 11000000 04dc0800 00000000 00000000 00000000 0000
ffff8800647b9f00 3459708085 S Bi:2:003:1 -115 512 <
ffff8800647b9f00 3459708119 C Bi:2:003:1 0 12 = 0c000000 03000120 11000000
ffff8800647b9f00 3459708138 S Bo:2:003:1 -115 20 = 14000000 01000298 12000000 04dc0000 03b90000
ffff8800647b9f00 3459708175 C Bo:2:003:1 0 20 >
ffff8800647b9f00 3459708192 S Bi:2:003:1 -115 512 <
ffff8800647b9f00 3459708358 C Bi:2:003:1 0 30 = 1e000000 02000298 12000000 04dc0800 00000000 00000000 00000000 0000
ffff880053139540 3459708692 S Bi:2:003:1 -115 512 <
ffff880053139540 3459708726 C Bi:2:003:1 0 12 = 0c000000 03000120 12000000
ffff880053139540 3459708747 S Bo:2:003:1 -115 20 = 14000000 01000298 13000000 04dc0000 82b90000
ffff880053139540 3459708787 C Bo:2:003:1 0 20 >
ffff880053139540 3459708804 S Bi:2:003:1 -115 512 <
ffff880053139540 3459708919 C Bi:2:003:1 0 30 = 1e000000 02000298 13000000 04dc0800 00000000 00000000 00000000 0000
ffff880053139540 3459708937 S Bi:2:003:1 -115 512 <
ffff880053139540 3459708970 C Bi:2:003:1 0 12 = 0c000000 03000120 13000000
ffff880053139540 3459708989 S Bo:2:003:1 -115 20 = 14000000 01000298 14000000 04dc0000 83b90000
ffff880053139540 3459709028 C Bo:2:003:1 0 20 >
ffff880053139540 3459709045 S Bi:2:003:1 -115 512 <
ffff880053139540 3459710236 C Bi:2:003:1 0 30 = 1e000000 02000298 14000000 04dc0800 00000000 00000000 00000000 0000
ffff88007ba0dc00 3459710255 S Bi:2:003:1 -115 512 <
ffff88007ba0dc00 3459710295 C Bi:2:003:1 0 12 = 0c000000 03000120 14000000
ffff88007ba0dc00 3459710316 S Bo:2:003:1 -115 20 = 14000000 01000298 15000000 04dc0000 84b90000
ffff88007ba0dc00 3459710354 C Bo:2:003:1 0 20 >
ffff88007ba0dc00 3459710371 S Bi:2:003:1 -115 512 <
ffff88007ba0dc00 3459710445 C Bi:2:003:1 0 30 = 1e000000 02000298 15000000 04dc0800 00000000 00000000 00000000 0000
ffff8800530cb840 3459710597 S Bi:2:003:1 -115 512 <
ffff8800530cb840 3459710638 C Bi:2:003:1 0 12 = 0c000000 03000120 15000000
ffff8800530cb840 3459710658 S Bo:2:003:1 -115 20 = 14000000 01000298 16000000 04dc0000 05ba0000
ffff8800530cb840 3459710694 C Bo:2:003:1 0 20 >
ffff8800530cb840 3459710711 S Bi:2:003:1 -115 512 <
ffff8800530cb840 3459710774 C Bi:2:003:1 0 30 = 1e000000 02000298 16000000 04dc0800 00000000 00000000 00000000 0000
ffff8800530cb840 3459710792 S Bi:2:003:1 -115 512 <
ffff8800530cb840 3459710825 C Bi:2:003:1 0 12 = 0c000000 03000120 16000000
ffff8800530cb840 3459710844 S Bo:2:003:1 -115 20 = 14000000 01000298 17000000 04dc0000 10ba0000
ffff8800530cb840 3459710880 C Bo:2:003:1 0 20 >
ffff8800530cb840 3459710898 S Bi:2:003:1 -115 512 <
ffff8800530cb840 3459710972 C Bi:2:003:1 0 30 = 1e000000 02000298 17000000 04dc0800 00000000 00000000 00000000 0000
ffff8800530cb840 3459710990 S Bi:2:003:1 -115 512 <
ffff8800530cb840 3459711023 C Bi:2:003:1 0 12 = 0c000000 03000120 17000000
ffff8800530cb840 3459711042 S Bo:2:003:1 -115 20 = 14000000 01000298 18000000 04dc0000 11ba0000
ffff8800530cb840 3459711078 C Bo:2:003:1 0 20 >
ffff8800530cb840 3459711095 S Bi:2:003:1 -115 512 <
ffff8800530cb840 3459711212 C Bi:2:003:1 0 30 = 1e000000 02000298 18000000 04dc0800 00000000 00000000 00000000 0000
ffff88005308a540 3459711470 S Bi:2:003:1 -115 512 <
ffff88005308a540 3459711503 C Bi:2:003:1 0 12 = 0c000000 03000120 18000000
ffff88005308a540 3459711525 S Bo:2:003:1 -115 20 = 14000000 01000298 19000000 04dc0000 14ba0000
ffff88005308a540 3459711562 C Bo:2:003:1 0 20 >
ffff88005308a540 3459711580 S Bi:2:003:1 -115 512 <
ffff88005308a540 3459711675 C Bi:2:003:1 0 30 = 1e000000 02000298 19000000 04dc0800 00000000 00000000 00000000 0000
ffff88004b23bf00 3459711981 S Bi:2:003:1 -115 512 <
ffff88004b23bf00 3459712023 C Bi:2:003:1 0 12 = 0c000000 03000120 19000000
ffff88004b23bf00 3459712045 S Bo:2:003:1 -115 20 = 14000000 01000298 1a000000 04dc0000 82ba0000
ffff88004b23bf00 3459712085 C Bo:2:003:1 0 20 >
ffff88004b23bf00 3459712103 S Bi:2:003:1 -115 512 <
ffff88004b23bf00 3459712169 C Bi:2:003:1 0 30 = 1e000000 02000298 1a000000 04dc0800 00000000 00000000 00000000 0000
ffff88004b23bf00 3459712187 S Bi:2:003:1 -115 512 <
ffff88004b23bf00 3459712220 C Bi:2:003:1 0 12 = 0c000000 03000120 1a000000
ffff88004b088480 3459712514 S Bo:2:003:1 -115 20 = 14000000 01000298 1b000000 04dc0000 06b90000
ffff88004b088480 3459712550 C Bo:2:003:1 0 20 >
ffff88004b088480 3459712569 S Bi:2:003:1 -115 512 <
ffff88004b088480 3459712649 C Bi:2:003:1 0 30 = 1e000000 02000298 1b000000 04dc0800 00000000 00000000 00000000 0000
ffff88004b088480 3459712667 S Bi:2:003:1 -115 512 <
ffff88004b088480 3459712723 C Bi:2:003:1 0 12 = 0c000000 03000120 1b000000
ffff88005ba56c00 3459713010 S Bo:2:003:1 -115 16 = 10000000 01001410 1c000000 01500000
ffff88005ba56c00 3459713049 C Bo:2:003:1 0 16 >
ffff88005ba56c00 3459713068 S Bi:2:003:1 -115 512 <
ffff88005ba56c00 3459713149 C Bi:2:003:1 0 23 = 17000000 02001410 1c000000 01500200 00003a01 006401
ffff88005ba56c00 3459713167 S Bi:2:003:1 -115 512 <
ffff88005ba56c00 3459713199 C Bi:2:003:1 0 12 = 0c000000 03000120 1c000000
ffff88005ba56c00 3459713221 S Bo:2:003:1 -115 12 = 0c000000 01000410 1d000000
ffff88005ba56c00 3459713258 C Bo:2:003:1 0 12 >
ffff88005ba56c00 3459713276 S Bi:2:003:1 -115 512 <
ffff88005ba56c00 3459713419 C Bi:2:003:1 0 16 = 10000000 02000410 1d000000 00000000
ffff88005ba56c00 3459713437 S Bi:2:003:1 -115 512 <
ffff88005ba56c00 3459713470 C Bi:2:003:1 0 12 = 0c000000 03000120 1d000000
ffff88005327fd80 3459713728 S Ii:2:003:2 -115:32 24 <
ffff880053182b40 3459718413 S Bo:2:003:1 -115 16 = 10000000 01001510 1e000000 02d40000
ffff880053182b40 3459718461 C Bo:2:003:1 0 16 >
ffff88003657fcc0 3459718863 S Bi:2:003:1 -115 512 <
ffff88003657fcc0 3459725114 C Bi:2:003:1 0 13 = 0d000000 02001510 1e000000 00
ffff88004b088e40 3459725178 S Bi:2:003:1 -115 512 <
ffff88004b088e40 3459725213 C Bi:2:003:1 0 12 = 0c000000 03000120 1e000000
ffff88004b088b40 3459725322 S Bo:2:003:1 -115 12 = 0c000000 01000410 1f000000
ffff88004b088b40 3459725356 C Bo:2:003:1 0 12 >
ffff88005bbc1840 3459725690 S Bi:2:003:1 -115 512 <
ffff88005bbc1840 3459725723 C Bi:2:003:1 0 16 = 10000000 02000410 1f000000 00000000
ffff88005bbc1780 3459725767 S Bi:2:003:1 -115 512 <
ffff88005bbc1780 3459725778 C Bi:2:003:1 0 12 = 0c000000 03000120 1f000000
ffff8800533e7480 3459770126 S Bo:2:003:1 -115 16 = 10000000 01001510 20000000 02d40000
ffff8800533e7480 3459770176 C Bo:2:003:1 0 16 >
ffff8800533e73c0 3459770211 S Bi:2:003:1 -115 512 <
ffff8800533e73c0 3459770401 C Bi:2:003:1 0 13 = 0d000000 02001510 20000000 00
ffff8800533e7240 3459770460 S Bi:2:003:1 -115 512 <
ffff8800533e7240 3459770496 C Bi:2:003:1 0 12 = 0c000000 03000120 20000000
ffff8800533e7c00 3459770571 S Bo:2:003:1 -115 12 = 0c000000 01000410 21000000
ffff8800533e7c00 3459770609 C Bo:2:003:1 0 12 >
ffff8800533e7cc0 3459770661 S Bi:2:003:1 -115 512 <
ffff8800533e7cc0 3459770799 C Bi:2:003:1 0 16 = 10000000 02000410 21000000 00000000
ffff8800533e7000 3459770838 S Bi:2:003:1 -115 512 <
ffff8800533e7000 3459770873 C Bi:2:003:1 0 12 = 0c000000 03000120 21000000
ffff88005b903900 3459844823 S Bo:2:003:1 -115 16 = 10000000 01001510 22000000 02d40000
ffff88005b903900 3459844875 C Bo:2:003:1 0 16 >
ffff88005b903000 3459844969 S Bi:2:003:1 -115 512 <
ffff88005b903000 3459845109 C Bi:2:003:1 0 13 = 0d000000 02001510 22000000 00
ffff88004b0d9540 3459845194 S Bi:2:003:1 -115 512 <
ffff88004b0d9540 3459845232 C Bi:2:003:1 0 12 = 0c000000 03000120 22000000
ffff88004b0d9540 3459845321 S Bo:2:003:1 -115 12 = 0c000000 01000410 23000000
ffff88004b0d9540 3459845362 C Bo:2:003:1 0 12 >
ffff88004b0d9540 3459845419 S Bi:2:003:1 -115 512 <
ffff88004b0d9540 3459845460 C Bi:2:003:1 0 16 = 10000000 02000410 23000000 00000000
ffff88004b0d9540 3459845519 S Bi:2:003:1 -115 512 <
ffff88004b0d9540 3459845538 C Bi:2:003:1 0 12 = 0c000000 03000120 23000000
ffff88004b0d9540 3459848576 S Bo:2:003:1 -115 16 = 10000000 01001510 24000000 02d40000
ffff88004b0d9540 3459848634 C Bo:2:003:1 0 16 >
ffff88004b0d9540 3459848698 S Bi:2:003:1 -115 512 <
ffff88004b0d9540 3459848780 C Bi:2:003:1 0 13 = 0d000000 02001510 24000000 00
ffff88004b0d9540 3459848854 S Bi:2:003:1 -115 512 <
ffff88004b0d9540 3459848912 C Bi:2:003:1 0 12 = 0c000000 03000120 24000000
ffff88004b0d9540 3459849004 S Bo:2:003:1 -115 12 = 0c000000 01000410 25000000
ffff88004b0d9540 3459849048 C Bo:2:003:1 0 12 >
ffff88004b0d9540 3459849079 S Bi:2:003:1 -115 512 <
ffff88004b0d9540 3459849127 C Bi:2:003:1 0 16 = 10000000 02000410 25000000 00000000
ffff88004b0d9540 3459849199 S Bi:2:003:1 -115 512 <
ffff88004b0d9540 3459849215 C Bi:2:003:1 0 12 = 0c000000 03000120 25000000
ffff8800533f76c0 3459939654 S Bo:2:003:1 -115 12 = 0c000000 01000410 26000000
ffff8800533f76c0 3459939731 C Bo:2:003:1 0 12 >
ffff88005b927840 3459939808 S Bi:2:003:1 -115 512 <
ffff88005b927840 3459939872 C Bi:2:003:1 0 16 = 10000000 02000410 26000000 00000000
ffff88005b927840 3459939985 S Bi:2:003:1 -115 512 <
ffff88005b927840 3459940027 C Bi:2:003:1 0 12 = 0c000000 03000120 26000000
ffff88005327fd80 3614950409 C Ii:2:003:2 0:32 16 = 10000000 04000640 26000000 01500000
ffff88005309db40 3614950608 S Ii:2:003:2 -115:32 24 <
ffff88005309db40 3835104924 C Ii:2:003:2 0:32 16 = 10000000 04000440 26000000 01000100
ffff8800533b2900 3835105224 S Bo:2:003:1 -115 12 = 0c000000 01000410 27000000
ffff8800533b2900 3835105280 C Bo:2:003:1 0 12 >
ffff8800533b2900 3835105325 S Bi:2:003:1 -115 512 <
ffff8800533b2900 3835116798 C Bi:2:003:1 0 20 = 14000000 02000410 27000000 01000000 01000100
ffff8800533b2900 3835116880 S Bi:2:003:1 -115 512 <
ffff8800533b2900 3835116940 C Bi:2:003:1 0 12 = 0c000000 03000120 27000000
ffff8800533b2900 3835116998 S Bo:2:003:1 -115 16 = 10000000 01000510 28000000 01000100
ffff8800533b2900 3835117049 C Bo:2:003:1 0 16 >
ffff8800533b2900 3835117090 S Bi:2:003:1 -115 512 <
ffff8800533b2900 3835117309 C Bi:2:003:1 0 74 = 4a000000 02000510 28000000 03000200 000000f0 5a230300 00000020 51a80000
ffff8800533b2900 3835117388 S Bi:2:003:1 -115 512 <
ffff8800533b2900 3835117437 C Bi:2:003:1 0 12 = 0c000000 03000120 28000000
ffff8800533b2900 3835117601 S Ii:2:003:2 -115:32 24 <
ffff8800533b2900 3867900679 C Ii:2:003:2 0:32 16 = 10000000 04000640 28000000 01500000
ffff8800533b2900 3867900816 S Ii:2:003:2 -115:32 24 <
ffff8800533b2900 3976951965 C Ii:2:003:2 0:32 16 = 10000000 04000640 28000000 01500000
ffff8800533b2900 3976952178 S Ii:2:003:2 -115:32 24 <
