usbpro started:
===============
18d1:4ee1
Debug: bus[002], dev[003], id[18d1:4ee1]
Debug: usbmon path[/sys/kernel/debug/usb/usbmon/2u]
Debug: mon_job[]
Brief:

Debug: line_num[22], line_start[20], line_end[27]
T:  Bus=02 Lev=01 Prnt=01 Port=00 Cnt=01 Dev#=  3 Spd=480 MxCh= 0
D:  Ver= 2.00 Cls=00(>ifc ) Sub=00 Prot=00 MxPS=64 #Cfgs=  1
P:  Vendor=18d1 ProdID=4ee1 Rev=02.32
S:  Manufacturer=LGE
S:  Product=Nexus 5
S:  SerialNumber=042a05a5002e8fa4
C:  #Ifs= 1 Cfg#= 1 Atr=80 MxPwr=500mA
I:  If#= 0 Alt= 0 #EPs= 3 Cls=ff(vend.) Sub=ff Prot=00 Driver=(none)
-------------------------------
Details:

Bus 002 Device 003: ID 18d1:4ee1 Google Inc. Nexus 4
Device Descriptor:
  bLength                18
  bDescriptorType         1
  bcdUSB               2.00
  bDeviceClass            0 (Defined at Interface level)
  bDeviceSubClass         0 
  bDeviceProtocol         0 
  bMaxPacketSize0        64
  idVendor           0x18d1 Google Inc.
  idProduct          0x4ee1 Nexus 4
  bcdDevice            2.32
  iManufacturer           1 LGE
  iProduct                2 Nexus 5
  iSerial                 3 042a05a5002e8fa4
  bNumConfigurations      1
  Configuration Descriptor:
    bLength                 9
    bDescriptorType         2
    wTotalLength           39
    bNumInterfaces          1
    bConfigurationValue     1
    iConfiguration          0 
    bmAttributes         0x80
      (Bus Powered)
    MaxPower              500mA
    Interface Descriptor:
      bLength                 9
      bDescriptorType         4
      bInterfaceNumber        0
      bAlternateSetting       0
      bNumEndpoints           3
      bInterfaceClass       255 Vendor Specific Class
      bInterfaceSubClass    255 Vendor Specific Subclass
      bInterfaceProtocol      0 
      iInterface              4 MTP
      Endpoint Descriptor:
        bLength                 7
        bDescriptorType         5
        bEndpointAddress     0x81  EP 1 IN
        bmAttributes            2
          Transfer Type            Bulk
          Synch Type               None
          Usage Type               Data
        wMaxPacketSize     0x0200  1x 512 bytes
        bInterval               0
      Endpoint Descriptor:
        bLength                 7
        bDescriptorType         5
        bEndpointAddress     0x01  EP 1 OUT
        bmAttributes            2
          Transfer Type            Bulk
          Synch Type               None
          Usage Type               Data
        wMaxPacketSize     0x0200  1x 512 bytes
        bInterval               0
      Endpoint Descriptor:
        bLength                 7
        bDescriptorType         5
        bEndpointAddress     0x82  EP 2 IN
        bmAttributes            3
          Transfer Type            Interrupt
          Synch Type               None
          Usage Type               Data
        wMaxPacketSize     0x001c  1x 28 bytes
        bInterval               6
Device Qualifier (for other device speed):
  bLength                10
  bDescriptorType         6
  bcdUSB               2.00
  bDeviceClass            0 (Defined at Interface level)
  bDeviceSubClass         0 
  bDeviceProtocol         0 
  bMaxPacketSize0        64
  bNumConfigurations      1
Device Status:     0x0000
  (Bus Powered)
-------------------------------
Kernel Driver Name:

(none)
Driver is not ready. Please refer to the driver report: /root/HoneyUSB/report/usbpro.drv.18d1.4ee1
-------------------------------
USB Packet Dump:

/root/HoneyUSB/report/usbpro.mon.18d1.4ee1
-------------------------------
USB HID Dump:

/root/HoneyUSB/report/usbpro.hid.18d1.4ee1
-------------------------------
Wireshark Packet Dump:


===============
usbpro done
