ffff88004d3e70c0 266225002 S Ci:2:006:0 s 80 06 0300 0000 0004 4 <
ffff88004d3e70c0 266225271 C Ci:2:006:0 0 4 = 04030904
ffff88004d3e70c0 266225350 S Ci:2:006:0 s 80 06 0301 0409 00fe 254 <
ffff88004d3e70c0 266225598 C Ci:2:006:0 0 22 = 16034100 70007000 6c006500 20004900 6e006300 2e00
ffff88004d3e7cc0 266225779 S Ci:2:006:0 s 80 06 0300 0000 0004 4 <
ffff88004d3e7cc0 266226049 C Ci:2:006:0 0 4 = 04030904
ffff88004d3e7cc0 266226145 S Ci:2:006:0 s 80 06 0302 0409 00fe 254 <
ffff88004d3e7cc0 266226403 C Ci:2:006:0 0 14 = 0e036900 50006800 6f006e00 6500
ffff88004d3e7cc0 266226458 S Ci:2:006:0 s 80 06 0300 0000 0004 4 <
ffff88004d3e7cc0 266226625 C Ci:2:006:0 0 4 = 04030904
ffff88004d3e7cc0 266226736 S Ci:2:006:0 s 80 06 0303 0409 00fe 254 <
ffff88004d3e7cc0 266226949 C Ci:2:006:0 0 82 = 52033600 30003500 61006600 35003000 63003200 61003500 33006500 64003300
ffff88004d3e7cc0 266227093 S Ci:2:006:0 s 80 06 0300 0000 0004 4 <
ffff88004d3e7cc0 266227245 C Ci:2:006:0 0 4 = 04030904
ffff88004d3e7cc0 266227356 S Ci:2:006:0 s 80 06 0305 0409 00fe 254 <
ffff88004d3e7cc0 266227540 C Ci:2:006:0 0 8 = 08035000 54005000
ffff88004d3e7cc0 266227707 S Ci:2:006:0 s 80 06 0300 0000 0004 4 <
ffff88004d3e7cc0 266227876 C Ci:2:006:0 0 4 = 04030904
ffff88004d3e7cc0 266227987 S Ci:2:006:0 s 80 06 0306 0409 00fe 254 <
ffff88004d3e7cc0 266228138 C Ci:2:006:0 0 38 = 26036900 50006f00 64002000 55005300 42002000 49006e00 74006500 72006600
ffff88004d3e7cc0 266228374 S Ci:2:006:0 s 81 06 2200 0002 00d0 208 <
ffff88004d3e7cc0 266228547 C Ci:2:006:0 -32 0
ffff88004d3e7cc0 266228628 S Ci:2:006:0 s 81 06 2200 0002 00d0 208 <
ffff88004d3e7cc0 266228806 C Ci:2:006:0 -32 0
ffff88004d3e7cc0 266228844 S Ci:2:006:0 s 81 06 2200 0002 00d0 208 <
ffff88004d3e7cc0 266229044 C Ci:2:006:0 -32 0
ffff88004d3e7cc0 266229128 S Ci:2:006:0 s 81 06 2200 0002 00d0 208 <
ffff88004d3e7cc0 266229740 C Ci:2:006:0 -32 0
ffff88004d3e7cc0 266229861 S Ci:2:006:0 s 80 06 0300 0000 0004 4 <
ffff88004d3e7cc0 266230070 C Ci:2:006:0 0 4 = 04030904
ffff88004d3e7cc0 266230155 S Ci:2:006:0 s 80 06 0307 0409 00fe 254 <
ffff88004d3e7cc0 266230298 C Ci:2:006:0 0 52 = 34035000 54005000 20002b00 20004100 70007000 6c006500 20004d00 6f006200
ffff88004d3e7cc0 266230468 S Ci:2:006:0 s 80 06 0300 0000 0004 4 <
ffff88004d3e7cc0 266231351 C Ci:2:006:0 0 4 = 04030904
ffff88004d3e7cc0 266231425 S Ci:2:006:0 s 80 06 0308 0409 00fe 254 <
ffff88004d3e7cc0 266231709 C Ci:2:006:0 0 94 = 5e035000 54005000 20002b00 20004100 70007000 6c006500 20004d00 6f006200
ffff88004d3e7cc0 266231808 S Ci:2:006:0 s 80 06 0600 0000 000a 10 <
ffff88004d3e7cc0 266232012 C Ci:2:006:0 0 10 = 0a060002 00000040 0400
ffff88004d3e7cc0 266232085 S Ci:2:006:0 s 80 06 0a00 0000 0004 4 <
ffff88004d3e7cc0 266232321 C Ci:2:006:0 -32 0
ffff88004d3e7cc0 266232398 S Ci:2:006:0 s 80 00 0000 0000 0002 2 <
ffff88004d3e7cc0 266232629 C Ci:2:006:0 0 2 = 0000
ffff880050cc56c0 266261305 S Ci:2:006:0 s 80 06 0300 0000 00ff 255 <
ffff880050cc56c0 266261603 C Ci:2:006:0 0 4 = 04030904
ffff880050cc56c0 266261696 S Ci:2:006:0 s 80 06 0303 0409 00ff 255 <
ffff880050cc56c0 266261916 C Ci:2:006:0 0 82 = 52033600 30003500 61006600 35003000 63003200 61003500 33006500 64003300
ffff880050cc56c0 266262045 S Bo:2:006:4 -115 20 = 00000000 00000014 00000001 00000000 00000000
ffff880050cc5e40 266262052 S Bi:2:006:5 -115 16384 <
ffff880050cc56c0 266262065 C Bo:2:006:4 0 20 >
ffff880050cc5e40 266262406 C Bi:2:006:5 0 20 = 00000000 00000014 00000001 00000000 5c5a42cc
ffff88003e1ac600 266262436 S Bi:2:006:5 -115 16384 <
ffff880050d66240 266279548 S Ci:2:006:0 s c0 00 0000 0002 0040 64 <
ffff880050d66240 266448264 C Ci:2:006:0 0 6 = 42d32d6a 6f45
ffff88005bab9180 266463900 S Co:2:006:0 s 01 0b 0001 0002 0000 0
ffff88005bab9180 266464226 C Co:2:006:0 0 0
ffff880067c56840 266464726 S Ci:2:006:0 s c0 45 0000 0002 0040 64 <
ffff880067c56840 266464903 C Ci:2:006:0 0 1 = 03
ffff88004d222d80 266464923 S Bi:2:006:6 -115 1516 <
ffff88003e291300 267266158 S Bo:2:006:4 -115 28 = 00000006 0000001c 0001f27e 00000000 00000000 50020200 00000000
ffff88003e291300 267266237 C Bo:2:006:4 0 28 >
ffff88003e291300 267267891 S Bo:2:006:4 -115 28 = 00000006 0000001c 0002f27e 00000000 00000000 50020200 00000000
ffff88003e291300 267267968 C Bo:2:006:4 0 28 >
ffff88003e1ac600 267270241 C Bi:2:006:5 0 28 = 00000006 0000001c f27e0001 00000000 00000001 58120200 40060000
ffff88003e291300 267270335 S Bo:2:006:4 -115 28 = 00000006 0000001c 0001f27e 00000001 00000001 50100200 00000000
ffff88003e291240 267270359 S Bi:2:006:5 -115 16384 <
ffff88003e291300 267270401 C Bo:2:006:4 0 28 >
ffff88003e291240 267270415 C Bi:2:006:5 0 28 = 00000006 0000001c f27e0002 00000000 00000001 56120200 40060000
ffff88003e291240 267270658 S Bo:2:006:4 -115 28 = 00000006 0000001c 0002f27e 00000001 00000001 50100200 00000000
ffff88003e291300 267270665 S Bi:2:006:5 -115 16384 <
ffff88003e291780 267270674 S Bo:2:006:4 -115 311 = 00000006 00000137 0001f27e 00000001 00000001 50100200 00000000 00000117
ffff88003e291240 267270749 C Bo:2:006:4 0 28 >
ffff88003e291240 267270982 S Bo:2:006:4 -115 372 = 00000006 00000174 0002f27e 00000001 00000001 50100200 00000000 00000154
ffff88003e291780 267271361 C Bo:2:006:4 0 311 >
ffff88003e291240 267271833 C Bo:2:006:4 0 372 >
ffff88003e291300 267279306 C Bi:2:006:5 0 32 = 00000006 00000020 f27e0001 00000001 0000011c 58100200 a84cb7f2 00000129
ffff88003e291300 267279401 S Bi:2:006:5 -115 16384 <
ffff88003e291300 267279727 C Bi:2:006:5 0 325 = 00000006 00000145 f27e0001 00000005 0000011c 58100200 a84cb7f2 3c3f786d
ffff88003e291300 267279826 S Bi:2:006:5 -115 16384 <
ffff88003e291300 267281934 C Bi:2:006:5 0 32 = 00000006 00000020 f27e0002 00000001 00000159 58100200 a84cb7f2 0000014a
ffff88003e291300 267282030 S Bi:2:006:5 -115 16384 <
ffff88003e291300 267282400 C Bi:2:006:5 0 358 = 00000006 00000166 f27e0002 00000005 00000159 58100200 a84cb7f2 3c3f786d
ffff88003e291300 267282500 S Bi:2:006:5 -115 16384 <
ffff88003e291240 267282719 S Bo:2:006:4 -115 373 = 00000006 00000175 0002f27e 00000159 0000014f 50100200 00000000 00000155
ffff88003e291240 267282790 C Bo:2:006:4 0 373 >
ffff88003e291300 267284602 C Bi:2:006:5 0 32 = 00000006 00000020 f27e0002 0000014f 000002b2 58100200 a84cb7f2 00000144
ffff88003e291300 267284699 S Bi:2:006:5 -115 16384 <
ffff88003e291300 267284959 C Bi:2:006:5 0 352 = 00000006 00000160 f27e0002 00000153 000002b2 58100200 a84cb7f2 3c3f786d
ffff88003e291300 267285060 S Bi:2:006:5 -115 16384 <
ffff88003e291240 267285661 S Bo:2:006:4 -115 28 = 00000006 0000001c 0002f27e 000002b2 00000297 50040200 00000000
ffff88003e291240 267285723 C Bo:2:006:4 0 28 >
ffff88003e291180 267301019 S Bo:2:006:4 -115 28 = 00000006 0000001c 0001f27e 0000011c 0000012e 50100200 00000000
ffff88003e291180 267301092 C Bo:2:006:4 0 28 >
ffff88003e291780 267309145 S Bo:2:006:4 -115 4618 = 00000006 0000120a 0001f27e 0000011c 0000012e 50100200 00000000 000011ea
ffff88003e291780 267309406 C Bo:2:006:4 0 4618 >
ffff88003e291300 267317187 C Bi:2:006:5 0 32 = 00000006 00000020 f27e0001 0000012e 0000130a 58100200 a84cb7f2 000000ef
ffff88003e291300 267317280 S Bi:2:006:5 -115 16384 <
ffff88003e291300 267317582 C Bi:2:006:5 0 267 = 00000006 0000010b f27e0001 00000132 0000130a 58100200 a84cb7f2 3c3f786d
ffff88003e291300 267317677 S Bi:2:006:5 -115 16384 <
ffff88003e291cc0 267317837 S Bo:2:006:4 -115 466 = 00000006 000001d2 0001f27e 0000130a 00000221 50100200 00000000 000001b2
ffff88003e291cc0 267317903 C Bo:2:006:4 0 466 >
ffff88003e291300 267320132 C Bi:2:006:5 0 32 = 00000006 00000020 f27e0001 00000221 000014c0 58100200 a84cb7f2 00000162
ffff88003e291300 267320181 S Bi:2:006:5 -115 16384 <
ffff88003e291300 267320460 C Bi:2:006:5 0 382 = 00000006 0000017e f27e0001 00000225 000014c0 58100200 a84cb7f2 3c3f786d
ffff88003e291300 267320499 S Bi:2:006:5 -115 16384 <
ffff880067d450c0 267322603 S Bo:2:006:4 -115 28 = 00000006 0000001c 0003f27e 00000000 00000000 50020200 00000000
ffff880067d450c0 267322618 C Bo:2:006:4 0 28 >
ffff880050d23540 267323585 S Bo:2:006:4 -115 82 = 00000006 00000052 0001f27e 000014c0 00000387 50100200 00000000 16030000
ffff880050d23540 267323622 C Bo:2:006:4 0 82 >
ffff88003e291300 267324070 C Bi:2:006:5 0 28 = 00000006 0000001c f27e0003 00000000 00000001 5e120200 093c6b65
ffff880050d23540 267324114 S Bo:2:006:4 -115 28 = 00000006 0000001c 0003f27e 00000001 00000001 50100200 00000000
ffff880050d233c0 267324128 S Bi:2:006:5 -115 16384 <
ffff880050d23540 267324137 C Bo:2:006:4 0 28 >
ffff880050d23540 267324309 S Bo:2:006:4 -115 312 = 00000006 00000138 0003f27e 00000001 00000001 50100200 00000000 00000118
ffff880050d23540 267324412 C Bo:2:006:4 0 312 >
ffff880050d233c0 267329525 C Bi:2:006:5 0 32 = 00000006 00000020 f27e0003 00000001 0000011d 58100200 a84cb7f2 00000129
ffff880050d233c0 267329592 S Bi:2:006:5 -115 16384 <
ffff880050d233c0 267329904 C Bi:2:006:5 0 325 = 00000006 00000145 f27e0003 00000005 0000011d 58100200 a84cb7f2 3c3f786d
ffff880050d233c0 267329947 S Bi:2:006:5 -115 16384 <
ffff88004d0b8c00 267331268 S Bo:2:006:4 -115 4619 = 00000006 0000120b 0003f27e 0000011d 0000012e 50100200 00000000 000011eb
ffff88004d0b8c00 267331444 C Bo:2:006:4 0 4619 >
ffff880050d233c0 267335921 C Bi:2:006:5 0 32 = 00000006 00000020 f27e0003 0000012e 0000130c 58100200 a84cb7f2 000000ef
ffff880050fd4600 267335980 S Bi:2:006:5 -115 16384 <
ffff880050fd4600 267336301 C Bi:2:006:5 0 267 = 00000006 0000010b f27e0003 00000132 0000130c 58100200 a84cb7f2 3c3f786d
ffff880050fd4600 267336369 S Bi:2:006:5 -115 16384 <
ffff880050fd4780 267336679 S Bo:2:006:4 -115 467 = 00000006 000001d3 0003f27e 0000130c 00000221 50100200 00000000 000001b3
ffff880050fd4780 267336715 C Bo:2:006:4 0 467 >
ffff880050fd4600 267340217 C Bi:2:006:5 0 32 = 00000006 00000020 f27e0003 00000221 000014c3 58100200 a84cb7f2 00000162
ffff880050fd4600 267340265 S Bi:2:006:5 -115 16384 <
ffff880050fd4600 267340601 C Bi:2:006:5 0 382 = 00000006 0000017e f27e0003 00000225 000014c3 58100200 a84cb7f2 3c3f786d
ffff880050fd4600 267340632 S Bi:2:006:5 -115 16384 <
ffff88004d3e79c0 267345014 S Bo:2:006:4 -115 82 = 00000006 00000052 0003f27e 000014c3 00000387 50100200 00000000 16030000
ffff88004d3e79c0 267345062 C Bo:2:006:4 0 82 >
ffff880050fd4600 267450407 C Bi:2:006:5 0 107 = 00000006 0000006b f27e0001 00000387 000014f6 58100200 a84cb7f2 16030000
ffff88003de5d300 267452888 S Bi:2:006:5 -115 16384 <
ffff88003de5db40 267452923 S Bo:2:006:4 -115 28 = 00000006 0000001c 0001f27e 000014f6 000003d6 50100200 00000000
ffff88003de5d300 267452941 C Bi:2:006:5 0 614 = 00000006 00000266 f27e0001 000003d6 000014f6 58100200 a84cb7f2 16030002
ffff88003de5db40 267452948 C Bo:2:006:4 0 28 >
ffff88003de5d300 267452957 S Bi:2:006:5 -115 16384 <
ffff88003de5d300 267453420 C Bi:2:006:5 0 42 = 00000006 0000002a f27e0001 00000620 000014f6 5b100200 1967a6bd 16030000
ffff88003de5d300 267453479 S Bi:2:006:5 -115 16384 <
ffff88003de5d300 267453543 C Bi:2:006:5 0 37 = 00000006 00000025 f27e0001 0000062e 000014f6 58100200 a84cb7f2 16030000
ffff88003de5d300 267453586 S Bi:2:006:5 -115 16384 <
ffff88003de5d300 267453842 C Bi:2:006:5 0 107 = 00000006 0000006b f27e0003 00000387 000014f9 5b100200 1967a6bd 16030000
ffff88003de5d300 267457393 S Bi:2:006:5 -115 16384 <
ffff88003de5db40 267457401 S Bo:2:006:4 -115 1194 = 00000006 000004aa 0001f27e 000014f6 00000637 50100200 00000000 16030002
ffff88003de5d9c0 267457426 S Bo:2:006:4 -115 28 = 00000006 0000001c 0003f27e 000014f9 000003d6 50100200 00000000
ffff88003de5d300 267457436 C Bi:2:006:5 0 614 = 00000006 00000266 f27e0003 000003d6 000014f9 5b100200 1967a6bd 16030002
ffff88003de5db40 267457440 C Bo:2:006:4 0 1194 >
ffff88003de5d300 267457450 S Bi:2:006:5 -115 16384 <
ffff88003de5d9c0 267457991 C Bo:2:006:4 0 28 >
ffff88003de5d300 267458688 C Bi:2:006:5 0 42 = 00000006 0000002a f27e0003 00000620 000014f9 58100200 a84cb7f2 16030000
ffff88003de5d300 267458741 S Bi:2:006:5 -115 16384 <
ffff88003de5d300 267459374 C Bi:2:006:5 0 37 = 00000006 00000025 f27e0003 0000062e 000014f9 5b100200 1967a6bd 16030000
ffff88003de5d300 267459427 S Bi:2:006:5 -115 16384 <
ffff88003de5d9c0 267463145 S Bo:2:006:4 -115 1125 = 00000006 00000465 0003f27e 000014f9 00000637 50100200 00000000 16030002
ffff88003de5d9c0 267463190 C Bo:2:006:4 0 1125 >
ffff88003de5d9c0 267463370 S Bo:2:006:4 -115 97 = 00000006 00000061 0003f27e 00001942 00000637 50100200 00000000 16030000
ffff88003de5d9c0 267463625 C Bo:2:006:4 0 97 >
ffff88003de5d300 267543738 C Bi:2:006:5 0 34 = 00000006 00000022 f27e0001 00000637 00001984 58100200 a84cb7f2 14030000
ffff88003de5d300 267543849 S Bi:2:006:5 -115 16384 <
ffff88003de5d9c0 267543888 S Bo:2:006:4 -115 28 = 00000006 0000001c 0001f27e 00001984 0000063d 50100200 00000000
ffff88003de5d9c0 267543905 C Bo:2:006:4 0 28 >
ffff88003de5d300 267544419 C Bi:2:006:5 0 97 = 00000006 00000061 f27e0001 0000063d 00001984 58100200 a84cb7f2 16030000
ffff88003de5d300 267544448 S Bi:2:006:5 -115 16384 <
ffff88003de5d9c0 267544916 S Bo:2:006:4 -115 486 = 00000006 000001e6 0001f27e 00001984 00000682 50100200 00000000 17030000
ffff88003de5d9c0 267544944 C Bo:2:006:4 0 486 >
ffff88003de5d300 267567640 C Bi:2:006:5 0 34 = 00000006 00000022 f27e0003 00000637 00001987 58100200 a84cb7f2 14030000
ffff88003de5d300 267567726 S Bi:2:006:5 -115 16384 <
ffff88003de5d9c0 267567761 S Bo:2:006:4 -115 28 = 00000006 0000001c 0003f27e 00001987 0000063d 50100200 00000000
ffff88003de5d9c0 267567782 C Bo:2:006:4 0 28 >
ffff88003de5d300 267568295 C Bi:2:006:5 0 97 = 00000006 00000061 f27e0003 0000063d 00001987 58100200 a84cb7f2 16030000
ffff88003de5d300 267568373 S Bi:2:006:5 -115 16384 <
ffff88003de5d9c0 267568632 S Bo:2:006:4 -115 374 = 00000006 00000176 0003f27e 00001987 00000682 50100200 00000000 17030000
ffff88003de5d9c0 267568696 C Bo:2:006:4 0 374 >
ffff88003de5d300 267602761 C Bi:2:006:5 0 65 = 00000006 00000041 f27e0001 00000682 00001b4e 58100200 a84cb7f2 17030000
ffff88003de5d300 267602880 S Bi:2:006:5 -115 16384 <
ffff88003de5d9c0 267602901 S Bo:2:006:4 -115 28 = 00000006 0000001c 0001f27e 00001b4e 000006a7 50100200 00000000
ffff88003de5d9c0 267602945 C Bo:2:006:4 0 28 >
ffff88003de5d300 267604306 C Bi:2:006:5 0 449 = 00000006 000001c1 f27e0001 000006a7 00001b4e 58100200 a84cb7f2 17030001
ffff88003de5d300 267604389 S Bi:2:006:5 -115 16384 <
ffff88003de5d9c0 267604617 S Bo:2:006:4 -115 438 = 00000006 000001b6 0001f27e 00001b4e 0000084c 50100200 00000000 17030000
ffff88003de5d9c0 267604670 C Bo:2:006:4 0 438 >
ffff88003de5d300 267663205 C Bi:2:006:5 0 65 = 00000006 00000041 f27e0003 00000682 00001ae1 58100200 a84cb7f2 17030000
ffff88003de5d300 267663305 S Bi:2:006:5 -115 16384 <
ffff88003de5d9c0 267663344 S Bo:2:006:4 -115 28 = 00000006 0000001c 0003f27e 00001ae1 000006a7 50100200 00000000
ffff88003de5d9c0 267663366 C Bo:2:006:4 0 28 >
ffff88003de5d300 267666405 C Bi:2:006:5 0 6305 = 00000006 000018a1 f27e0003 000006a7 00001ae1 58100200 a84cb7f2 17030018
ffff88003de5d300 267666508 S Bi:2:006:5 -115 16384 <
ffff88003de5d9c0 267667019 S Bo:2:006:4 -115 438 = 00000006 000001b6 0003f27e 00001ae1 00001f2c 50100200 00000000 17030000
ffff88003de5d9c0 267667073 C Bo:2:006:4 0 438 >
ffff88003de5d300 267683884 C Bi:2:006:5 0 65 = 00000006 00000041 f27e0001 0000084c 00001ce8 58100200 a84cb7f2 17030000
ffff88003de5d300 267684073 S Bi:2:006:5 -115 16384 <
ffff88003de5d9c0 267684116 S Bo:2:006:4 -115 28 = 00000006 0000001c 0001f27e 00001ce8 00000871 50100200 00000000
ffff88003de5d9c0 267684190 C Bo:2:006:4 0 28 >
ffff88003de5d300 267684793 C Bi:2:006:5 0 625 = 00000006 00000271 f27e0001 00000871 00001ce8 58100200 a84cb7f2 17030002
ffff88003de5d300 267684896 S Bi:2:006:5 -115 16384 <
ffff88003de5d9c0 267685118 S Bo:2:006:4 -115 454 = 00000006 000001c6 0001f27e 00001ce8 00000ac6 50100200 00000000 17030000
ffff88003de5d9c0 267685166 C Bo:2:006:4 0 454 >
ffff88003de5d300 267686918 C Bi:2:006:5 0 65 = 00000006 00000041 f27e0001 00000ac6 00001e92 58100200 a84cb7f2 17030000
ffff88003de5d300 267687034 S Bi:2:006:5 -115 16384 <
ffff88003de5d300 267687422 C Bi:2:006:5 0 305 = 00000006 00000131 f27e0001 00000aeb 00001e92 58100200 a84cb7f2 17030001
ffff88003de5d300 267687538 S Bi:2:006:5 -115 16384 <
ffff88003de5d9c0 267687654 S Bo:2:006:4 -115 65 = 00000006 00000041 0001f27e 00001e92 00000c00 50100200 00000000 15030000
ffff88003de5d9c0 267687698 C Bo:2:006:4 0 65 >
ffff88003de5d300 267688798 C Bi:2:006:5 0 65 = 00000006 00000041 f27e0001 00000c00 00001eb7 58100200 a84cb7f2 15030000
ffff88003de5d300 267688922 S Bi:2:006:5 -115 16384 <
ffff88003de5d9c0 267689138 S Bo:2:006:4 -115 28 = 00000006 0000001c 0001f27e 00001eb7 00000c25 50040200 00000000
ffff88003de5d9c0 267689200 C Bo:2:006:4 0 28 >
ffff88003de5db40 267689201 S Bo:2:006:4 -115 28 = 00000006 0000001c 0004f27e 00000000 00000000 50020200 00000000
ffff88003de5db40 267689377 C Bo:2:006:4 0 28 >
ffff88003de5d300 267690667 C Bi:2:006:5 0 28 = 00000006 0000001c f27e0004 00000000 00000001 55120200 40060000
ffff88003de5d300 267690786 S Bo:2:006:4 -115 28 = 00000006 0000001c 0004f27e 00000001 00000001 50100200 00000000
ffff88003de5db40 267690792 S Bi:2:006:5 -115 16384 <
ffff88003de5d300 267690827 C Bo:2:006:4 0 28 >
ffff88003de5d300 267690877 S Bo:2:006:4 -115 311 = 00000006 00000137 0004f27e 00000001 00000001 50100200 00000000 00000117
ffff88003de5d300 267691110 C Bo:2:006:4 0 311 >
ffff88003de5db40 267702149 C Bi:2:006:5 0 32 = 00000006 00000020 f27e0004 00000001 0000011c 58100200 a84cb7f2 00000129
ffff88003de5db40 267702244 S Bi:2:006:5 -115 16384 <
ffff88003de5db40 267702497 C Bi:2:006:5 0 325 = 00000006 00000145 f27e0004 00000005 0000011c 58100200 a84cb7f2 3c3f786d
ffff88003de5db40 267702605 S Bi:2:006:5 -115 16384 <
ffff88003de5d300 267703206 S Bo:2:006:4 -115 4618 = 00000006 0000120a 0004f27e 0000011c 0000012e 50100200 00000000 000011ea
ffff88003de5d300 267703362 C Bo:2:006:4 0 4618 >
ffff88003de5db40 267706190 C Bi:2:006:5 0 32 = 00000006 00000020 f27e0004 0000012e 0000130a 58100200 a84cb7f2 000000ef
ffff88003de5db40 267706308 S Bi:2:006:5 -115 16384 <
ffff88003de5db40 267706593 C Bi:2:006:5 0 267 = 00000006 0000010b f27e0004 00000132 0000130a 58100200 a84cb7f2 3c3f786d
ffff88003de5db40 267706712 S Bi:2:006:5 -115 16384 <
ffff88003de5d300 267706847 S Bo:2:006:4 -115 466 = 00000006 000001d2 0004f27e 0000130a 00000221 50100200 00000000 000001b2
ffff88003de5d300 267706901 C Bo:2:006:4 0 466 >
ffff88003de5db40 267709667 C Bi:2:006:5 0 32 = 00000006 00000020 f27e0004 00000221 000014c0 58100200 a84cb7f2 00000162
ffff88003de5db40 267709826 S Bi:2:006:5 -115 16384 <
ffff88003de5db40 267710063 C Bi:2:006:5 0 382 = 00000006 0000017e f27e0004 00000225 000014c0 58100200 a84cb7f2 3c3f786d
ffff88003de5db40 267710166 S Bi:2:006:5 -115 16384 <
ffff88003de5d300 267713853 S Bo:2:006:4 -115 82 = 00000006 00000052 0004f27e 000014c0 00000387 50100200 00000000 16030000
ffff88003de5d300 267713922 C Bo:2:006:4 0 82 >
ffff88003de5db40 267719839 C Bi:2:006:5 0 107 = 00000006 0000006b f27e0004 00000387 000014f6 58100200 a84cb7f2 16030000
ffff88003de5db40 267719960 S Bi:2:006:5 -115 16384 <
ffff88003de5db40 267720308 C Bi:2:006:5 0 614 = 00000006 00000266 f27e0004 000003d6 000014f6 58100200 a84cb7f2 16030002
ffff88003de5db40 267720428 S Bi:2:006:5 -115 16384 <
ffff88003de5db40 267720645 C Bi:2:006:5 0 42 = 00000006 0000002a f27e0004 00000620 000014f6 58100200 a84cb7f2 16030000
ffff88003de5db40 267720681 S Bi:2:006:5 -115 16384 <
ffff88003de5db40 267720938 C Bi:2:006:5 0 37 = 00000006 00000025 f27e0004 0000062e 000014f6 58100200 a84cb7f2 16030000
ffff88003de5db40 267721018 S Bi:2:006:5 -115 16384 <
ffff88003de5d300 267728886 S Bo:2:006:4 -115 715 = 00000006 000002cb 0004f27e 000014f6 00000637 50100200 00000000 16030002
ffff88003de5d9c0 267728915 S Bo:2:006:4 -115 165 = 00000006 000000a5 0004f27e 000017a5 00000637 50100200 00000000 16030000
ffff88003de5d780 267728946 S Bo:2:006:4 -115 295 = 00000006 00000127 0004f27e 0000182e 00000637 50100200 00000000 16030001
ffff88003de5d300 267728957 C Bo:2:006:4 0 715 >
ffff88003de5d300 267728972 S Bo:2:006:4 -115 34 = 00000006 00000022 0004f27e 00001939 00000637 50100200 00000000 14030000
ffff88003de5d9c0 267729151 C Bo:2:006:4 0 165 >
ffff88003de5d9c0 267729204 S Bo:2:006:4 -115 97 = 00000006 00000061 0004f27e 0000193f 00000637 50100200 00000000 16030000
ffff88003de5d780 267729598 C Bo:2:006:4 0 295 >
ffff88003de5d300 267729900 C Bo:2:006:4 0 34 >
ffff88003de5d9c0 267730153 C Bo:2:006:4 0 97 >
ffff88003de5db40 267779240 C Bi:2:006:5 0 65 = 00000006 00000041 f27e0003 00001f2c 00001c7b 58100200 a84cb7f2 17030000
ffff88003de5db40 267779370 S Bi:2:006:5 -115 16384 <
ffff88003de5d9c0 267779389 S Bo:2:006:4 -115 28 = 00000006 0000001c 0003f27e 00001c7b 00001f51 50100200 00000000
ffff88003de5d9c0 267779419 C Bo:2:006:4 0 28 >
ffff88003de5db40 267782374 C Bi:2:006:5 0 16369 = 00000006 00003ff1 f27e0003 00001f51 00001c7b 58100200 a84cb7f2 1703003f
ffff88003de5db40 267782502 S Bi:2:006:5 -115 16384 <
ffff88003de5db40 267782777 C Bi:2:006:5 0 11697 = 00000006 00002db1 f27e0003 00005f26 00001c7b 5b100200 1967a6bd 1703002d
ffff88003de5db40 267782901 S Bi:2:006:5 -115 16384 <
ffff88003de5d9c0 267788756 S Bo:2:006:4 -115 454 = 00000006 000001c6 0003f27e 00001c7b 00008cbb 50100200 00000000 17030000
ffff88003de5d9c0 267788803 C Bo:2:006:4 0 454 >
ffff88003de5db40 267790645 C Bi:2:006:5 0 65 = 00000006 00000041 f27e0003 00008cbb 00001e25 58100200 a84cb7f2 17030000
ffff88003de5db40 267790772 S Bi:2:006:5 -115 16384 <
ffff88003de5db40 267791240 C Bi:2:006:5 0 305 = 00000006 00000131 f27e0003 00008ce0 00001e25 58100200 a84cb7f2 17030001
ffff88003de5db40 267791366 S Bi:2:006:5 -115 16384 <
ffff88003de5d9c0 267791715 S Bo:2:006:4 -115 65 = 00000006 00000041 0003f27e 00001e25 00008df5 50100200 00000000 15030000
ffff88003de5d9c0 267791785 C Bo:2:006:4 0 65 >
ffff88003de5db40 267793068 C Bi:2:006:5 0 65 = 00000006 00000041 f27e0003 00008df5 00001e4a 58100200 a84cb7f2 15030000
ffff88003de5db40 267793232 S Bi:2:006:5 -115 16384 <
ffff88003de5d9c0 267793593 S Bo:2:006:4 -115 28 = 00000006 0000001c 0003f27e 00001e4a 00008e1a 50040200 00000000
ffff88003de5d9c0 267793671 C Bo:2:006:4 0 28 >
ffff88003de5db40 267801852 C Bi:2:006:5 0 34 = 00000006 00000022 f27e0004 00000637 00001984 58100200 a84cb7f2 14030000
ffff88003de5db40 267801938 S Bi:2:006:5 -115 16384 <
ffff88003de5d9c0 267801977 S Bo:2:006:4 -115 28 = 00000006 0000001c 0004f27e 00001984 0000063d 50100200 00000000
ffff88003de5d9c0 267802039 C Bo:2:006:4 0 28 >
ffff88003de5db40 267802486 C Bi:2:006:5 0 97 = 00000006 00000061 f27e0004 0000063d 00001984 58100200 a84cb7f2 16030000
ffff88003de5db40 267802605 S Bi:2:006:5 -115 16384 <
ffff88003de5d9c0 267802898 S Bo:2:006:4 -115 65 = 00000006 00000041 0004f27e 00001984 00000682 50100200 00000000 17030000
ffff88003de5d9c0 267802964 C Bo:2:006:4 0 65 >
ffff88003de5d9c0 267803037 S Bo:2:006:4 -115 401 = 00000006 00000191 0004f27e 000019a9 00000682 50100200 00000000 17030001
ffff88003de5d9c0 267803777 C Bo:2:006:4 0 401 >
ffff88003de5db40 267821364 C Bi:2:006:5 0 65 = 00000006 00000041 f27e0004 00000682 00001b1e 58100200 a84cb7f2 17030000
ffff88003de5db40 267821495 S Bi:2:006:5 -115 16384 <
ffff88003de5db40 267821937 C Bi:2:006:5 0 625 = 00000006 00000271 f27e0004 000006a7 00001b1e 58100200 a84cb7f2 17030002
ffff88003de5db40 267822065 S Bi:2:006:5 -115 16384 <
ffff88003de5d9c0 267822434 S Bo:2:006:4 -115 65 = 00000006 00000041 0004f27e 00001b1e 000008fc 50100200 00000000 17030000
ffff88003de5d9c0 267822512 C Bo:2:006:4 0 65 >
ffff88003de5d9c0 267822587 S Bo:2:006:4 -115 417 = 00000006 000001a1 0004f27e 00001b43 000008fc 50100200 00000000 17030001
ffff88003de5d9c0 267822687 C Bo:2:006:4 0 417 >
ffff88003de5db40 267827553 C Bi:2:006:5 0 65 = 00000006 00000041 f27e0004 000008fc 00001cc8 58100200 a84cb7f2 17030000
ffff88003de5db40 267827690 S Bi:2:006:5 -115 16384 <
ffff88003de5db40 267828133 C Bi:2:006:5 0 305 = 00000006 00000131 f27e0004 00000921 00001cc8 58100200 a84cb7f2 17030001
ffff88003de5db40 267828256 S Bi:2:006:5 -115 16384 <
ffff88003de5d9c0 267828473 S Bo:2:006:4 -115 65 = 00000006 00000041 0004f27e 00001cc8 00000a36 50100200 00000000 15030000
ffff88003de5d9c0 267828520 C Bo:2:006:4 0 65 >
ffff88003de5db40 267829959 C Bi:2:006:5 0 65 = 00000006 00000041 f27e0004 00000a36 00001ced 58100200 a84cb7f2 15030000
ffff88003de5db40 267830090 S Bi:2:006:5 -115 16384 <
ffff88003de5d9c0 267830296 S Bo:2:006:4 -115 28 = 00000006 0000001c 0004f27e 00001ced 00000a5b 50040200 00000000
ffff88003de5d9c0 267830330 C Bo:2:006:4 0 28 >
ffff88003e2923c0 267944813 S Ci:2:006:0 s c0 45 0000 0002 0040 64 <
ffff88003e2923c0 267945243 C Ci:2:006:0 0 1 = 03
ffff88004d1b2cc0 268286905 S Bo:2:006:4 -115 28 = 00000006 0000001c 0005f27e 00000000 00000000 50020200 00000000
ffff88004d1b2cc0 268286975 C Bo:2:006:4 0 28 >
ffff88003de5db40 268289641 C Bi:2:006:5 0 28 = 00000006 0000001c f27e0005 00000000 00000001 55120200 40060000
ffff88004d1b2cc0 268289717 S Bo:2:006:4 -115 28 = 00000006 0000001c 0005f27e 00000001 00000001 50100200 00000000
ffff88004d1b2a80 268289736 S Bi:2:006:5 -115 16384 <
ffff88004d1b2cc0 268289774 C Bo:2:006:4 0 28 >
ffff88004d1b2cc0 268289895 S Bo:2:006:4 -115 328 = 00000006 00000148 0005f27e 00000001 00000001 50100200 00000000 00000128
ffff88004d1b2cc0 268290226 C Bo:2:006:4 0 328 >
ffff88004d1b2a80 268303220 C Bi:2:006:5 0 32 = 00000006 00000020 f27e0005 00000001 0000012d 58100200 a84cb7f2 00000129
ffff88004d1b2a80 268303322 S Bi:2:006:5 -115 16384 <
ffff88004d1b2a80 268303818 C Bi:2:006:5 0 325 = 00000006 00000145 f27e0005 00000005 0000012d 58100200 a84cb7f2 3c3f786d
ffff88004d1b2a80 268303922 S Bi:2:006:5 -115 16384 <
ffff88004d1b2cc0 268305207 S Bo:2:006:4 -115 4635 = 00000006 0000121b 0005f27e 0000012d 0000012e 50100200 00000000 000011fb
ffff88004d1b2cc0 268305379 C Bo:2:006:4 0 4635 >
ffff88004d1b2a80 268311090 C Bi:2:006:5 0 32 = 00000006 00000020 f27e0005 0000012e 0000132c 58100200 a84cb7f2 000000ef
ffff88004d1b2a80 268311198 S Bi:2:006:5 -115 16384 <
ffff88004d1b2a80 268311569 C Bi:2:006:5 0 267 = 00000006 0000010b f27e0005 00000132 0000132c 58100200 a84cb7f2 3c3f786d
ffff88004d1b2a80 268311681 S Bi:2:006:5 -115 16384 <
ffff88004d1b2cc0 268311975 S Bo:2:006:4 -115 483 = 00000006 000001e3 0005f27e 0000132c 00000221 50100200 00000000 000001c3
ffff88004d1b2cc0 268312053 C Bo:2:006:4 0 483 >
ffff88004d1b2a80 268315570 C Bi:2:006:5 0 32 = 00000006 00000020 f27e0005 00000221 000014f3 58100200 a84cb7f2 00000162
ffff88004d1b2a80 268315679 S Bi:2:006:5 -115 16384 <
ffff88004d1b2a80 268316027 C Bi:2:006:5 0 382 = 00000006 0000017e f27e0005 00000225 000014f3 58100200 a84cb7f2 3c3f786d
ffff88004d1b2a80 268316127 S Bi:2:006:5 -115 16384 <
ffff88004d1b2840 268322137 S Bo:2:006:4 -115 82 = 00000006 00000052 0005f27e 000014f3 00000387 50100200 00000000 16030000
ffff88004d1b2840 268322236 C Bo:2:006:4 0 82 >
ffff88004d1b2a80 268336010 C Bi:2:006:5 0 107 = 00000006 0000006b f27e0005 00000387 00001529 58100200 a84cb7f2 16030000
ffff88004d1b2a80 268336081 S Bi:2:006:5 -115 16384 <
ffff88004d1b2a80 268336518 C Bi:2:006:5 0 614 = 00000006 00000266 f27e0005 000003d6 00001529 58100200 a84cb7f2 16030002
ffff88004d1b2a80 268336629 S Bi:2:006:5 -115 16384 <
ffff88004d1b2a80 268337024 C Bi:2:006:5 0 42 = 00000006 0000002a f27e0005 00000620 00001529 58100200 a84cb7f2 16030000
ffff88004d1b2a80 268337115 S Bi:2:006:5 -115 16384 <
ffff88004d1b2a80 268337557 C Bi:2:006:5 0 37 = 00000006 00000025 f27e0005 0000062e 00001529 58100200 a84cb7f2 16030000
ffff88004d1b2a80 268337639 S Bi:2:006:5 -115 16384 <
ffff880067c01480 268342031 S Bo:2:006:4 -115 28 = 00000006 0000001c 0006f27e 00000000 00000000 50020200 00000000
ffff880067c01480 268342108 C Bo:2:006:4 0 28 >
ffff88004d1b2a80 268345476 C Bi:2:006:5 0 28 = 00000006 0000001c f27e0006 00000000 00000001 5d120200 40060000
ffff880067c01480 268345589 S Bo:2:006:4 -115 28 = 00000006 0000001c 0006f27e 00000001 00000001 50100200 00000000
ffff880067c01840 268345626 S Bi:2:006:5 -115 16384 <
ffff880067c01900 268345648 S Bo:2:006:4 -115 1125 = 00000006 00000465 0005f27e 00001529 00000637 50100200 00000000 16030002
ffff880067c01480 268345666 C Bo:2:006:4 0 28 >
ffff880067c01480 268345926 S Bo:2:006:4 -115 358 = 00000006 00000166 0006f27e 00000001 00000001 50100200 00000000 00000146
ffff880067c01900 268346065 C Bo:2:006:4 0 1125 >
ffff880067c01540 268346103 S Bo:2:006:4 -115 97 = 00000006 00000061 0005f27e 00001972 00000637 50100200 00000000 16030000
ffff880067c01480 268346668 C Bo:2:006:4 0 358 >
ffff880067c01540 268347262 C Bo:2:006:4 0 97 >
ffff880067c01840 268380194 C Bi:2:006:5 0 32 = 00000006 00000020 f27e0006 00000001 0000014b 58100200 a84cb7f2 0000014a
ffff880067c01840 268380316 S Bi:2:006:5 -115 16384 <
ffff880067c01540 268380369 S Bo:2:006:4 -115 28 = 00000006 0000001c 0006f27e 0000014b 00000005 50100200 00000000
ffff880067c01540 268380433 C Bo:2:006:4 0 28 >
ffff880067c01840 268380869 C Bi:2:006:5 0 358 = 00000006 00000166 f27e0006 00000005 0000014b 58100200 a84cb7f2 3c3f786d
ffff880067c01840 268380979 S Bi:2:006:5 -115 16384 <
ffff88003de5d300 268381267 S Bo:2:006:4 -115 359 = 00000006 00000167 0006f27e 0000014b 0000014f 50100200 00000000 00000147
ffff88003de5d300 268381339 C Bo:2:006:4 0 359 >
ffff880067c01840 268397731 C Bi:2:006:5 0 32 = 00000006 00000020 f27e0006 0000014f 00000296 58100200 a84cb7f2 00000144
ffff88003de5d300 268397828 S Bi:2:006:5 -115 16384 <
ffff88003de5d300 268398226 C Bi:2:006:5 0 352 = 00000006 00000160 f27e0006 00000153 00000296 58100200 a84cb7f2 3c3f786d
ffff88003de5d300 268398322 S Bi:2:006:5 -115 16384 <
ffff88003de5d780 268398645 S Bo:2:006:4 -115 362 = 00000006 0000016a 0006f27e 00000296 00000297 50100200 00000000 0000014a
ffff88003de5d780 268398717 C Bo:2:006:4 0 362 >
ffff88003de5d300 268420344 C Bi:2:006:5 0 32 = 00000006 00000020 f27e0006 00000297 000003e4 58100200 a84cb7f2 00000146
ffff88003de5d300 268420418 S Bi:2:006:5 -115 16384 <
ffff88003de5d300 268420696 C Bi:2:006:5 0 354 = 00000006 00000162 f27e0006 0000029b 000003e4 58100200 a84cb7f2 3c3f786d
ffff88003de5d300 268420841 S Bi:2:006:5 -115 16384 <
ffff88003de5d780 268421051 S Bo:2:006:4 -115 28 = 00000006 0000001c 0007f27e 00000000 00000000 50020200 00000000
ffff88003de5d780 268421116 C Bo:2:006:4 0 28 >
ffff88003de5d300 268422169 C Bi:2:006:5 0 28 = 00000006 0000001c f27e0007 00000000 00000001 58120200 40060000
ffff88003de5d300 268422269 S Bo:2:006:4 -115 28 = 00000006 0000001c 0007f27e 00000001 00000001 50100200 00000000
ffff88003de5d780 268422291 S Bi:2:006:5 -115 16384 <
ffff88003de5d300 268422334 C Bo:2:006:4 0 28 >
ffff88003de5d300 268422449 S Bo:2:006:4 -115 314 = 00000006 0000013a 0007f27e 00000001 00000001 50100200 00000000 0000011a
ffff88003de5d300 268422522 C Bo:2:006:4 0 314 >
ffff88003de5d300 268429013 S Bo:2:006:4 -115 28 = 00000006 0000001c 0006f27e 000003e4 000003e1 50100200 00000000
ffff88003de5d300 268429081 C Bo:2:006:4 0 28 >
ffff88003de5d780 268526136 C Bi:2:006:5 0 34 = 00000006 00000022 f27e0005 00000637 000019b7 58100200 a84cb7f2 14030000
ffff88003de5d780 268526214 S Bi:2:006:5 -115 16384 <
ffff88003de5d300 268526249 S Bo:2:006:4 -115 28 = 00000006 0000001c 0005f27e 000019b7 0000063d 50100200 00000000
ffff88003de5d300 268526291 C Bo:2:006:4 0 28 >
ffff88003de5d780 268526945 C Bi:2:006:5 0 97 = 00000006 00000061 f27e0005 0000063d 000019b7 58100200 a84cb7f2 16030000
ffff88003de5d780 268527041 S Bi:2:006:5 -115 16384 <
ffff88003de5d300 268527420 S Bo:2:006:4 -115 438 = 00000006 000001b6 0005f27e 000019b7 00000682 50100200 00000000 17030000
ffff88003de5d300 268527451 C Bo:2:006:4 0 438 >
ffff88003de5d780 268529856 C Bi:2:006:5 0 32 = 00000006 00000020 f27e0007 00000001 0000011f 58100200 a84cb7f2 00000129
ffff88003de5d780 268529949 S Bi:2:006:5 -115 16384 <
ffff88003de5d300 268529984 S Bo:2:006:4 -115 28 = 00000006 0000001c 0007f27e 0000011f 00000005 50100200 00000000
ffff88003de5d300 268530025 C Bo:2:006:4 0 28 >
ffff88003de5d780 268530643 C Bi:2:006:5 0 325 = 00000006 00000145 f27e0007 00000005 0000011f 58100200 a84cb7f2 3c3f786d
ffff88003de5d780 268530739 S Bi:2:006:5 -115 16384 <
ffff88003de5d780 268532084 C Bi:2:006:5 0 65 = 00000006 00000041 f27e0005 00000682 00001b51 58100200 a84cb7f2 17030000
ffff88004d0ad300 268532163 S Bi:2:006:5 -115 16384 <
ffff88004d0ad000 268532191 S Bo:2:006:4 -115 4621 = 00000006 0000120d 0007f27e 0000011f 0000012e 50100200 00000000 000011ed
ffff88004d0ad000 268532316 C Bo:2:006:4 0 4621 >
ffff88004d0ad300 268533075 C Bi:2:006:5 0 385 = 00000006 00000181 f27e0005 000006a7 00001b51 58100200 a84cb7f2 17030001
ffff88004d0ad300 268533113 S Bi:2:006:5 -115 16384 <
ffff88004d0ad000 268533707 S Bo:2:006:4 -115 470 = 00000006 000001d6 0005f27e 00001b51 0000080c 50100200 00000000 17030000
ffff88004d0ad000 268533746 C Bo:2:006:4 0 470 >
ffff88004d0ad300 268536187 C Bi:2:006:5 0 32 = 00000006 00000020 f27e0007 0000012e 00001310 58100200 a84cb7f2 000000ef
ffff88004d0ad300 268536227 S Bi:2:006:5 -115 16384 <
ffff88004d0ad300 268536610 C Bi:2:006:5 0 267 = 00000006 0000010b f27e0007 00000132 00001310 58100200 a84cb7f2 3c3f786d
ffff88004d0ad300 268536660 S Bi:2:006:5 -115 16384 <
ffff88003de5d300 268537037 S Bo:2:006:4 -115 469 = 00000006 000001d5 0007f27e 00001310 00000221 50100200 00000000 000001b5
ffff88003de5d300 268537105 C Bo:2:006:4 0 469 >
ffff88004d0ad300 268539156 C Bi:2:006:5 0 32 = 00000006 00000020 f27e0007 00000221 000014c9 58100200 a84cb7f2 00000162
ffff88003de5d300 268539253 S Bi:2:006:5 -115 16384 <
ffff88003de5d300 268539522 C Bi:2:006:5 0 382 = 00000006 0000017e f27e0007 00000225 000014c9 58100200 a84cb7f2 3c3f786d
ffff88003de5d300 268539617 S Bi:2:006:5 -115 16384 <
ffff88003de5d600 268545270 S Bo:2:006:4 -115 82 = 00000006 00000052 0007f27e 000014c9 00000387 50100200 00000000 16030000
ffff88003de5d600 268545317 C Bo:2:006:4 0 82 >
ffff88003de5d300 268552106 C Bi:2:006:5 0 107 = 00000006 0000006b f27e0007 00000387 000014ff 58100200 a84cb7f2 16030000
ffff88003de5d300 268552193 S Bi:2:006:5 -115 16384 <
ffff88003de5d300 268552497 C Bi:2:006:5 0 614 = 00000006 00000266 f27e0007 000003d6 000014ff 58100200 a84cb7f2 16030002
ffff88003de5d300 268552595 S Bi:2:006:5 -115 16384 <
ffff88003de5d300 268553233 C Bi:2:006:5 0 42 = 00000006 0000002a f27e0007 00000620 000014ff 58100200 a84cb7f2 16030000
ffff88003de5d300 268553317 S Bi:2:006:5 -115 16384 <
ffff88003de5d300 268553630 C Bi:2:006:5 0 37 = 00000006 00000025 f27e0007 0000062e 000014ff 58100200 a84cb7f2 16030000
ffff88003de5d300 268553734 S Bi:2:006:5 -115 16384 <
ffff88003de5d600 268561700 S Bo:2:006:4 -115 715 = 00000006 000002cb 0007f27e 000014ff 00000637 50100200 00000000 16030002
ffff88003de5d180 268561740 S Bo:2:006:4 -115 165 = 00000006 000000a5 0007f27e 000017ae 00000637 50100200 00000000 16030000
ffff88003de5d600 268561761 C Bo:2:006:4 0 715 >
ffff88003de5d480 268561763 S Bo:2:006:4 -115 295 = 00000006 00000127 0007f27e 00001837 00000637 50100200 00000000 16030001
ffff88003de5d600 268561800 S Bo:2:006:4 -115 34 = 00000006 00000022 0007f27e 00001942 00000637 50100200 00000000 14030000
ffff88003de5d180 268562058 C Bo:2:006:4 0 165 >
ffff88003de5d180 268562195 S Bo:2:006:4 -115 97 = 00000006 00000061 0007f27e 00001948 00000637 50100200 00000000 16030000
ffff88003de5d480 268562620 C Bo:2:006:4 0 295 >
ffff88003de5d600 268562901 C Bo:2:006:4 0 34 >
ffff88003de5d180 268563174 C Bo:2:006:4 0 97 >
ffff88003de5d300 268655606 C Bi:2:006:5 0 65 = 00000006 00000041 f27e0005 0000080c 00001d0b 58100200 a84cb7f2 17030000
ffff88003de5d300 268655690 S Bi:2:006:5 -115 16384 <
ffff88003de5d180 268655734 S Bo:2:006:4 -115 28 = 00000006 0000001c 0005f27e 00001d0b 00000831 50100200 00000000
ffff88003de5d180 268655751 C Bo:2:006:4 0 28 >
ffff88003de5d300 268656419 C Bi:2:006:5 0 417 = 00000006 000001a1 f27e0005 00000831 00001d0b 58100200 a84cb7f2 17030001
ffff88003de5d300 268656495 S Bi:2:006:5 -115 16384 <
ffff88004d0ad000 268656942 S Bo:2:006:4 -115 438 = 00000006 000001b6 0005f27e 00001d0b 000009b6 50100200 00000000 17030000
ffff88004d0ad000 268656977 C Bo:2:006:4 0 438 >
ffff88003de5d300 268659745 C Bi:2:006:5 0 65 = 00000006 00000041 f27e0005 000009b6 00001ea5 58100200 a84cb7f2 17030000
ffff88004d0ad000 268659795 S Bi:2:006:5 -115 16384 <
ffff88004d0ad000 268660275 C Bi:2:006:5 0 385 = 00000006 00000181 f27e0005 000009db 00001ea5 58100200 a84cb7f2 17030001
ffff88004d0ad000 268660315 S Bi:2:006:5 -115 16384 <
ffff88004d0ad6c0 268660640 S Bo:2:006:4 -115 438 = 00000006 000001b6 0005f27e 00001ea5 00000b40 50100200 00000000 17030000
ffff88004d0ad6c0 268660667 C Bo:2:006:4 0 438 >
ffff88004d0ad000 268662418 C Bi:2:006:5 0 65 = 00000006 00000041 f27e0005 00000b40 0000203f 58100200 a84cb7f2 17030000
ffff88004d0ad000 268662460 S Bi:2:006:5 -115 16384 <
ffff88004d0ad000 268662923 C Bi:2:006:5 0 385 = 00000006 00000181 f27e0005 00000b65 0000203f 58100200 a84cb7f2 17030001
ffff88004d0ad000 268662962 S Bi:2:006:5 -115 16384 <
ffff88004d0ad6c0 268663266 S Bo:2:006:4 -115 470 = 00000006 000001d6 0005f27e 0000203f 00000cca 50100200 00000000 17030000
ffff88004d0ad6c0 268663294 C Bo:2:006:4 0 470 >
ffff88004d0ad000 268665319 C Bi:2:006:5 0 65 = 00000006 00000041 f27e0005 00000cca 000021f9 58100200 a84cb7f2 17030000
ffff88004d0ad000 268665358 S Bi:2:006:5 -115 16384 <
ffff88004d0ad000 268665823 C Bi:2:006:5 0 305 = 00000006 00000131 f27e0005 00000cef 000021f9 58100200 a84cb7f2 17030001
ffff88004d0ad000 268665861 S Bi:2:006:5 -115 16384 <
ffff88004d0ad6c0 268666084 S Bo:2:006:4 -115 65 = 00000006 00000041 0005f27e 000021f9 00000e04 50100200 00000000 15030000
ffff88004d0ad6c0 268666108 C Bo:2:006:4 0 65 >
ffff88004d0ad000 268667150 C Bi:2:006:5 0 65 = 00000006 00000041 f27e0005 00000e04 0000221e 58100200 a84cb7f2 15030000
ffff88004d0ad000 268667194 S Bi:2:006:5 -115 16384 <
ffff88004d0ad6c0 268667604 S Bo:2:006:4 -115 28 = 00000006 0000001c 0005f27e 0000221e 00000e29 50040200 00000000
ffff88004d0ad6c0 268667628 C Bo:2:006:4 0 28 >
ffff88004d0ad000 268678988 C Bi:2:006:5 0 34 = 00000006 00000022 f27e0007 00000637 0000198d 58100200 a84cb7f2 14030000
ffff880050d24480 268679033 S Bi:2:006:5 -115 16384 <
ffff88003deadc00 268679061 S Bo:2:006:4 -115 28 = 00000006 0000001c 0007f27e 0000198d 0000063d 50100200 00000000
ffff88003deadc00 268679097 C Bo:2:006:4 0 28 >
ffff880050d24480 268679719 C Bi:2:006:5 0 97 = 00000006 00000061 f27e0007 0000063d 0000198d 58100200 a84cb7f2 16030000
ffff88003deadc00 268679742 S Bi:2:006:5 -115 16384 <
ffff880050d24480 268679968 S Bo:2:006:4 -115 28 = 00000006 0000001c 0006f27e 000003e4 000003e1 50040200 00000000
ffff880050d24480 268679987 C Bo:2:006:4 0 28 >
ffff880050d24480 268680248 S Bo:2:006:4 -115 65 = 00000006 00000041 0007f27e 0000198d 00000682 50100200 00000000 17030000
ffff880050d24480 268680269 C Bo:2:006:4 0 65 >
ffff880067c56480 268680279 S Bo:2:006:4 -115 401 = 00000006 00000191 0007f27e 000019b2 00000682 50100200 00000000 17030001
ffff880067c56480 268680806 C Bo:2:006:4 0 401 >
ffff88003deadc00 268735995 C Bi:2:006:5 0 65 = 00000006 00000041 f27e0007 00000682 00001b27 58100200 a84cb7f2 17030000
ffff88003de5d600 268736095 S Bi:2:006:5 -115 16384 <
ffff88003de5d180 268736138 S Bo:2:006:4 -115 28 = 00000006 0000001c 0007f27e 00001b27 000006a7 50100200 00000000
ffff88003de5d180 268736178 C Bo:2:006:4 0 28 >
ffff88003de5d600 268736867 C Bi:2:006:5 0 401 = 00000006 00000191 f27e0007 000006a7 00001b27 58100200 a84cb7f2 17030001
ffff88003de5d600 268736944 S Bi:2:006:5 -115 16384 <
ffff88004d1b2780 268737132 S Bo:2:006:4 -115 28 = 00000006 0000001c 0008c0f5 00000000 00000000 50020200 00000000
ffff88004d1b2780 268737173 C Bo:2:006:4 0 28 >
ffff88003de5d600 268738204 C Bi:2:006:5 0 28 = 00000006 0000001c c0f50008 00000000 00000001 55120200 40060000
ffff88004d1b2780 268738257 S Bo:2:006:4 -115 28 = 00000006 0000001c 0008c0f5 00000001 00000001 50100200 00000000
ffff88004d1b2240 268738263 S Bi:2:006:5 -115 16384 <
ffff88004d1b2780 268738301 C Bo:2:006:4 0 28 >
ffff88004d1b2780 268738424 S Bo:2:006:4 -115 65 = 00000006 00000041 0007f27e 00001b27 0000081c 50100200 00000000 17030000
ffff88004d1b2000 268738473 S Bo:2:006:4 -115 417 = 00000006 000001a1 0007f27e 00001b4c 0000081c 50100200 00000000 17030001
ffff88004d1b2780 268738739 C Bo:2:006:4 0 65 >
ffff88004d1b2000 268739029 C Bo:2:006:4 0 417 >
ffff88004d1b2240 268749034 C Bi:2:006:5 0 65 = 00000006 00000041 f27e0007 0000081c 00001cd1 58100200 a84cb7f2 17030000
ffff88004d1b2240 268749111 S Bi:2:006:5 -115 16384 <
ffff88004d1b2240 268749538 C Bi:2:006:5 0 305 = 00000006 00000131 f27e0007 00000841 00001cd1 58100200 a84cb7f2 17030001
ffff88004d1b2240 268749615 S Bi:2:006:5 -115 16384 <
ffff88004d1b2000 268749777 S Bo:2:006:4 -115 65 = 00000006 00000041 0007f27e 00001cd1 00000956 50100200 00000000 15030000
ffff88004d1b2000 268749816 C Bo:2:006:4 0 65 >
ffff88004d1b2240 268750890 C Bi:2:006:5 0 65 = 00000006 00000041 f27e0007 00000956 00001cf6 58100200 a84cb7f2 15030000
ffff88004d1b2240 268750946 S Bi:2:006:5 -115 16384 <
ffff88004d1b2000 268751038 S Bo:2:006:4 -115 28 = 00000006 0000001c 0007f27e 00001cf6 0000097b 50040200 00000000
ffff88004d1b2000 268751082 C Bo:2:006:4 0 28 >
ffff88004d1b2000 268751134 S Bo:2:006:4 -115 68 = 00000006 00000044 0008c0f5 00000001 00000001 50100200 00000000 43464136
ffff88004d1b2780 268751151 S Bo:2:006:4 -115 34 = 00000006 00000022 0008c0f5 00000029 00000001 50100200 00000000 2f444349
ffff88004d1b2000 268751265 C Bo:2:006:4 0 68 >
ffff88004d1b2780 268751613 C Bo:2:006:4 0 34 >
ffff88003de5d180 268796957 S Bo:2:006:4 -115 28 = 00000006 0000001c 0009f27e 00000000 00000000 50020200 00000000
ffff88003de5d180 268796992 C Bo:2:006:4 0 28 >
ffff88004d1b2240 268798134 C Bi:2:006:5 0 28 = 00000006 0000001c f27e0009 00000000 00000001 56120200 40060000
ffff88003de5d180 268798227 S Bo:2:006:4 -115 28 = 00000006 0000001c 0009f27e 00000001 00000001 50100200 00000000
ffff88003de5d900 268798249 S Bi:2:006:5 -115 16384 <
ffff88003de5d180 268798251 C Bo:2:006:4 0 28 >
ffff88003de5d180 268798437 S Bo:2:006:4 -115 312 = 00000006 00000138 0009f27e 00000001 00000001 50100200 00000000 00000118
ffff88003de5d180 268798469 C Bo:2:006:4 0 312 >
ffff88003de5d900 268802683 C Bi:2:006:5 0 32 = 00000006 00000020 f27e0009 00000001 0000011d 58100200 a84cb7f2 00000129
ffff88003de5d900 268802711 S Bi:2:006:5 -115 16384 <
ffff88003de5d900 268803090 C Bi:2:006:5 0 325 = 00000006 00000145 f27e0009 00000005 0000011d 58100200 a84cb7f2 3c3f786d
ffff88003de5d900 268803105 S Bi:2:006:5 -115 16384 <
ffff88003de5d180 268803815 S Bo:2:006:4 -115 4619 = 00000006 0000120b 0009f27e 0000011d 0000012e 50100200 00000000 000011eb
ffff88003de5d180 268803977 C Bo:2:006:4 0 4619 >
ffff88003de5d900 268806842 C Bi:2:006:5 0 32 = 00000006 00000020 f27e0009 0000012e 0000130c 58100200 a84cb7f2 000000ef
ffff88003de5d900 268806886 S Bi:2:006:5 -115 16384 <
ffff88003de5d900 268807236 C Bi:2:006:5 0 267 = 00000006 0000010b f27e0009 00000132 0000130c 58100200 a84cb7f2 3c3f786d
ffff88003de5d900 268807251 S Bi:2:006:5 -115 16384 <
ffff88003de5d180 268807515 S Bo:2:006:4 -115 467 = 00000006 000001d3 0009f27e 0000130c 00000221 50100200 00000000 000001b3
ffff88003de5d180 268807579 C Bo:2:006:4 0 467 >
ffff88003de5d900 268812217 C Bi:2:006:5 0 32 = 00000006 00000020 f27e0009 00000221 000014c3 58100200 a84cb7f2 00000162
ffff88003de5d900 268812316 S Bi:2:006:5 -115 16384 <
ffff88003de5d900 268812622 C Bi:2:006:5 0 382 = 00000006 0000017e f27e0009 00000225 000014c3 58100200 a84cb7f2 3c3f786d
ffff88003de5d900 268812876 S Bi:2:006:5 -115 16384 <
ffff88003de5d180 268815321 S Bo:2:006:4 -115 82 = 00000006 00000052 0009f27e 000014c3 00000387 50100200 00000000 16030000
ffff88003de5d180 268815347 C Bo:2:006:4 0 82 >
ffff88003de5d900 268821765 C Bi:2:006:5 0 107 = 00000006 0000006b f27e0009 00000387 000014f9 58100200 a84cb7f2 16030000
ffff88003de5d900 268821864 S Bi:2:006:5 -115 16384 <
ffff88003de5d900 268822439 C Bi:2:006:5 0 614 = 00000006 00000266 f27e0009 000003d6 000014f9 58100200 a84cb7f2 16030002
ffff88003de5d900 268822511 S Bi:2:006:5 -115 16384 <
ffff88003de5d900 268822776 C Bi:2:006:5 0 42 = 00000006 0000002a f27e0009 00000620 000014f9 58100200 a84cb7f2 16030000
ffff88003de5d900 268822830 S Bi:2:006:5 -115 16384 <
ffff88003de5d900 268823128 C Bi:2:006:5 0 37 = 00000006 00000025 f27e0009 0000062e 000014f9 58100200 a84cb7f2 16030000
ffff88003de5d900 268823181 S Bi:2:006:5 -115 16384 <
ffff88003de5d180 268826943 S Bo:2:006:4 -115 715 = 00000006 000002cb 0009f27e 000014f9 00000637 50100200 00000000 16030002
ffff88003de5d180 268826975 C Bo:2:006:4 0 715 >
ffff88003de5d840 268826977 S Bo:2:006:4 -115 165 = 00000006 000000a5 0009f27e 000017a8 00000637 50100200 00000000 16030000
ffff88003de5d180 268826996 S Bo:2:006:4 -115 295 = 00000006 00000127 0009f27e 00001831 00000637 50100200 00000000 16030001
ffff88004d1fe600 268827014 S Bo:2:006:4 -115 34 = 00000006 00000022 0009f27e 0000193c 00000637 50100200 00000000 14030000
ffff88004d1fe900 268827209 S Bo:2:006:4 -115 97 = 00000006 00000061 0009f27e 00001942 00000637 50100200 00000000 16030000
ffff88003de5d840 268827214 C Bo:2:006:4 0 165 >
ffff88003de5d180 268827738 C Bo:2:006:4 0 295 >
ffff88004d1fe600 268828059 C Bo:2:006:4 0 34 >
ffff88004d1fe900 268828336 C Bo:2:006:4 0 97 >
ffff88003de5d900 268896716 C Bi:2:006:5 0 34 = 00000006 00000022 f27e0009 00000637 00001987 58100200 a84cb7f2 14030000
ffff88004d1fe900 268896818 S Bi:2:006:5 -115 16384 <
ffff88004d1fe600 268896846 S Bo:2:006:4 -115 28 = 00000006 0000001c 0009f27e 00001987 0000063d 50100200 00000000
ffff88004d1fe600 268896859 C Bo:2:006:4 0 28 >
ffff88004d1fe900 268897480 C Bi:2:006:5 0 97 = 00000006 00000061 f27e0009 0000063d 00001987 58100200 a84cb7f2 16030000
ffff88004d1fe900 268897544 S Bi:2:006:5 -115 16384 <
ffff88004d1fe600 268897920 S Bo:2:006:4 -115 438 = 00000006 000001b6 0009f27e 00001987 00000682 50100200 00000000 17030000
ffff88004d1fe600 268897943 C Bo:2:006:4 0 438 >
ffff88004d1fe900 268937282 C Bi:2:006:5 0 65 = 00000006 00000041 f27e0009 00000682 00001b21 58100200 a84cb7f2 17030000
ffff88004d1fe900 268937345 S Bi:2:006:5 -115 16384 <
ffff88004d1fe600 268937364 S Bo:2:006:4 -115 28 = 00000006 0000001c 0009f27e 00001b21 000006a7 50100200 00000000
ffff88004d1fe600 268937382 C Bo:2:006:4 0 28 >
ffff88004d1fe900 268938156 C Bi:2:006:5 0 401 = 00000006 00000191 f27e0009 000006a7 00001b21 58100200 a84cb7f2 17030001
ffff88004d1fe900 268938203 S Bi:2:006:5 -115 16384 <
ffff88004d1fe600 268938359 S Bo:2:006:4 -115 28 = 00000006 0000001c 000ac0f8 00000000 00000000 50020200 00000000
ffff88004d1fe600 268938383 C Bo:2:006:4 0 28 >
ffff88004d1fe900 268939376 C Bi:2:006:5 0 28 = 00000006 0000001c c0f8000a 00000000 00000001 56120200 40060000
ffff88004d1fe900 268939440 S Bo:2:006:4 -115 28 = 00000006 0000001c 000ac0f8 00000001 00000001 50100200 00000000
ffff88004d1fe600 268939453 S Bi:2:006:5 -115 16384 <
ffff88004d1fe900 268939459 C Bo:2:006:4 0 28 >
ffff88004d1fe900 268939515 S Bo:2:006:4 -115 91 = 00000006 0000005b 000ac0f8 00000001 00000001 50100200 00000000 43464136
ffff88004d1fe900 268939632 C Bo:2:006:4 0 91 >
ffff88004d1b2780 268940793 S Ci:2:006:0 s c0 45 0000 0002 0040 64 <
ffff88004d1b2780 268940995 C Ci:2:006:0 0 1 = 03
ffff88004d1fe900 268968011 S Bo:2:006:4 -115 28 = 00000006 0000001c 0009f27e 00001b21 0000081c 50100200 00000000
ffff88004d1fe900 268968050 C Bo:2:006:4 0 28 >
ffff88004d1fe600 268984509 C Bi:2:006:5 0 76 = 00000006 0000004c c0f8000a 00000001 00000040 58100200 a84cb7f2 43464136
ffff88004d1fe600 268984631 S Bi:2:006:5 -115 16384 <
ffff88004d1fe900 268984665 S Bo:2:006:4 -115 28 = 00000006 0000001c 000ac0f8 00000040 00000031 50100200 00000000
ffff88004d1fe900 268984679 C Bo:2:006:4 0 28 >
ffff88004d1fe900 268984723 S Bo:2:006:4 -115 115 = 00000006 00000073 000ac0f8 00000040 00000031 50100200 00000000 43464136
ffff88004d1fe900 268984856 C Bo:2:006:4 0 115 >
ffff88004d1fe600 268989455 C Bi:2:006:5 0 76 = 00000006 0000004c c0f8000a 00000031 00000097 58100200 a84cb7f2 43464136
ffff88004d1fe600 268989553 S Bi:2:006:5 -115 16384 <
ffff88004d1fe900 268989635 S Bo:2:006:4 -115 26963 = 00000006 00006953 000ac0f8 00000097 00000061 50100200 00000000 43464136
ffff88004d1fe900 268990254 C Bo:2:006:4 0 26963 >
ffff88004d1fe600 268993106 C Bi:2:006:5 0 76 = 00000006 0000004c c0f8000a 00000061 000069ce 58100200 a84cb7f2 43464136
ffff88004d1fe600 268993138 S Bi:2:006:5 -115 16384 <
ffff88004d1fe900 268993167 S Bo:2:006:4 -115 76 = 00000006 0000004c 000ac0f8 000069ce 00000091 50100200 00000000 43464136
ffff88004d1fe900 268993186 C Bo:2:006:4 0 76 >
ffff88004d1fe600 268996401 C Bi:2:006:5 0 68 = 00000006 00000044 c0f50008 00000001 0000002f 58100200 a84cb7f2 43464136
ffff88004d1fe600 268996467 S Bi:2:006:5 -115 16384 <
ffff88004d1fe900 268996487 S Bo:2:006:4 -115 28 = 00000006 0000001c 0008c0f5 0000002f 00000029 50100200 00000000
ffff88004d1fe900 268996501 C Bo:2:006:4 0 28 >
ffff88004d1fe600 268997400 C Bi:2:006:5 0 135 = 00000006 00000087 c0f50008 00000029 0000002f 58100200 a84cb7f2 73745f73
ffff88004d1fe600 268997463 S Bi:2:006:5 -115 16384 <
ffff88004d1fe600 269006159 C Bi:2:006:5 0 76 = 00000006 0000004c c0f8000a 00000091 000069fe 58100200 a84cb7f2 43464136
ffff88004d1fe600 269006243 S Bi:2:006:5 -115 16384 <
ffff88004d1fe240 269006433 S Bo:2:006:4 -115 454 = 00000006 000001c6 0009f27e 00001b21 0000081c 50100200 00000000 17030000
ffff88004d1fe300 269006455 S Bo:2:006:4 -115 28 = 00000006 0000001c 000ac0f8 000069fe 000000c1 50040200 00000000
ffff88004d1fe240 269006474 C Bo:2:006:4 0 454 >
ffff88004d1fe300 269007209 C Bo:2:006:4 0 28 >
ffff88004d1fe600 269012059 C Bi:2:006:5 0 65 = 00000006 00000041 f27e0009 0000081c 00001ccb 58100200 a84cb7f2 17030000
ffff88005b9e1f00 269012089 S Bi:2:006:5 -115 16384 <
ffff88005b9e1f00 269012597 C Bi:2:006:5 0 305 = 00000006 00000131 f27e0009 00000841 00001ccb 58100200 a84cb7f2 17030001
ffff88005b9e1f00 269012637 S Bi:2:006:5 -115 16384 <
ffff88005b9e1e40 269012782 S Bo:2:006:4 -115 65 = 00000006 00000041 0009f27e 00001ccb 00000956 50100200 00000000 15030000
ffff88005b9e1e40 269012810 C Bo:2:006:4 0 65 >
ffff88005b9e1f00 269014157 C Bi:2:006:5 0 65 = 00000006 00000041 f27e0009 00000956 00001cf0 58100200 a84cb7f2 15030000
ffff88005b9e1f00 269014186 S Bi:2:006:5 -115 16384 <
ffff88005b9e1d80 269014771 S Bo:2:006:4 -115 28 = 00000006 0000001c 0009f27e 00001cf0 0000097b 50040200 00000000
ffff88005b9e1d80 269014789 C Bo:2:006:4 0 28 >
ffff88005b9e1d80 269027132 S Bo:2:006:4 -115 28 = 00000006 0000001c 0008c0f5 0000002f 00000094 50100200 00000000
ffff88005b9e1d80 269027197 C Bo:2:006:4 0 28 >
ffff88003e2e40c0 269691231 S Bo:2:006:4 -115 28 = 00000006 0000001c 000bf27e 00000000 00000000 50020200 00000000
ffff88003e2e40c0 269691276 C Bo:2:006:4 0 28 >
ffff88005b9e1f00 269693628 C Bi:2:006:5 0 28 = 00000006 0000001c f27e000b 00000000 00000001 58120200 40060000
ffff88003e2e40c0 269693678 S Bo:2:006:4 -115 28 = 00000006 0000001c 000bf27e 00000001 00000001 50100200 00000000
ffff88003e2e4300 269693691 S Bi:2:006:5 -115 16384 <
ffff88003e2e40c0 269693701 C Bo:2:006:4 0 28 >
ffff880067d569c0 269693891 S Bo:2:006:4 -115 358 = 00000006 00000166 000bf27e 00000001 00000001 50100200 00000000 00000146
ffff880067d569c0 269694051 C Bo:2:006:4 0 358 >
ffff88003e2e4300 269702602 C Bi:2:006:5 0 32 = 00000006 00000020 f27e000b 00000001 0000014b 58100200 a84cb7f2 0000014a
ffff880067d569c0 269702658 S Bi:2:006:5 -115 16384 <
ffff880067d569c0 269703028 C Bi:2:006:5 0 358 = 00000006 00000166 f27e000b 00000005 0000014b 58100200 a84cb7f2 3c3f786d
ffff880067d569c0 269703083 S Bi:2:006:5 -115 16384 <
ffff880067d56780 269703206 S Bo:2:006:4 -115 359 = 00000006 00000167 000bf27e 0000014b 0000014f 50100200 00000000 00000147
ffff880067d56780 269703227 C Bo:2:006:4 0 359 >
ffff880067d569c0 269705248 C Bi:2:006:5 0 32 = 00000006 00000020 f27e000b 0000014f 00000296 58100200 a84cb7f2 00000144
ffff880067d569c0 269705270 S Bi:2:006:5 -115 16384 <
ffff880067d569c0 269705630 C Bi:2:006:5 0 352 = 00000006 00000160 f27e000b 00000153 00000296 58100200 a84cb7f2 3c3f786d
ffff880067d569c0 269705682 S Bi:2:006:5 -115 16384 <
ffff880067d56780 269705904 S Bo:2:006:4 -115 362 = 00000006 0000016a 000bf27e 00000296 00000297 50100200 00000000 0000014a
ffff880067d56780 269705930 C Bo:2:006:4 0 362 >
ffff880067d569c0 269707476 C Bi:2:006:5 0 32 = 00000006 00000020 f27e000b 00000297 000003e4 58100200 a84cb7f2 00000146
ffff880067d569c0 269707497 S Bi:2:006:5 -115 16384 <
ffff880067d569c0 269708481 C Bi:2:006:5 0 354 = 00000006 00000162 f27e000b 0000029b 000003e4 58100200 a84cb7f2 3c3f786d
ffff880067d569c0 269708501 S Bi:2:006:5 -115 16384 <
ffff880067d56780 269708661 S Bo:2:006:4 -115 28 = 00000006 0000001c 000cf27e 00000000 00000000 50020200 00000000
ffff880067d56780 269708674 C Bo:2:006:4 0 28 >
ffff880067d569c0 269709674 C Bi:2:006:5 0 28 = 00000006 0000001c f27e000c 00000000 00000001 50120200 40060000
ffff880067d569c0 269709765 S Bo:2:006:4 -115 28 = 00000006 0000001c 000cf27e 00000001 00000001 50100200 00000000
ffff880067d56780 269709772 S Bi:2:006:5 -115 16384 <
ffff880067d569c0 269709782 C Bo:2:006:4 0 28 >
ffff880067d569c0 269709895 S Bo:2:006:4 -115 314 = 00000006 0000013a 000cf27e 00000001 00000001 50100200 00000000 0000011a
ffff880067d569c0 269709959 C Bo:2:006:4 0 314 >
ffff880067d56780 269712701 C Bi:2:006:5 0 32 = 00000006 00000020 f27e000c 00000001 0000011f 58100200 a84cb7f2 00000129
ffff880067d56780 269712743 S Bi:2:006:5 -115 16384 <
ffff880067d56780 269713081 C Bi:2:006:5 0 325 = 00000006 00000145 f27e000c 00000005 0000011f 58100200 a84cb7f2 3c3f786d
ffff880067d56780 269713184 S Bi:2:006:5 -115 16384 <
ffff880067d569c0 269713966 S Bo:2:006:4 -115 4621 = 00000006 0000120d 000cf27e 0000011f 0000012e 50100200 00000000 000011ed
ffff880067d569c0 269714084 C Bo:2:006:4 0 4621 >
ffff880067d56780 269717145 C Bi:2:006:5 0 32 = 00000006 00000020 f27e000c 0000012e 00001310 58100200 a84cb7f2 000000ef
ffff880067d56780 269717221 S Bi:2:006:5 -115 16384 <
ffff880067d56780 269717549 C Bi:2:006:5 0 267 = 00000006 0000010b f27e000c 00000132 00001310 58100200 a84cb7f2 3c3f786d
ffff880067d56780 269717642 S Bi:2:006:5 -115 16384 <
ffff880067d569c0 269717816 S Bo:2:006:4 -115 469 = 00000006 000001d5 000cf27e 00001310 00000221 50100200 00000000 000001b5
ffff880067d569c0 269717840 C Bo:2:006:4 0 469 >
ffff880067d56780 269720088 C Bi:2:006:5 0 32 = 00000006 00000020 f27e000c 00000221 000014c9 58100200 a84cb7f2 00000162
ffff880067d56780 269720245 S Bi:2:006:5 -115 16384 <
ffff880067d56780 269720481 C Bi:2:006:5 0 382 = 00000006 0000017e f27e000c 00000225 000014c9 58100200 a84cb7f2 3c3f786d
ffff880067d56780 269720577 S Bi:2:006:5 -115 16384 <
ffff880067d56600 269723739 S Bo:2:006:4 -115 82 = 00000006 00000052 000cf27e 000014c9 00000387 50100200 00000000 16030000
ffff880067d56600 269723758 C Bo:2:006:4 0 82 >
ffff880067d56780 269730824 C Bi:2:006:5 0 107 = 00000006 0000006b f27e000c 00000387 000014ff 58100200 a84cb7f2 16030000
ffff880067d56780 269730903 S Bi:2:006:5 -115 16384 <
ffff880067d56780 269731260 C Bi:2:006:5 0 614 = 00000006 00000266 f27e000c 000003d6 000014ff 58100200 a84cb7f2 16030002
ffff880067d56780 269731288 S Bi:2:006:5 -115 16384 <
ffff880067d56780 269731596 C Bi:2:006:5 0 42 = 00000006 0000002a f27e000c 00000620 000014ff 58100200 a84cb7f2 16030000
ffff880067d56780 269731624 S Bi:2:006:5 -115 16384 <
ffff880067d56780 269731918 C Bi:2:006:5 0 37 = 00000006 00000025 f27e000c 0000062e 000014ff 58100200 a84cb7f2 16030000
ffff880067d56780 269731945 S Bi:2:006:5 -115 16384 <
ffff880067d56600 269735760 S Bo:2:006:4 -115 715 = 00000006 000002cb 000cf27e 000014ff 00000637 50100200 00000000 16030002
ffff880067d56600 269735785 C Bo:2:006:4 0 715 >
ffff880067d56600 269736002 S Bo:2:006:4 -115 28 = 00000006 0000001c 000bf27e 000003e4 000003e1 50100200 00000000
ffff880067d56b40 269736030 S Bo:2:006:4 -115 165 = 00000006 000000a5 000cf27e 000017ae 00000637 50100200 00000000 16030000
ffff880067d56f00 269736047 S Bo:2:006:4 -115 295 = 00000006 00000127 000cf27e 00001837 00000637 50100200 00000000 16030001
ffff880067d560c0 269736065 S Bo:2:006:4 -115 34 = 00000006 00000022 000cf27e 00001942 00000637 50100200 00000000 14030000
ffff880067d56cc0 269736270 S Bo:2:006:4 -115 97 = 00000006 00000061 000cf27e 00001948 00000637 50100200 00000000 16030000
ffff880067d56600 269736295 C Bo:2:006:4 0 28 >
ffff880067d56b40 269737703 C Bo:2:006:4 0 165 >
ffff880067d56f00 269738228 C Bo:2:006:4 0 295 >
ffff880067d560c0 269738771 C Bo:2:006:4 0 34 >
ffff880067d56cc0 269739325 C Bo:2:006:4 0 97 >
ffff880067d56780 269794797 C Bi:2:006:5 0 34 = 00000006 00000022 f27e000c 00000637 0000198d 58100200 a84cb7f2 14030000
ffff880067d56780 269794873 S Bi:2:006:5 -115 16384 <
ffff880067d56d80 269794895 S Bo:2:006:4 -115 28 = 00000006 0000001c 000cf27e 0000198d 0000063d 50100200 00000000
ffff880067d56d80 269794912 C Bo:2:006:4 0 28 >
ffff880067d56780 269795519 C Bi:2:006:5 0 97 = 00000006 00000061 f27e000c 0000063d 0000198d 58100200 a84cb7f2 16030000
ffff880067d56780 269795585 S Bi:2:006:5 -115 16384 <
ffff880067d56d80 269795700 S Bo:2:006:4 -115 28 = 00000006 0000001c 000bf27e 000003e4 000003e1 50040200 00000000
ffff880067d56d80 269795714 C Bo:2:006:4 0 28 >
ffff880067d56d80 269795956 S Bo:2:006:4 -115 65 = 00000006 00000041 000cf27e 0000198d 00000682 50100200 00000000 17030000
ffff880067d56d80 269795972 C Bo:2:006:4 0 65 >
ffff880067d56d80 269796022 S Bo:2:006:4 -115 417 = 00000006 000001a1 000cf27e 000019b2 00000682 50100200 00000000 17030001
ffff880067d56d80 269796228 C Bo:2:006:4 0 417 >
ffff880067d56780 269844330 C Bi:2:006:5 0 65 = 00000006 00000041 f27e000c 00000682 00001b37 58100200 a84cb7f2 17030000
ffff880067d56780 269844417 S Bi:2:006:5 -115 16384 <
ffff880067d56d80 269844442 S Bo:2:006:4 -115 28 = 00000006 0000001c 000cf27e 00001b37 000006a7 50100200 00000000
ffff880067d56d80 269844452 C Bo:2:006:4 0 28 >
ffff880067d56780 269845226 C Bi:2:006:5 0 417 = 00000006 000001a1 f27e000c 000006a7 00001b37 58100200 a84cb7f2 17030001
ffff880067d56780 269845293 S Bi:2:006:5 -115 16384 <
ffff880067d56d80 269845462 S Bo:2:006:4 -115 28 = 00000006 0000001c 000dc0fc 00000000 00000000 50020200 00000000
ffff880067d56d80 269845472 C Bo:2:006:4 0 28 >
ffff880067d56780 269846468 C Bi:2:006:5 0 28 = 00000006 0000001c c0fc000d 00000000 00000001 58120200 40060000
ffff880067d56780 269846531 S Bo:2:006:4 -115 28 = 00000006 0000001c 000dc0fc 00000001 00000001 50100200 00000000
ffff880067d56d80 269846538 S Bi:2:006:5 -115 16384 <
ffff880067d56780 269846542 C Bo:2:006:4 0 28 >
ffff880067d56780 269846803 S Bo:2:006:4 -115 454 = 00000006 000001c6 000cf27e 00001b37 0000082c 50100200 00000000 17030000
ffff880067d56780 269846829 C Bo:2:006:4 0 454 >
ffff880067d56d80 269919454 C Bi:2:006:5 0 65 = 00000006 00000041 f27e000c 0000082c 00001ce1 58100200 a84cb7f2 17030000
ffff880067d56d80 269919529 S Bi:2:006:5 -115 16384 <
ffff880067d56780 269919564 S Bo:2:006:4 -115 28 = 00000006 0000001c 000cf27e 00001ce1 00000851 50100200 00000000
ffff880067d56780 269919580 C Bo:2:006:4 0 28 >
ffff880067d56d80 269920330 C Bi:2:006:5 0 417 = 00000006 000001a1 f27e000c 00000851 00001ce1 58100200 a84cb7f2 17030001
ffff880067d56d80 269920397 S Bi:2:006:5 -115 16384 <
ffff880067d56780 269920564 S Bo:2:006:4 -115 28 = 00000006 0000001c 000ec0fe 00000000 00000000 50020200 00000000
ffff880067d56780 269920575 C Bo:2:006:4 0 28 >
ffff880067d56d80 269921573 C Bi:2:006:5 0 28 = 00000006 0000001c c0fe000e 00000000 00000001 52120200 40060000
ffff880067d56d80 269921640 S Bo:2:006:4 -115 28 = 00000006 0000001c 000ec0fe 00000001 00000001 50100200 00000000
ffff880067d56780 269921647 S Bi:2:006:5 -115 16384 <
ffff880067d56d80 269921653 C Bo:2:006:4 0 28 >
ffff880067d56f00 269922192 S Bo:2:006:4 -115 454 = 00000006 000001c6 000cf27e 00001ce1 000009d6 50100200 00000000 17030000
ffff880067d56f00 269922216 C Bo:2:006:4 0 454 >
ffff880067d56780 269925393 C Bi:2:006:5 0 65 = 00000006 00000041 f27e000c 000009d6 00001e8b 58100200 a84cb7f2 17030000
ffff880067d56780 269925462 S Bi:2:006:5 -115 16384 <
ffff880067d56780 269925894 C Bi:2:006:5 0 305 = 00000006 00000131 f27e000c 000009fb 00001e8b 58100200 a84cb7f2 17030001
ffff880067d56780 269925960 S Bi:2:006:5 -115 16384 <
ffff880067d56cc0 269926100 S Bo:2:006:4 -115 65 = 00000006 00000041 000cf27e 00001e8b 00000b10 50100200 00000000 15030000
ffff880067d56cc0 269926113 C Bo:2:006:4 0 65 >
ffff880067d56780 269927594 C Bi:2:006:5 0 65 = 00000006 00000041 f27e000c 00000b10 00001eb0 58100200 a84cb7f2 15030000
ffff880067d56780 269927658 S Bi:2:006:5 -115 16384 <
ffff880067d563c0 269927926 S Bo:2:006:4 -115 28 = 00000006 0000001c 000cf27e 00001eb0 00000b35 50040200 00000000
ffff880067d563c0 269927948 C Bo:2:006:4 0 28 >
ffff880067d563c0 269934277 S Bo:2:006:4 -115 32 = 00000006 00000020 000dc0fc 00000001 00000001 50100200 00000000 00000149
ffff880067d563c0 269934300 C Bo:2:006:4 0 32 >
ffff880067d563c0 269934349 S Bo:2:006:4 -115 357 = 00000006 00000165 000dc0fc 00000005 00000001 50100200 00000000 3c3f786d
ffff880067d563c0 269934504 C Bo:2:006:4 0 357 >
ffff880067d563c0 269940908 S Ci:2:006:0 s c0 45 0000 0002 0040 64 <
ffff880067d563c0 269941138 C Ci:2:006:0 0 1 = 03
ffff880067d56780 270075520 C Bi:2:006:5 0 32 = 00000006 00000020 c0fc000d 00000001 0000014e 58100200 a84cb7f2 00001360
ffff880067d56780 270075668 S Bi:2:006:5 -115 16384 <
ffff880067d560c0 270075711 S Bo:2:006:4 -115 28 = 00000006 0000001c 000dc0fc 0000014e 00000005 50100200 00000000
ffff880067d560c0 270075776 C Bo:2:006:4 0 28 >
ffff880067d56780 270076345 C Bi:2:006:5 0 4988 = 00000006 0000137c c0fc000d 00000005 0000014e 58100200 a84cb7f2 3c3f786d
ffff880067d56780 270076486 S Bi:2:006:5 -115 16384 <
ffff880067d56780 270081717 C Bi:2:006:5 0 32 = 00000006 00000020 c0fc000d 00001365 0000014e 58100200 a84cb7f2 000000ea
ffff880067d56780 270081864 S Bi:2:006:5 -115 16384 <
ffff880067d56780 270082128 C Bi:2:006:5 0 262 = 00000006 00000106 c0fc000d 00001369 0000014e 58100200 a84cb7f2 3c3f786d
ffff880067d56780 270082256 S Bi:2:006:5 -115 16384 <
ffff8800662f9c00 270106008 S Bo:2:006:4 -115 28 = 00000006 0000001c 000dc0fc 0000014e 00001453 50100200 00000000
ffff8800662f9c00 270106121 C Bo:2:006:4 0 28 >
ffff88005b9bcb40 270940819 S Ci:2:006:0 s c0 45 0000 0002 0040 64 <
ffff88005b9bcb40 270941316 C Ci:2:006:0 0 1 = 03
ffff88003e291e40 271940880 S Ci:2:006:0 s c0 45 0000 0002 0040 64 <
ffff88003e291e40 271941313 C Ci:2:006:0 0 1 = 03
ffff88003e0e66c0 272940884 S Ci:2:006:0 s c0 45 0000 0002 0040 64 <
ffff88003e0e66c0 272941321 C Ci:2:006:0 0 1 = 03
ffff880050e99780 273940817 S Ci:2:006:0 s c0 45 0000 0002 0040 64 <
ffff880050e99780 273941342 C Ci:2:006:0 0 1 = 03
ffff880050d30cc0 274940879 S Ci:2:006:0 s c0 45 0000 0002 0040 64 <
ffff880050d30cc0 274941450 C Ci:2:006:0 0 1 = 03
ffff88007b827780 275940832 S Ci:2:006:0 s c0 45 0000 0002 0040 64 <
ffff88007b827780 275941326 C Ci:2:006:0 0 1 = 03
ffff88003ddd70c0 276940844 S Ci:2:006:0 s c0 45 0000 0002 0040 64 <
ffff88003ddd70c0 276941409 C Ci:2:006:0 0 1 = 03
ffff88007b827780 277940860 S Ci:2:006:0 s c0 45 0000 0002 0040 64 <
ffff88007b827780 277941427 C Ci:2:006:0 0 1 = 03
ffff880050c26300 278940843 S Ci:2:006:0 s c0 45 0000 0002 0040 64 <
ffff880050c26300 278941359 C Ci:2:006:0 0 1 = 03
ffff88005ba87900 279940816 S Ci:2:006:0 s c0 45 0000 0002 0040 64 <
ffff88005ba87900 279941553 C Ci:2:006:0 0 1 = 03
ffff88003dcba300 280940844 S Ci:2:006:0 s c0 45 0000 0002 0040 64 <
ffff88003dcba300 280941322 C Ci:2:006:0 0 1 = 03
ffff88005ba87000 281940867 S Ci:2:006:0 s c0 45 0000 0002 0040 64 <
ffff88005ba87000 281941425 C Ci:2:006:0 0 1 = 03
ffff880067c01000 282940851 S Ci:2:006:0 s c0 45 0000 0002 0040 64 <
ffff880067c01000 282941390 C Ci:2:006:0 0 1 = 03
ffff88005ba87600 283940889 S Ci:2:006:0 s c0 45 0000 0002 0040 64 <
ffff88005ba87600 283941458 C Ci:2:006:0 0 1 = 03
ffff88004d0ad9c0 284940804 S Ci:2:006:0 s c0 45 0000 0002 0040 64 <
ffff88004d0ad9c0 284941312 C Ci:2:006:0 0 1 = 03
ffff88003e292540 285940864 S Ci:2:006:0 s c0 45 0000 0002 0040 64 <
ffff88003e292540 285941124 C Ci:2:006:0 0 1 = 03
ffff88005b9e1480 286940830 S Ci:2:006:0 s c0 45 0000 0002 0040 64 <
ffff88005b9e1480 286941364 C Ci:2:006:0 0 1 = 03
ffff88004d1b2300 287940810 S Ci:2:006:0 s c0 45 0000 0002 0040 64 <
ffff88004d1b2300 287941286 C Ci:2:006:0 0 1 = 03
ffff88004d1c2540 288940885 S Ci:2:006:0 s c0 45 0000 0002 0040 64 <
ffff88004d1c2540 288941385 C Ci:2:006:0 0 1 = 03
ffff88004d2213c0 289940816 S Ci:2:006:0 s c0 45 0000 0002 0040 64 <
ffff88004d2213c0 289941437 C Ci:2:006:0 0 1 = 03
ffff88004d1fe000 290940873 S Ci:2:006:0 s c0 45 0000 0002 0040 64 <
ffff88004d1fe000 290941356 C Ci:2:006:0 0 1 = 03
ffff88004d1fe000 291940804 S Ci:2:006:0 s c0 45 0000 0002 0040 64 <
ffff88004d1fe000 291941318 C Ci:2:006:0 0 1 = 03
ffff88004d1fe000 292940863 S Ci:2:006:0 s c0 45 0000 0002 0040 64 <
ffff88004d1fe000 292941369 C Ci:2:006:0 0 1 = 03
ffff88004d1fe000 293940866 S Ci:2:006:0 s c0 45 0000 0002 0040 64 <
ffff88004d1fe000 293941369 C Ci:2:006:0 0 1 = 03
ffff88004d1fe000 294940883 S Ci:2:006:0 s c0 45 0000 0002 0040 64 <
ffff88004d1fe000 294941474 C Ci:2:006:0 0 1 = 03
ffff88004d1fe000 295940888 S Ci:2:006:0 s c0 45 0000 0002 0040 64 <
ffff88004d1fe000 295941403 C Ci:2:006:0 0 1 = 03
ffff88004d1fe000 296940852 S Ci:2:006:0 s c0 45 0000 0002 0040 64 <
ffff88004d1fe000 296941407 C Ci:2:006:0 0 1 = 03
ffff88004d1fe000 297940878 S Ci:2:006:0 s c0 45 0000 0002 0040 64 <
ffff88004d1fe000 297941357 C Ci:2:006:0 0 1 = 03
ffff88004d1fe000 298940849 S Ci:2:006:0 s c0 45 0000 0002 0040 64 <
ffff88004d1fe000 298941451 C Ci:2:006:0 0 1 = 03
ffff88004d1fe000 299940848 S Ci:2:006:0 s c0 45 0000 0002 0040 64 <
ffff88004d1fe000 299941428 C Ci:2:006:0 0 1 = 03
ffff88004d1fe000 300940830 S Ci:2:006:0 s c0 45 0000 0002 0040 64 <
ffff88004d1fe000 300941318 C Ci:2:006:0 0 1 = 03
ffff88004d1fe000 301940845 S Ci:2:006:0 s c0 45 0000 0002 0040 64 <
ffff88004d1fe000 301941140 C Ci:2:006:0 0 1 = 03
ffff88004d1fe000 302940819 S Ci:2:006:0 s c0 45 0000 0002 0040 64 <
ffff88004d1fe000 302941376 C Ci:2:006:0 0 1 = 03
ffff88004d1fe000 303940836 S Ci:2:006:0 s c0 45 0000 0002 0040 64 <
ffff88004d1fe000 303941327 C Ci:2:006:0 0 1 = 03
ffff88004d1fe000 304940833 S Ci:2:006:0 s c0 45 0000 0002 0040 64 <
ffff88004d1fe000 304941309 C Ci:2:006:0 0 1 = 03
ffff88004d1fe000 305940851 S Ci:2:006:0 s c0 45 0000 0002 0040 64 <
ffff88004d1fe000 305941364 C Ci:2:006:0 0 1 = 03
ffff88004d1fe000 306940827 S Ci:2:006:0 s c0 45 0000 0002 0040 64 <
ffff88004d1fe000 306941387 C Ci:2:006:0 0 1 = 03
ffff88005bbf99c0 307940857 S Ci:2:006:0 s c0 45 0000 0002 0040 64 <
ffff88005bbf99c0 307941347 C Ci:2:006:0 0 1 = 03
ffff88005bbf99c0 308940805 S Ci:2:006:0 s c0 45 0000 0002 0040 64 <
ffff88005bbf99c0 308941245 C Ci:2:006:0 0 1 = 03
ffff88005bbf99c0 309940837 S Ci:2:006:0 s c0 45 0000 0002 0040 64 <
ffff88005bbf99c0 309941400 C Ci:2:006:0 0 1 = 03
ffff88005bbf99c0 310940864 S Ci:2:006:0 s c0 45 0000 0002 0040 64 <
ffff88005bbf99c0 310941335 C Ci:2:006:0 0 1 = 03
ffff88005bbf99c0 311940845 S Ci:2:006:0 s c0 45 0000 0002 0040 64 <
ffff88005bbf99c0 311941349 C Ci:2:006:0 0 1 = 03
ffff88005bbf9180 312940869 S Ci:2:006:0 s c0 45 0000 0002 0040 64 <
ffff88005bbf9180 312941432 C Ci:2:006:0 0 1 = 03
ffff88005bbf9180 313940862 S Ci:2:006:0 s c0 45 0000 0002 0040 64 <
ffff88005bbf9180 313941364 C Ci:2:006:0 0 1 = 03
ffff88005bbf9540 314940863 S Ci:2:006:0 s c0 45 0000 0002 0040 64 <
ffff88005bbf9540 314941368 C Ci:2:006:0 0 1 = 03
ffff88005bbf9540 315940861 S Ci:2:006:0 s c0 45 0000 0002 0040 64 <
ffff88005bbf9540 315941359 C Ci:2:006:0 0 1 = 03
ffff88005bbf9540 316940842 S Ci:2:006:0 s c0 45 0000 0002 0040 64 <
ffff88005bbf9540 316941342 C Ci:2:006:0 0 1 = 03
ffff88005bbf9540 317940853 S Ci:2:006:0 s c0 45 0000 0002 0040 64 <
ffff88005bbf9540 317941432 C Ci:2:006:0 0 1 = 03
ffff88005bbf9540 318940810 S Ci:2:006:0 s c0 45 0000 0002 0040 64 <
ffff88005bbf9540 318941296 C Ci:2:006:0 0 1 = 03
ffff88005bbf9540 319940877 S Ci:2:006:0 s c0 45 0000 0002 0040 64 <
ffff88005bbf9540 319941427 C Ci:2:006:0 0 1 = 03
ffff88005bbf9540 320940866 S Ci:2:006:0 s c0 45 0000 0002 0040 64 <
ffff88005bbf9540 320941326 C Ci:2:006:0 0 1 = 03
ffff88005bbf9540 321940854 S Ci:2:006:0 s c0 45 0000 0002 0040 64 <
ffff88005bbf9540 321941433 C Ci:2:006:0 0 1 = 03
ffff88005bbf9540 322940856 S Ci:2:006:0 s c0 45 0000 0002 0040 64 <
ffff88005bbf9540 322941365 C Ci:2:006:0 0 1 = 03
ffff88005bbf9540 323940838 S Ci:2:006:0 s c0 45 0000 0002 0040 64 <
ffff88005bbf9540 323941314 C Ci:2:006:0 0 1 = 03
ffff88005bbf9540 324940846 S Ci:2:006:0 s c0 45 0000 0002 0040 64 <
ffff88005bbf9540 324941381 C Ci:2:006:0 0 1 = 03
ffff88005bbf9540 325940837 S Ci:2:006:0 s c0 45 0000 0002 0040 64 <
ffff88005bbf9540 325941359 C Ci:2:006:0 0 1 = 03
ffff88005bbf9540 326940867 S Ci:2:006:0 s c0 45 0000 0002 0040 64 <
ffff88005bbf9540 326941408 C Ci:2:006:0 0 1 = 03
ffff88005bbf9540 327940862 S Ci:2:006:0 s c0 45 0000 0002 0040 64 <
ffff88005bbf9540 327941401 C Ci:2:006:0 0 1 = 03
ffff88004d227240 328211118 S Bo:2:006:4 -115 28 = 00000006 0000001c 000ff27e 00000000 00000000 50020200 00000000
ffff88004d227240 328211202 C Bo:2:006:4 0 28 >
ffff880067d56780 328213509 C Bi:2:006:5 0 28 = 00000006 0000001c f27e000f 00000000 00000001 5b120200 40060000
ffff88003e2e5a80 328213616 S Bo:2:006:4 -115 28 = 00000006 0000001c 000ff27e 00000001 00000001 50100200 00000000
ffff88003e2e5a80 328213643 C Bo:2:006:4 0 28 >
ffff88003e2e5cc0 328213650 S Bi:2:006:5 -115 16384 <
ffff88004d227000 328213932 S Bo:2:006:4 -115 311 = 00000006 00000137 000ff27e 00000001 00000001 50100200 00000000 00000117
ffff88004d227000 328214001 C Bo:2:006:4 0 311 >
ffff88003e2e5cc0 328222167 C Bi:2:006:5 0 32 = 00000006 00000020 f27e000f 00000001 0000011c 58100200 a84cb7f2 00000129
ffff88004d227000 328222281 S Bi:2:006:5 -115 16384 <
ffff88004d227000 328222575 C Bi:2:006:5 0 325 = 00000006 00000145 f27e000f 00000005 0000011c 58100200 a84cb7f2 3c3f786d
ffff88004d227000 328222628 S Bi:2:006:5 -115 16384 <
ffff88004d2276c0 328223311 S Bo:2:006:4 -115 4618 = 00000006 0000120a 000ff27e 0000011c 0000012e 50100200 00000000 000011ea
ffff88004d2276c0 328223455 C Bo:2:006:4 0 4618 >
ffff88004d227000 328230007 C Bi:2:006:5 0 32 = 00000006 00000020 f27e000f 0000012e 0000130a 58100200 a84cb7f2 000000ef
ffff88004d227000 328230061 S Bi:2:006:5 -115 16384 <
ffff88004d227000 328230778 C Bi:2:006:5 0 267 = 00000006 0000010b f27e000f 00000132 0000130a 58100200 a84cb7f2 3c3f786d
ffff88004d227000 328233997 S Bi:2:006:5 -115 16384 <
ffff88004d2276c0 328234344 S Bo:2:006:4 -115 466 = 00000006 000001d2 000ff27e 0000130a 00000221 50100200 00000000 000001b2
ffff88004d2276c0 328234417 C Bo:2:006:4 0 466 >
ffff88004d227000 328238575 C Bi:2:006:5 0 32 = 00000006 00000020 f27e000f 00000221 000014c0 58100200 a84cb7f2 00000162
ffff88004d227000 328238643 S Bi:2:006:5 -115 16384 <
ffff88004d227000 328239300 C Bi:2:006:5 0 382 = 00000006 0000017e f27e000f 00000225 000014c0 58100200 a84cb7f2 3c3f786d
ffff88004d227000 328239351 S Bi:2:006:5 -115 16384 <
ffff88004d2276c0 328241076 S Bo:2:006:4 -115 82 = 00000006 00000052 000ff27e 000014c0 00000387 50100200 00000000 16030000
ffff88004d2276c0 328241089 C Bo:2:006:4 0 82 >
ffff88004d227000 328304573 C Bi:2:006:5 0 107 = 00000006 0000006b f27e000f 00000387 000014f6 58100200 a84cb7f2 16030000
ffff88003e2e5a80 328304704 S Bi:2:006:5 -115 16384 <
ffff88003e2e5d80 328304755 S Bo:2:006:4 -115 28 = 00000006 0000001c 000ff27e 000014f6 000003d6 50100200 00000000
ffff88003e2e5d80 328304814 C Bo:2:006:4 0 28 >
ffff88003e2e5a80 328305303 C Bi:2:006:5 0 614 = 00000006 00000266 f27e000f 000003d6 000014f6 58100200 a84cb7f2 16030002
ffff88003e2e5a80 328305352 S Bi:2:006:5 -115 16384 <
ffff88003e2e5a80 328305638 C Bi:2:006:5 0 42 = 00000006 0000002a f27e000f 00000620 000014f6 58100200 a84cb7f2 16030000
ffff88003e2e5a80 328305684 S Bi:2:006:5 -115 16384 <
ffff88003e2e5a80 328306059 C Bi:2:006:5 0 37 = 00000006 00000025 f27e000f 0000062e 000014f6 58100200 a84cb7f2 16030000
ffff88003e2e5a80 328306133 S Bi:2:006:5 -115 16384 <
ffff88004d2276c0 328312256 S Bo:2:006:4 -115 715 = 00000006 000002cb 000ff27e 000014f6 00000637 50100200 00000000 16030002
ffff88004d227d80 328312278 S Bo:2:006:4 -115 165 = 00000006 000000a5 000ff27e 000017a5 00000637 50100200 00000000 16030000
ffff88004d227840 328312291 S Bo:2:006:4 -115 295 = 00000006 00000127 000ff27e 0000182e 00000637 50100200 00000000 16030001
ffff88004d227900 328312303 S Bo:2:006:4 -115 34 = 00000006 00000022 000ff27e 00001939 00000637 50100200 00000000 14030000
ffff88004d227c00 328312492 S Bo:2:006:4 -115 97 = 00000006 00000061 000ff27e 0000193f 00000637 50100200 00000000 16030000
ffff88004d2276c0 328312531 C Bo:2:006:4 0 715 >
ffff88004d227d80 328312856 C Bo:2:006:4 0 165 >
ffff88004d227840 328313549 C Bo:2:006:4 0 295 >
ffff88004d227900 328314135 C Bo:2:006:4 0 34 >
ffff88004d227c00 328314630 C Bo:2:006:4 0 97 >
ffff88003e2e5a80 328362889 C Bi:2:006:5 0 34 = 00000006 00000022 f27e000f 00000637 00001984 58100200 a84cb7f2 14030000
ffff88004d227c00 328362979 S Bi:2:006:5 -115 16384 <
ffff88004d227900 328363009 S Bo:2:006:4 -115 28 = 00000006 0000001c 000ff27e 00001984 0000063d 50100200 00000000
ffff88004d227900 328363027 C Bo:2:006:4 0 28 >
ffff88004d227c00 328363605 C Bi:2:006:5 0 97 = 00000006 00000061 f27e000f 0000063d 00001984 58100200 a84cb7f2 16030000
ffff88004d227c00 328363650 S Bi:2:006:5 -115 16384 <
ffff88004d227900 328363833 S Bo:2:006:4 -115 65 = 00000006 00000041 000ff27e 00001984 00000682 50100200 00000000 17030000
ffff88004d227840 328363862 S Bo:2:006:4 -115 401 = 00000006 00000191 000ff27e 000019a9 00000682 50100200 00000000 17030001
ffff88004d227900 328363891 C Bo:2:006:4 0 65 >
ffff88004d227840 328364038 C Bo:2:006:4 0 401 >
ffff88004d227c00 328373655 C Bi:2:006:5 0 65 = 00000006 00000041 f27e000f 00000682 00001b1e 58100200 a84cb7f2 17030000
ffff88004d227c00 328373714 S Bi:2:006:5 -115 16384 <
ffff88004d227c00 328374327 C Bi:2:006:5 0 625 = 00000006 00000271 f27e000f 000006a7 00001b1e 58100200 a84cb7f2 17030002
ffff88004d227c00 328374389 S Bi:2:006:5 -115 16384 <
ffff88004d227840 328374659 S Bo:2:006:4 -115 65 = 00000006 00000041 000ff27e 00001b1e 000008fc 50100200 00000000 17030000
ffff88004d227900 328374701 S Bo:2:006:4 -115 417 = 00000006 000001a1 000ff27e 00001b43 000008fc 50100200 00000000 17030001
ffff88004d227840 328374732 C Bo:2:006:4 0 65 >
ffff88004d227900 328374860 C Bo:2:006:4 0 417 >
ffff88004d227c00 328376785 C Bi:2:006:5 0 65 = 00000006 00000041 f27e000f 000008fc 00001cc8 58100200 a84cb7f2 17030000
ffff88004d227c00 328376851 S Bi:2:006:5 -115 16384 <
ffff88004d227c00 328377258 C Bi:2:006:5 0 305 = 00000006 00000131 f27e000f 00000921 00001cc8 58100200 a84cb7f2 17030001
ffff88004d227c00 328377297 S Bi:2:006:5 -115 16384 <
ffff88004d227900 328377419 S Bo:2:006:4 -115 65 = 00000006 00000041 000ff27e 00001cc8 00000a36 50100200 00000000 15030000
ffff88004d227900 328377443 C Bo:2:006:4 0 65 >
ffff88004d227c00 328378469 C Bi:2:006:5 0 65 = 00000006 00000041 f27e000f 00000a36 00001ced 58100200 a84cb7f2 15030000
ffff88004d227c00 328378489 S Bi:2:006:5 -115 16384 <
ffff88004d227900 328378594 S Bo:2:006:4 -115 28 = 00000006 0000001c 000ff27e 00001ced 00000a5b 50040200 00000000
ffff88004d227900 328378609 C Bo:2:006:4 0 28 >
ffff88005bbf9540 328940865 S Ci:2:006:0 s c0 45 0000 0002 0040 64 <
ffff88005bbf9540 328941363 C Ci:2:006:0 0 1 = 03
ffff88005bbf9540 329944841 S Ci:2:006:0 s c0 45 0000 0002 0040 64 <
ffff88005bbf9540 329945316 C Ci:2:006:0 0 1 = 03
ffff88005bbf9540 330942653 S Ci:2:006:0 s c0 45 0000 0002 0040 64 <
ffff88005bbf9540 330943180 C Ci:2:006:0 0 1 = 03
ffff88005bbf9540 331940893 S Ci:2:006:0 s c0 45 0000 0002 0040 64 <
ffff88005bbf9540 331941406 C Ci:2:006:0 0 1 = 03
ffff88005bbf9540 332940805 S Ci:2:006:0 s c0 45 0000 0002 0040 64 <
ffff88005bbf9540 332941288 C Ci:2:006:0 0 1 = 03
ffff88005bbf9540 333940864 S Ci:2:006:0 s c0 45 0000 0002 0040 64 <
ffff88005bbf9540 333941379 C Ci:2:006:0 0 1 = 03
ffff88005bbf9540 334940855 S Ci:2:006:0 s c0 45 0000 0002 0040 64 <
ffff88005bbf9540 334941432 C Ci:2:006:0 0 1 = 03
ffff88005bbf9540 335940850 S Ci:2:006:0 s c0 45 0000 0002 0040 64 <
ffff88005bbf9540 335941334 C Ci:2:006:0 0 1 = 03
ffff88005bbf9540 336940856 S Ci:2:006:0 s c0 45 0000 0002 0040 64 <
ffff88005bbf9540 336941388 C Ci:2:006:0 0 1 = 03
ffff88005bbf9cc0 337940909 S Ci:2:006:0 s c0 45 0000 0002 0040 64 <
ffff88005bbf9cc0 337941380 C Ci:2:006:0 0 1 = 03
ffff88005bbf9cc0 338940878 S Ci:2:006:0 s c0 45 0000 0002 0040 64 <
ffff88005bbf9cc0 338941431 C Ci:2:006:0 0 1 = 03
ffff88005bbf9cc0 339940904 S Ci:2:006:0 s c0 45 0000 0002 0040 64 <
ffff88005bbf9cc0 339941410 C Ci:2:006:0 0 1 = 03
ffff88005bbf9cc0 340940867 S Ci:2:006:0 s c0 45 0000 0002 0040 64 <
ffff88005bbf9cc0 340941352 C Ci:2:006:0 0 1 = 03
ffff88005bbf9cc0 341940872 S Ci:2:006:0 s c0 45 0000 0002 0040 64 <
ffff88005bbf9cc0 341941389 C Ci:2:006:0 0 1 = 03
ffff88005bbf9cc0 342940848 S Ci:2:006:0 s c0 45 0000 0002 0040 64 <
ffff88005bbf9cc0 342941377 C Ci:2:006:0 0 1 = 03
ffff88005bbf9cc0 343940887 S Ci:2:006:0 s c0 45 0000 0002 0040 64 <
ffff88005bbf9cc0 343941367 C Ci:2:006:0 0 1 = 03
ffff88005bbf9cc0 344940863 S Ci:2:006:0 s c0 45 0000 0002 0040 64 <
ffff88005bbf9cc0 344941391 C Ci:2:006:0 0 1 = 03
ffff88005bbf9cc0 345940831 S Ci:2:006:0 s c0 45 0000 0002 0040 64 <
ffff88005bbf9cc0 345941333 C Ci:2:006:0 0 1 = 03
ffff88005bbf9cc0 346940886 S Ci:2:006:0 s c0 45 0000 0002 0040 64 <
ffff88005bbf9cc0 346941463 C Ci:2:006:0 0 1 = 03
ffff88005bbf9cc0 347940874 S Ci:2:006:0 s c0 45 0000 0002 0040 64 <
ffff88005bbf9cc0 347941365 C Ci:2:006:0 0 1 = 03
ffff88005bbf9cc0 348940880 S Ci:2:006:0 s c0 45 0000 0002 0040 64 <
ffff88005bbf9cc0 348941369 C Ci:2:006:0 0 1 = 03
ffff88005bbf9cc0 349940850 S Ci:2:006:0 s c0 45 0000 0002 0040 64 <
ffff88005bbf9cc0 349941355 C Ci:2:006:0 0 1 = 03
ffff88005bbf9cc0 350940848 S Ci:2:006:0 s c0 45 0000 0002 0040 64 <
ffff88005bbf9cc0 350941432 C Ci:2:006:0 0 1 = 03
ffff88005bbf9cc0 351940864 S Ci:2:006:0 s c0 45 0000 0002 0040 64 <
ffff88005bbf9cc0 351941453 C Ci:2:006:0 0 1 = 03
ffff88005bbf9cc0 352940858 S Ci:2:006:0 s c0 45 0000 0002 0040 64 <
ffff88005bbf9cc0 352941418 C Ci:2:006:0 0 1 = 03
ffff88005bbf9300 353940839 S Ci:2:006:0 s c0 45 0000 0002 0040 64 <
ffff88005bbf9300 353941289 C Ci:2:006:0 0 1 = 03
ffff88005bbf9cc0 354940875 S Ci:2:006:0 s c0 45 0000 0002 0040 64 <
ffff88005bbf9cc0 354941360 C Ci:2:006:0 0 1 = 03
ffff88005bbf9cc0 355940894 S Ci:2:006:0 s c0 45 0000 0002 0040 64 <
ffff88005bbf9cc0 355941355 C Ci:2:006:0 0 1 = 03
ffff88005bbf9cc0 356940794 S Ci:2:006:0 s c0 45 0000 0002 0040 64 <
ffff88005bbf9cc0 356941311 C Ci:2:006:0 0 1 = 03
ffff88005bbf9cc0 357940855 S Ci:2:006:0 s c0 45 0000 0002 0040 64 <
ffff88005bbf9cc0 357941428 C Ci:2:006:0 0 1 = 03
ffff88005bbf9cc0 358940870 S Ci:2:006:0 s c0 45 0000 0002 0040 64 <
ffff88005bbf9cc0 358941399 C Ci:2:006:0 0 1 = 03
ffff88005bbf9cc0 359940860 S Ci:2:006:0 s c0 45 0000 0002 0040 64 <
ffff88005bbf9cc0 359941367 C Ci:2:006:0 0 1 = 03
ffff88005bbf9cc0 360940846 S Ci:2:006:0 s c0 45 0000 0002 0040 64 <
ffff88005bbf9cc0 360941335 C Ci:2:006:0 0 1 = 03
ffff88005bbf9cc0 361940839 S Ci:2:006:0 s c0 45 0000 0002 0040 64 <
ffff88005bbf9cc0 361941386 C Ci:2:006:0 0 1 = 03
ffff88005bbf9cc0 362940942 S Ci:2:006:0 s c0 45 0000 0002 0040 64 <
ffff88005bbf9cc0 362941415 C Ci:2:006:0 0 1 = 03
ffff88005bbf9cc0 363940858 S Ci:2:006:0 s c0 45 0000 0002 0040 64 <
ffff88005bbf9cc0 363941350 C Ci:2:006:0 0 1 = 03
ffff88005bbf9cc0 364940880 S Ci:2:006:0 s c0 45 0000 0002 0040 64 <
ffff88005bbf9cc0 364941377 C Ci:2:006:0 0 1 = 03
ffff88005bbf9cc0 365940841 S Ci:2:006:0 s c0 45 0000 0002 0040 64 <
ffff88005bbf9cc0 365941322 C Ci:2:006:0 0 1 = 03
ffff88005bbf9cc0 366940919 S Ci:2:006:0 s c0 45 0000 0002 0040 64 <
ffff88005bbf9cc0 366941741 C Ci:2:006:0 0 1 = 03
ffff88005bbf9cc0 367940860 S Ci:2:006:0 s c0 45 0000 0002 0040 64 <
ffff88005bbf9cc0 367941369 C Ci:2:006:0 0 1 = 03
ffff88005bbf9cc0 368940875 S Ci:2:006:0 s c0 45 0000 0002 0040 64 <
ffff88005bbf9cc0 368941381 C Ci:2:006:0 0 1 = 03
ffff88005bbf9cc0 369940867 S Ci:2:006:0 s c0 45 0000 0002 0040 64 <
ffff88005bbf9cc0 369941404 C Ci:2:006:0 0 1 = 03
ffff88005bbf9cc0 370940805 S Ci:2:006:0 s c0 45 0000 0002 0040 64 <
ffff88005bbf9cc0 370941292 C Ci:2:006:0 0 1 = 03
ffff88005bbf9cc0 371940865 S Ci:2:006:0 s c0 45 0000 0002 0040 64 <
ffff88005bbf9cc0 371941351 C Ci:2:006:0 0 1 = 03
ffff88005bbf9300 372940843 S Ci:2:006:0 s c0 45 0000 0002 0040 64 <
ffff88005bbf9300 372941405 C Ci:2:006:0 0 1 = 03
ffff88005bbf9300 373940856 S Ci:2:006:0 s c0 45 0000 0002 0040 64 <
ffff88005bbf9300 373941348 C Ci:2:006:0 0 1 = 03
ffff88005bbf9300 374940891 S Ci:2:006:0 s c0 45 0000 0002 0040 64 <
ffff88005bbf9300 374941393 C Ci:2:006:0 0 1 = 03
ffff88005bbf9300 375940859 S Ci:2:006:0 s c0 45 0000 0002 0040 64 <
ffff88005bbf9300 375941332 C Ci:2:006:0 0 1 = 03
ffff88005bbf9300 376940915 S Ci:2:006:0 s c0 45 0000 0002 0040 64 <
ffff88005bbf9300 376941396 C Ci:2:006:0 0 1 = 03
ffff88005bbf9300 377940868 S Ci:2:006:0 s c0 45 0000 0002 0040 64 <
ffff88005bbf9300 377941376 C Ci:2:006:0 0 1 = 03
ffff88005bbf9300 378940872 S Ci:2:006:0 s c0 45 0000 0002 0040 64 <
ffff88005bbf9300 378941344 C Ci:2:006:0 0 1 = 03
ffff88005bbf9300 379940851 S Ci:2:006:0 s c0 45 0000 0002 0040 64 <
ffff88005bbf9300 379941324 C Ci:2:006:0 0 1 = 03
ffff88005bbf9300 380940836 S Ci:2:006:0 s c0 45 0000 0002 0040 64 <
ffff88005bbf9300 380941350 C Ci:2:006:0 0 1 = 03
ffff88005bbf9300 381940863 S Ci:2:006:0 s c0 45 0000 0002 0040 64 <
ffff88005bbf9300 381941369 C Ci:2:006:0 0 1 = 03
ffff88005bbf9300 382940888 S Ci:2:006:0 s c0 45 0000 0002 0040 64 <
ffff88005bbf9300 382941382 C Ci:2:006:0 0 1 = 03
ffff88005bbf9300 383940871 S Ci:2:006:0 s c0 45 0000 0002 0040 64 <
ffff88005bbf9300 383941305 C Ci:2:006:0 0 1 = 03
ffff88005bbf9300 384940882 S Ci:2:006:0 s c0 45 0000 0002 0040 64 <
ffff88005bbf9300 384941325 C Ci:2:006:0 0 1 = 03
ffff88005ba87d80 385940874 S Ci:2:006:0 s c0 45 0000 0002 0040 64 <
ffff88005ba87d80 385941376 C Ci:2:006:0 0 1 = 03
ffff88005ba87d80 386940907 S Ci:2:006:0 s c0 45 0000 0002 0040 64 <
ffff88005ba87d80 386941413 C Ci:2:006:0 0 1 = 03
ffff88005ba87d80 387940852 S Ci:2:006:0 s c0 45 0000 0002 0040 64 <
ffff88005ba87d80 387941407 C Ci:2:006:0 0 1 = 03
ffff880050e69b40 388212273 S Bo:2:006:4 -115 28 = 00000006 0000001c 0010f27e 00000000 00000000 50020200 00000000
ffff880050e69b40 388212319 C Bo:2:006:4 0 28 >
ffff88004d227c00 388214590 C Bi:2:006:5 0 28 = 00000006 0000001c f27e0010 00000000 00000001 58120200 40060000
ffff88003e2e5d80 388214621 S Bo:2:006:4 -115 28 = 00000006 0000001c 0010f27e 00000001 00000001 50100200 00000000
ffff88003e2e5a80 388214627 S Bi:2:006:5 -115 16384 <
ffff88003e2e5d80 388214636 C Bo:2:006:4 0 28 >
ffff880050e69600 388214793 S Bo:2:006:4 -115 311 = 00000006 00000137 0010f27e 00000001 00000001 50100200 00000000 00000117
ffff880050e69600 388215002 C Bo:2:006:4 0 311 >
ffff88003e2e5a80 388221010 C Bi:2:006:5 0 32 = 00000006 00000020 f27e0010 00000001 0000011c 58100200 a84cb7f2 00000129
ffff88003e2e5a80 388221039 S Bi:2:006:5 -115 16384 <
ffff88003e2e5a80 388221818 C Bi:2:006:5 0 325 = 00000006 00000145 f27e0010 00000005 0000011c 58100200 a84cb7f2 3c3f786d
ffff88003e2e5a80 388221843 S Bi:2:006:5 -115 16384 <
ffff880050e690c0 388222588 S Bo:2:006:4 -115 4618 = 00000006 0000120a 0010f27e 0000011c 0000012e 50100200 00000000 000011ea
ffff880050e690c0 388222716 C Bo:2:006:4 0 4618 >
ffff88003e2e5a80 388226113 C Bi:2:006:5 0 32 = 00000006 00000020 f27e0010 0000012e 0000130a 58100200 a84cb7f2 000000ef
ffff880050e690c0 388226175 S Bi:2:006:5 -115 16384 <
ffff880050e690c0 388226532 C Bi:2:006:5 0 267 = 00000006 0000010b f27e0010 00000132 0000130a 58100200 a84cb7f2 3c3f786d
ffff880050e690c0 388226569 S Bi:2:006:5 -115 16384 <
ffff88003e2e5d80 388226772 S Bo:2:006:4 -115 466 = 00000006 000001d2 0010f27e 0000130a 00000221 50100200 00000000 000001b2
ffff88003e2e5d80 388226800 C Bo:2:006:4 0 466 >
ffff880050e690c0 388228986 C Bi:2:006:5 0 32 = 00000006 00000020 f27e0010 00000221 000014c0 58100200 a84cb7f2 00000162
ffff88003e2e5d80 388229029 S Bi:2:006:5 -115 16384 <
ffff88003e2e5d80 388229365 C Bi:2:006:5 0 382 = 00000006 0000017e f27e0010 00000225 000014c0 58100200 a84cb7f2 3c3f786d
ffff88003e2e5d80 388229392 S Bi:2:006:5 -115 16384 <
ffff88003e2e5cc0 388231229 S Bo:2:006:4 -115 82 = 00000006 00000052 0010f27e 000014c0 00000387 50100200 00000000 16030000
ffff88003e2e5cc0 388231249 C Bo:2:006:4 0 82 >
ffff88003e2e5d80 388293606 C Bi:2:006:5 0 107 = 00000006 0000006b f27e0010 00000387 000014f6 58100200 a84cb7f2 16030000
ffff88003e2e5d80 388293700 S Bi:2:006:5 -115 16384 <
ffff88003e2e5cc0 388293742 S Bo:2:006:4 -115 28 = 00000006 0000001c 0010f27e 000014f6 000003d6 50100200 00000000
ffff88003e2e5cc0 388293759 C Bo:2:006:4 0 28 >
ffff88003e2e5d80 388294315 C Bi:2:006:5 0 614 = 00000006 00000266 f27e0010 000003d6 000014f6 58100200 a84cb7f2 16030002
ffff88003e2e5d80 388294370 S Bi:2:006:5 -115 16384 <
ffff88003e2e5d80 388294633 C Bi:2:006:5 0 42 = 00000006 0000002a f27e0010 00000620 000014f6 58100200 a84cb7f2 16030000
ffff88003e2e5d80 388294690 S Bi:2:006:5 -115 16384 <
ffff88003e2e5d80 388295004 C Bi:2:006:5 0 37 = 00000006 00000025 f27e0010 0000062e 000014f6 58100200 a84cb7f2 16030000
ffff88003e2e5d80 388295057 S Bi:2:006:5 -115 16384 <
ffff88003e2e5cc0 388303024 S Bo:2:006:4 -115 715 = 00000006 000002cb 0010f27e 000014f6 00000637 50100200 00000000 16030002
ffff88003e2e5cc0 388303059 C Bo:2:006:4 0 715 >
ffff88003e2e5cc0 388303122 S Bo:2:006:4 -115 165 = 00000006 000000a5 0010f27e 000017a5 00000637 50100200 00000000 16030000
ffff88003e2e5780 388303161 S Bo:2:006:4 -115 295 = 00000006 00000127 0010f27e 0000182e 00000637 50100200 00000000 16030001
ffff88003e2e5240 388303202 S Bo:2:006:4 -115 34 = 00000006 00000022 0010f27e 00001939 00000637 50100200 00000000 14030000
ffff88003e2e5cc0 388303544 C Bo:2:006:4 0 165 >
ffff88003e2e5cc0 388303658 S Bo:2:006:4 -115 97 = 00000006 00000061 0010f27e 0000193f 00000637 50100200 00000000 16030000
ffff88003e2e5780 388304311 C Bo:2:006:4 0 295 >
ffff88003e2e5240 388304885 C Bo:2:006:4 0 34 >
ffff88003e2e5cc0 388305454 C Bo:2:006:4 0 97 >
ffff88003e2e5d80 388353632 C Bi:2:006:5 0 34 = 00000006 00000022 f27e0010 00000637 00001984 58100200 a84cb7f2 14030000
ffff88003e2e5d80 388353689 S Bi:2:006:5 -115 16384 <
ffff88003e2e5cc0 388353717 S Bo:2:006:4 -115 28 = 00000006 0000001c 0010f27e 00001984 0000063d 50100200 00000000
ffff88003e2e5cc0 388353734 C Bo:2:006:4 0 28 >
ffff88003e2e5d80 388354357 C Bi:2:006:5 0 97 = 00000006 00000061 f27e0010 0000063d 00001984 58100200 a84cb7f2 16030000
ffff88003e2e5d80 388354414 S Bi:2:006:5 -115 16384 <
ffff88003e2e5cc0 388354753 S Bo:2:006:4 -115 65 = 00000006 00000041 0010f27e 00001984 00000682 50100200 00000000 17030000
ffff88003e2e5cc0 388354778 C Bo:2:006:4 0 65 >
ffff88003e2e5cc0 388354898 S Bo:2:006:4 -115 401 = 00000006 00000191 0010f27e 000019a9 00000682 50100200 00000000 17030001
ffff88003e2e5cc0 388355491 C Bo:2:006:4 0 401 >
ffff88003e2e5d80 388370279 C Bi:2:006:5 0 65 = 00000006 00000041 f27e0010 00000682 00001b1e 58100200 a84cb7f2 17030000
ffff88003e2e5d80 388370334 S Bi:2:006:5 -115 16384 <
ffff88003e2e5d80 388370847 C Bi:2:006:5 0 625 = 00000006 00000271 f27e0010 000006a7 00001b1e 58100200 a84cb7f2 17030002
ffff88003e2e5d80 388370902 S Bi:2:006:5 -115 16384 <
ffff88003e2e5cc0 388371412 S Bo:2:006:4 -115 65 = 00000006 00000041 0010f27e 00001b1e 000008fc 50100200 00000000 17030000
ffff88003e2e5cc0 388371435 C Bo:2:006:4 0 65 >
ffff88003e2e5cc0 388371559 S Bo:2:006:4 -115 417 = 00000006 000001a1 0010f27e 00001b43 000008fc 50100200 00000000 17030001
ffff88003e2e5cc0 388372119 C Bo:2:006:4 0 417 >
ffff88003e2e5d80 388376067 C Bi:2:006:5 0 65 = 00000006 00000041 f27e0010 000008fc 00001cc8 58100200 a84cb7f2 17030000
ffff88003e2e5d80 388376149 S Bi:2:006:5 -115 16384 <
ffff88003e2e5d80 388377028 C Bi:2:006:5 0 305 = 00000006 00000131 f27e0010 00000921 00001cc8 58100200 a84cb7f2 17030001
ffff88003e2e5d80 388377080 S Bi:2:006:5 -115 16384 <
ffff88003e2e5cc0 388377339 S Bo:2:006:4 -115 65 = 00000006 00000041 0010f27e 00001cc8 00000a36 50100200 00000000 15030000
ffff88003e2e5cc0 388377362 C Bo:2:006:4 0 65 >
ffff88003e2e5d80 388379961 C Bi:2:006:5 0 65 = 00000006 00000041 f27e0010 00000a36 00001ced 58100200 a84cb7f2 15030000
ffff88003e2e5d80 388380035 S Bi:2:006:5 -115 16384 <
ffff88003e2e5cc0 388380222 S Bo:2:006:4 -115 28 = 00000006 0000001c 0010f27e 00001ced 00000a5b 50040200 00000000
ffff88003e2e5cc0 388380242 C Bo:2:006:4 0 28 >
ffff8800791be480 388940825 S Ci:2:006:0 s c0 45 0000 0002 0040 64 <
ffff8800791be480 388941308 C Ci:2:006:0 0 1 = 03
ffff8800791be480 389940863 S Ci:2:006:0 s c0 45 0000 0002 0040 64 <
ffff8800791be480 389941377 C Ci:2:006:0 0 1 = 03
ffff8800791be480 390940869 S Ci:2:006:0 s c0 45 0000 0002 0040 64 <
ffff8800791be480 390941302 C Ci:2:006:0 0 1 = 03
ffff8800791be480 391940892 S Ci:2:006:0 s c0 45 0000 0002 0040 64 <
ffff8800791be480 391941371 C Ci:2:006:0 0 1 = 03
ffff8800791be480 392940864 S Ci:2:006:0 s c0 45 0000 0002 0040 64 <
ffff8800791be480 392941365 C Ci:2:006:0 0 1 = 03
ffff8800791be480 393940876 S Ci:2:006:0 s c0 45 0000 0002 0040 64 <
ffff8800791be480 393941368 C Ci:2:006:0 0 1 = 03
