ffff88003c1c9480 2615540115 C Ii:1:017:1 -108:2 0
ffff880036a54600 2615606591 S Ci:1:017:0 s 81 06 2200 0000 1000 4096 <
ffff880036a54600 2615611322 C Ci:1:017:0 0 59 = 05010906 a1010507 19e029e7 15002501 75019508 81028101 19002965 15002565
ffff8800366f0240 2615611572 S Co:1:017:0 s 21 0a 0000 0000 0000 0
ffff8800366f0240 2615613345 C Co:1:017:0 0 0
ffff8800366f0240 2615613416 S Ci:1:017:0 s 81 06 2200 0000 003b 59 <
ffff8800366f0240 2615616384 C Ci:1:017:0 0 59 = 05010906 a1010507 19e029e7 15002501 75019508 81028101 19002965 15002565
ffff880039f9c3c0 2615617252 S Co:1:017:0 s 21 09 0200 0000 0001 1 = 00
ffff880039f9c3c0 2615619420 C Co:1:017:0 0 1 >
ffff880039f9c300 2615630314 S Ii:1:017:1 -115:2 8 <
ffff880039f9c300 2615642813 C Ii:1:017:1 -108:2 0
ffff880016e24480 2615698725 S Ci:1:017:0 s 81 06 2200 0000 1000 4096 <
ffff880016e24480 2615703194 C Ci:1:017:0 0 59 = 05010906 a1010507 19e029e7 15002501 75019508 81028101 19002965 15002565
ffff880016e24480 2615703485 S Co:1:017:0 s 21 0b 0001 0000 0000 0
ffff880016e24480 2615705226 C Co:1:017:0 0 0
ffff880016e24480 2615705274 S Co:1:017:0 s 21 0a 0000 0000 0000 0
ffff880016e24480 2615707243 C Co:1:017:0 0 0
ffff880039fb3900 2615707279 S Ii:1:017:1 -115:2 8 <
ffff88001fea0600 2616052982 S Ci:1:017:0 s 80 06 0300 0000 0004 4 <
ffff88001fea0600 2616055953 C Ci:1:017:0 0 4 = 04030904
ffff88001fea0600 2616056037 S Ci:1:017:0 s 80 06 0301 0409 00fe 254 <
ffff88001fea0600 2616059998 C Ci:1:017:0 0 20 = 14034100 54004d00 45004c00 20004100 56005200
ffff88003a4483c0 2616060274 S Ci:1:017:0 s 80 06 0300 0000 0004 4 <
ffff88003a4483c0 2616062026 C Ci:1:017:0 0 4 = 04030904
ffff88003a4483c0 2616062085 S Ci:1:017:0 s 80 06 0302 0409 00fe 254 <
ffff88003a4483c0 2616066083 C Ci:1:017:0 0 26 = 1a034800 49004400 20004b00 65007900 62006f00 61007200 6400
ffff88003a4483c0 2616066221 S Ci:1:017:0 s 80 06 0600 0000 000a 10 <
ffff88003a4483c0 2616067544 C Ci:1:017:0 -32 0
ffff88003a4483c0 2616067601 S Ci:1:017:0 s 80 06 0a00 0000 0004 4 <
ffff88003a4483c0 2616068545 C Ci:1:017:0 -32 0
ffff88003a4483c0 2616068600 S Ci:1:017:0 s 80 00 0000 0000 0002 2 <
ffff88003a4483c0 2616070151 C Ci:1:017:0 0 2 = 0000
ffff880039fb3900 2616961710 C Ii:1:017:1 0:2 8 = 04000000 00000000
ffff88000d6950c0 2616961832 S Ii:1:017:1 -115:2 8 <
ffff88000d6950c0 2616967828 C Ii:1:017:1 0:2 8 = 04003b00 00000000
ffff88000d6950c0 2616967926 S Ii:1:017:1 -115:2 8 <
ffff88000d6950c0 2616974003 C Ii:1:017:1 0:2 8 = 04000000 00000000
ffff88000d6950c0 2616981561 S Ii:1:017:1 -115:2 8 <
ffff88000d6950c0 2616986250 C Ii:1:017:1 0:2 8 = 00000000 00000000
ffff88000d6950c0 2616986331 S Ii:1:017:1 -115:2 8 <
ffff88000d6950c0 2617975505 C Ii:1:017:1 0:2 8 = 00001b00 00000000
ffff88000d6950c0 2617975634 S Ii:1:017:1 -115:2 8 <
ffff88000d6950c0 2617981568 C Ii:1:017:1 0:2 8 = 00000000 00000000
ffff88000d6950c0 2617981642 S Ii:1:017:1 -115:2 8 <
ffff88000d6950c0 2617987653 C Ii:1:017:1 0:2 8 = 00001700 00000000
ffff88000d6950c0 2617987732 S Ii:1:017:1 -115:2 8 <
ffff88000d6950c0 2617993765 C Ii:1:017:1 0:2 8 = 00000000 00000000
ffff88000d6950c0 2617993878 S Ii:1:017:1 -115:2 8 <
ffff88000d6950c0 2617999837 C Ii:1:017:1 0:2 8 = 00000800 00000000
ffff88000d6950c0 2617999911 S Ii:1:017:1 -115:2 8 <
ffff88000d6950c0 2618005931 C Ii:1:017:1 0:2 8 = 00001500 00000000
ffff88000d6950c0 2618006009 S Ii:1:017:1 -115:2 8 <
ffff88000d6950c0 2618012019 C Ii:1:017:1 0:2 8 = 00001000 00000000
ffff88000d6950c0 2618012104 S Ii:1:017:1 -115:2 8 <
ffff88000d6950c0 2618018163 C Ii:1:017:1 0:2 8 = 00000000 00000000
ffff88000d6950c0 2618018254 S Ii:1:017:1 -115:2 8 <
ffff88000d6950c0 2619009843 C Ii:1:017:1 0:2 8 = 00002800 00000000
ffff88000d6950c0 2619010001 S Ii:1:017:1 -115:2 8 <
ffff88000d6950c0 2619015920 C Ii:1:017:1 0:2 8 = 00000000 00000000
ffff88000d6950c0 2619016006 S Ii:1:017:1 -115:2 8 <
ffff88000d6950c0 2620522178 C Ii:1:017:1 0:2 8 = 00001300 00000000
ffff88002a3a0600 2620522349 S Ii:1:017:1 -115:2 8 <
ffff88002a3a0600 2620528203 C Ii:1:017:1 0:2 8 = 00000000 00000000
ffff88002a3a0600 2620528289 S Ii:1:017:1 -115:2 8 <
ffff88002a3a0600 2620534289 C Ii:1:017:1 0:2 8 = 00001a00 00000000
ffff88002a3a0600 2620534369 S Ii:1:017:1 -115:2 8 <
ffff88002a3a0600 2620539363 C Ii:1:017:1 0:2 8 = 00000000 00000000
ffff88002a3a0600 2620539442 S Ii:1:017:1 -115:2 8 <
ffff88002a3a0600 2620543427 C Ii:1:017:1 0:2 8 = 00000700 00000000
ffff88002a3a0600 2620543506 S Ii:1:017:1 -115:2 8 <
ffff88002a3a0600 2620547487 C Ii:1:017:1 0:2 8 = 00000000 00000000
ffff88002a3a0600 2620547565 S Ii:1:017:1 -115:2 8 <
ffff88002a3a0600 2621544195 C Ii:1:017:1 0:2 8 = 00002800 00000000
ffff88002a3a0600 2621544348 S Ii:1:017:1 -115:2 8 <
ffff88002a3a0600 2621550234 C Ii:1:017:1 0:2 8 = 00000000 00000000
ffff88002a3a0600 2621550321 S Ii:1:017:1 -115:2 8 <
ffff88002a3a0600 2622153729 C Ii:1:017:1 0:2 8 = 00000c00 00000000
ffff88002a3a0600 2622153858 S Ii:1:017:1 -115:2 8 <
ffff88002a3a0600 2622159802 C Ii:1:017:1 0:2 8 = 00000000 00000000
ffff88002a3a0600 2622159894 S Ii:1:017:1 -115:2 8 <
ffff88002a3a0600 2622165883 C Ii:1:017:1 0:2 8 = 00000700 00000000
ffff88002a3a0600 2622165974 S Ii:1:017:1 -115:2 8 <
ffff88002a3a0600 2622171974 C Ii:1:017:1 0:2 8 = 00000000 00000000
ffff88002a3a0600 2622172202 S Ii:1:017:1 -115:2 8 <
ffff88002a3a0600 2622769904 C Ii:1:017:1 0:2 8 = 00002800 00000000
ffff88002a3a0600 2622770077 S Ii:1:017:1 -115:2 8 <
ffff88002a3a0600 2622775965 C Ii:1:017:1 0:2 8 = 00000000 00000000
ffff88002a3a0600 2622776060 S Ii:1:017:1 -115:2 8 <
ffff88002a3a0600 2623780293 C Ii:1:017:1 0:2 8 = 00000600 00000000
ffff88002a3a0600 2623780484 S Ii:1:017:1 -115:2 8 <
ffff88002a3a0600 2623786343 C Ii:1:017:1 0:2 8 = 00000000 00000000
ffff88002a3a0600 2623786434 S Ii:1:017:1 -115:2 8 <
ffff88002a3a0600 2623789379 C Ii:1:017:1 0:2 8 = 00000400 00000000
ffff88002a3a0600 2623789530 S Ii:1:017:1 -115:2 8 <
ffff88002a3a0600 2623793444 C Ii:1:017:1 0:2 8 = 00000000 00000000
ffff88002a3a0600 2623793534 S Ii:1:017:1 -115:2 8 <
ffff88002a3a0600 2623797525 C Ii:1:017:1 0:2 8 = 00001700 00000000
ffff88002a3a0600 2623797614 S Ii:1:017:1 -115:2 8 <
ffff88002a3a0600 2623803574 C Ii:1:017:1 0:2 8 = 00000000 00000000
ffff88002a3a0600 2623803674 S Ii:1:017:1 -115:2 8 <
ffff88002a3a0600 2623809661 C Ii:1:017:1 0:2 8 = 00002c00 00000000
ffff88002a3a0600 2623809767 S Ii:1:017:1 -115:2 8 <
ffff88002a3a0600 2623815741 C Ii:1:017:1 0:2 8 = 00003800 00000000
ffff88002a3a0600 2623815855 S Ii:1:017:1 -115:2 8 <
ffff88002a3a0600 2623821827 C Ii:1:017:1 0:2 8 = 00000800 00000000
ffff88002a3a0600 2623821929 S Ii:1:017:1 -115:2 8 <
ffff88002a3a0600 2623827904 C Ii:1:017:1 0:2 8 = 00001700 00000000
ffff88002a3a0600 2623827995 S Ii:1:017:1 -115:2 8 <
ffff88002a3a0600 2623833991 C Ii:1:017:1 0:2 8 = 00000600 00000000
ffff88002a3a0600 2623834092 S Ii:1:017:1 -115:2 8 <
ffff88002a3a0600 2623840069 C Ii:1:017:1 0:2 8 = 00003800 00000000
ffff88002a3a0600 2623840161 S Ii:1:017:1 -115:2 8 <
ffff88002a3a0600 2623846156 C Ii:1:017:1 0:2 8 = 00001300 00000000
ffff88002a3a0600 2623846252 S Ii:1:017:1 -115:2 8 <
ffff88002a3a0600 2623852235 C Ii:1:017:1 0:2 8 = 00000400 00000000
ffff88002a3a0600 2623852326 S Ii:1:017:1 -115:2 8 <
ffff88002a3a0600 2623858318 C Ii:1:017:1 0:2 8 = 00001600 00000000
ffff88002a3a0600 2623858408 S Ii:1:017:1 -115:2 8 <
ffff88002a3a0600 2623863386 C Ii:1:017:1 0:2 8 = 00001600 00000000
ffff88002a3a0600 2623863476 S Ii:1:017:1 -115:2 8 <
ffff88002a3a0600 2623867451 C Ii:1:017:1 0:2 8 = 00001a00 00000000
ffff88002a3a0600 2623867545 S Ii:1:017:1 -115:2 8 <
ffff88002a3a0600 2623871503 C Ii:1:017:1 0:2 8 = 00000700 00000000
ffff88002a3a0600 2623871593 S Ii:1:017:1 -115:2 8 <
ffff88002a3a0600 2623877630 C Ii:1:017:1 0:2 8 = 00000000 00000000
ffff88002a3a0600 2623877725 S Ii:1:017:1 -115:2 8 <
ffff88002a3a0600 2624873626 C Ii:1:017:1 0:2 8 = 00002800 00000000
ffff88003a52ecc0 2624873856 S Ii:1:017:1 -115:2 8 <
ffff88003a52ecc0 2624880164 C Ii:1:017:1 0:2 8 = 00000000 00000000
ffff88003a52ecc0 2624880321 S Ii:1:017:1 -115:2 8 <
