ffff8800700fa3c0 3801810389 S Ci:2:004:0 s 80 06 0300 0000 0004 4 <
ffff8800700fa3c0 3801810547 C Ci:2:004:0 0 4 = 04030904
ffff8800700fa3c0 3801810673 S Ci:2:004:0 s 80 06 0302 0409 00fe 254 <
ffff8800700fa3c0 3801810757 C Ci:2:004:0 0 16 = 10035300 61006d00 73007500 6e006700
ffff88003e097540 3801810953 S Ci:2:004:0 s 80 06 0300 0000 0004 4 <
ffff88003e097540 3801811038 C Ci:2:004:0 0 4 = 04030904
ffff88003e097540 3801811125 S Ci:2:004:0 s 80 06 0303 0409 00fe 254 <
ffff88003e097540 3801811217 C Ci:2:004:0 0 16 = 10034e00 65007800 75007300 20005300
ffff88003e097540 3801811263 S Ci:2:004:0 s 80 06 0300 0000 0004 4 <
ffff88003e097540 3801811350 C Ci:2:004:0 0 4 = 04030904
ffff88003e097540 3801811405 S Ci:2:004:0 s 80 06 0304 0409 00fe 254 <
ffff88003e097540 3801811496 C Ci:2:004:0 0 34 = 22033300 33003300 34003400 33003600 38004300 31003100 33003000 30004500
ffff88003e097540 3801811534 S Ci:2:004:0 s 80 06 0300 0000 0004 4 <
ffff88003e097540 3801811582 C Ci:2:004:0 0 4 = 04030904
ffff88003e097540 3801811599 S Ci:2:004:0 s 80 06 0301 0409 00fe 254 <
ffff88003e097540 3801811678 C Ci:2:004:0 0 26 = 1a034d00 61007300 73002000 53007400 6f007200 61006700 6500
ffff88003e097540 3801811708 S Ci:2:004:0 s 80 06 0600 0000 000a 10 <
ffff88003e097540 3801811773 C Ci:2:004:0 0 10 = 0a060002 00000040 0100
ffff88003e097540 3801811793 S Ci:2:004:0 s 80 06 0a00 0000 0004 4 <
ffff88003e097540 3801811837 C Ci:2:004:0 -32 0
ffff88003e097540 3801811854 S Ci:2:004:0 s 80 00 0000 0000 0002 2 <
ffff88003e097540 3801811922 C Ci:2:004:0 0 2 = 0100
ffff88005ba87840 3802460807 S Ci:2:004:0 s a1 fe 0000 0000 0001 1 <
ffff88005ba87840 3802460975 C Ci:2:004:0 0 1 = 00
ffff88005ba87840 3802461111 S Bo:2:004:1 -115 31 = 55534243 01000000 24000000 80000612 00000024 00000000 00000000 000000
ffff88005ba87840 3802461165 C Bo:2:004:1 0 31 >
ffff880050d02f00 3802461209 S Bi:2:004:2 -115 36 <
ffff880050d02f00 3802461305 C Bi:2:004:2 0 36 = 00800202 1f000000 476f6f67 6c650020 46696c65 2d434420 47616467 65742020
ffff88005ba87840 3802461350 S Bi:2:004:2 -115 13 <
ffff88005ba87840 3802461371 C Bi:2:004:2 0 13 = 55534253 01000000 00000000 00
ffff88005ba87840 3802461777 S Bo:2:004:1 -115 31 = 55534243 02000000 00000000 00000600 00000000 00000000 00000000 000000
ffff88005ba87840 3802461798 C Bo:2:004:1 0 31 >
ffff88005ba87840 3802461814 S Bi:2:004:2 -115 13 <
ffff88005ba87840 3802461897 C Bi:2:004:2 0 13 = 55534253 02000000 00000000 01
ffff88005ba87840 3802461912 S Bo:2:004:1 -115 31 = 55534243 03000000 12000000 80000603 00000012 00000000 00000000 000000
ffff88005ba87840 3802461934 C Bo:2:004:1 0 31 >
ffff880050d02900 3802461944 S Bi:2:004:2 -115 18 <
ffff880050d02900 3802462041 C Bi:2:004:2 0 18 = 70000600 0000000a 00000000 29000000 0000
ffff88005ba87840 3802462053 S Bi:2:004:2 -115 13 <
ffff88005ba87840 3802462126 C Bi:2:004:2 0 13 = 55534253 03000000 00000000 00
ffff88005ba87840 3802462182 S Bo:2:004:1 -115 31 = 55534243 04000000 00000000 00000600 00000000 00000000 00000000 000000
ffff88005ba87840 3802462244 C Bo:2:004:1 0 31 >
ffff88005ba87840 3802462263 S Bi:2:004:2 -115 13 <
ffff88005ba87840 3802462351 C Bi:2:004:2 0 13 = 55534253 04000000 00000000 01
ffff88005ba87840 3802462365 S Bo:2:004:1 -115 31 = 55534243 05000000 12000000 80000603 00000012 00000000 00000000 000000
ffff88005ba87840 3802462394 C Bo:2:004:1 0 31 >
ffff880050d02cc0 3802462408 S Bi:2:004:2 -115 18 <
ffff880050d02cc0 3802462479 C Bi:2:004:2 0 18 = 70000200 0000000a 00000000 3a000000 0000
ffff88005ba87840 3802462499 S Bi:2:004:2 -115 13 <
ffff88005ba87840 3802462521 C Bi:2:004:2 0 13 = 55534253 05000000 00000000 00
ffff88005ba87840 3802462832 S Bo:2:004:1 -115 31 = 55534243 06000000 00000000 00000600 00000000 00000000 00000000 000000
ffff88005ba87840 3802462856 C Bo:2:004:1 0 31 >
ffff88005ba87840 3802462873 S Bi:2:004:2 -115 13 <
ffff88005ba87840 3802463011 C Bi:2:004:2 0 13 = 55534253 06000000 00000000 01
ffff88005ba87840 3802463042 S Bo:2:004:1 -115 31 = 55534243 07000000 12000000 80000603 00000012 00000000 00000000 000000
ffff88005ba87840 3802463077 C Bo:2:004:1 0 31 >
ffff880050d02cc0 3802463097 S Bi:2:004:2 -115 18 <
ffff880050d02cc0 3802463177 C Bi:2:004:2 0 18 = 70000200 0000000a 00000000 3a000000 0000
ffff88005ba87840 3802463203 S Bi:2:004:2 -115 13 <
ffff88005ba87840 3802463256 C Bi:2:004:2 0 13 = 55534253 07000000 00000000 00
ffff88005ba87840 3802463315 S Bo:2:004:1 -115 31 = 55534243 08000000 00000000 00000600 00000000 00000000 00000000 000000
ffff88005ba87840 3802463352 C Bo:2:004:1 0 31 >
ffff88005ba87840 3802463371 S Bi:2:004:2 -115 13 <
ffff88005ba87840 3802463459 C Bi:2:004:2 0 13 = 55534253 08000000 00000000 01
ffff88005ba87840 3802463478 S Bo:2:004:1 -115 31 = 55534243 09000000 12000000 80000603 00000012 00000000 00000000 000000
ffff88005ba87840 3802463493 C Bo:2:004:1 0 31 >
ffff880050d02cc0 3802463504 S Bi:2:004:2 -115 18 <
ffff880050d02cc0 3802463584 C Bi:2:004:2 0 18 = 70000200 0000000a 00000000 3a000000 0000
ffff88005ba87840 3802463602 S Bi:2:004:2 -115 13 <
ffff88005ba87840 3802463621 C Bi:2:004:2 0 13 = 55534253 09000000 00000000 00
ffff88005ba87840 3802473344 S Bo:2:004:1 -115 31 = 55534243 0a000000 00000000 00000600 00000000 00000000 00000000 000000
ffff88005ba87840 3802473374 C Bo:2:004:1 0 31 >
ffff88005ba87840 3802473408 S Bi:2:004:2 -115 13 <
ffff88005ba87840 3802473478 C Bi:2:004:2 0 13 = 55534253 0a000000 00000000 01
ffff88005ba87840 3802473507 S Bo:2:004:1 -115 31 = 55534243 0b000000 12000000 80000603 00000012 00000000 00000000 000000
ffff88005ba87840 3802473524 C Bo:2:004:1 0 31 >
ffff8800787dff00 3802473535 S Bi:2:004:2 -115 18 <
ffff8800787dff00 3802473605 C Bi:2:004:2 0 18 = 70000200 0000000a 00000000 3a000000 0000
ffff88005ba87840 3802473617 S Bi:2:004:2 -115 13 <
ffff88005ba87840 3802473643 C Bi:2:004:2 0 13 = 55534253 0b000000 00000000 00
ffff88005ba87840 3802473718 S Bo:2:004:1 -115 31 = 55534243 0c000000 00000000 00000600 00000000 00000000 00000000 000000
ffff88005ba87840 3802473738 C Bo:2:004:1 0 31 >
ffff88005ba87840 3802473748 S Bi:2:004:2 -115 13 <
ffff88005ba87840 3802473831 C Bi:2:004:2 0 13 = 55534253 0c000000 00000000 01
ffff88005ba87840 3802473846 S Bo:2:004:1 -115 31 = 55534243 0d000000 12000000 80000603 00000012 00000000 00000000 000000
ffff88005ba87840 3802473866 C Bo:2:004:1 0 31 >
ffff88003e239180 3802473876 S Bi:2:004:2 -115 18 <
ffff88003e239180 3802473910 C Bi:2:004:2 0 18 = 70000200 0000000a 00000000 3a000000 0000
ffff88005ba87840 3802473921 S Bi:2:004:2 -115 13 <
ffff88005ba87840 3802473957 C Bi:2:004:2 0 13 = 55534253 0d000000 00000000 00
ffff88005ba87840 3802474049 S Bo:2:004:1 -115 31 = 55534243 0e000000 00000000 00000600 00000000 00000000 00000000 000000
ffff88005ba87840 3802474070 C Bo:2:004:1 0 31 >
ffff88005ba87840 3802474080 S Bi:2:004:2 -115 13 <
ffff88005ba87840 3802474156 C Bi:2:004:2 0 13 = 55534253 0e000000 00000000 01
ffff88005ba87840 3802474167 S Bo:2:004:1 -115 31 = 55534243 0f000000 12000000 80000603 00000012 00000000 00000000 000000
ffff88005ba87840 3802474196 C Bo:2:004:1 0 31 >
ffff88005b997480 3802474212 S Bi:2:004:2 -115 18 <
ffff88005b997480 3802474248 C Bi:2:004:2 0 18 = 70000200 0000000a 00000000 3a000000 0000
ffff88005ba87840 3802474273 S Bi:2:004:2 -115 13 <
ffff88005ba87840 3802474287 C Bi:2:004:2 0 13 = 55534253 0f000000 00000000 00
ffff88005ba87840 3802483814 S Bo:2:004:1 -115 31 = 55534243 10000000 00000000 00000600 00000000 00000000 00000000 000000
ffff88005ba87840 3802483842 C Bo:2:004:1 0 31 >
ffff88005ba87840 3802483850 S Bi:2:004:2 -115 13 <
ffff88005ba87840 3802483952 C Bi:2:004:2 0 13 = 55534253 10000000 00000000 01
ffff88005ba87840 3802483970 S Bo:2:004:1 -115 31 = 55534243 11000000 12000000 80000603 00000012 00000000 00000000 000000
ffff88005ba87840 3802483993 C Bo:2:004:1 0 31 >
ffff88003e239600 3802484003 S Bi:2:004:2 -115 18 <
ffff88003e239600 3802484060 C Bi:2:004:2 0 18 = 70000200 0000000a 00000000 3a000000 0000
ffff88005ba87840 3802484080 S Bi:2:004:2 -115 13 <
ffff88005ba87840 3802484099 C Bi:2:004:2 0 13 = 55534253 11000000 00000000 00
ffff88005ba87840 3802484788 S Bo:2:004:1 -115 31 = 55534243 12000000 00000000 00000600 00000000 00000000 00000000 000000
ffff88005ba87840 3802484802 C Bo:2:004:1 0 31 >
ffff88005ba87840 3802484824 S Bi:2:004:2 -115 13 <
ffff88005ba87840 3802484921 C Bi:2:004:2 0 13 = 55534253 12000000 00000000 01
ffff88005ba87840 3802485365 S Bo:2:004:1 -115 31 = 55534243 13000000 12000000 80000603 00000012 00000000 00000000 000000
ffff88005ba87840 3802485389 C Bo:2:004:1 0 31 >
ffff88003e239600 3802485408 S Bi:2:004:2 -115 18 <
ffff88003e239600 3802485492 C Bi:2:004:2 0 18 = 70000200 0000000a 00000000 3a000000 0000
ffff88005ba87840 3802485500 S Bi:2:004:2 -115 13 <
ffff88005ba87840 3802485528 C Bi:2:004:2 0 13 = 55534253 13000000 00000000 00
ffff88005ba87840 3802485647 S Bo:2:004:1 -115 31 = 55534243 14000000 00000000 00000600 00000000 00000000 00000000 000000
ffff88005ba87840 3802485681 C Bo:2:004:1 0 31 >
ffff88005ba87840 3802485717 S Bi:2:004:2 -115 13 <
ffff88005ba87840 3802485742 C Bi:2:004:2 0 13 = 55534253 14000000 00000000 01
ffff88005ba87840 3802485754 S Bo:2:004:1 -115 31 = 55534243 15000000 12000000 80000603 00000012 00000000 00000000 000000
ffff88005ba87840 3802485780 C Bo:2:004:1 0 31 >
ffff88004d10c480 3802485796 S Bi:2:004:2 -115 18 <
ffff88004d10c480 3802485832 C Bi:2:004:2 0 18 = 70000200 0000000a 00000000 3a000000 0000
ffff88005ba87840 3802485857 S Bi:2:004:2 -115 13 <
ffff88005ba87840 3802485872 C Bi:2:004:2 0 13 = 55534253 15000000 00000000 00
ffff88005ba87840 3802489108 S Bo:2:004:1 -115 31 = 55534243 16000000 00000000 00000600 00000000 00000000 00000000 000000
ffff88005ba87840 3802489131 C Bo:2:004:1 0 31 >
ffff88005ba87840 3802489139 S Bi:2:004:2 -115 13 <
ffff88005ba87840 3802489245 C Bi:2:004:2 0 13 = 55534253 16000000 00000000 01
ffff88005ba87840 3802489256 S Bo:2:004:1 -115 31 = 55534243 17000000 12000000 80000603 00000012 00000000 00000000 000000
ffff88005ba87840 3802489281 C Bo:2:004:1 0 31 >
ffff88003e2240c0 3802489290 S Bi:2:004:2 -115 18 <
ffff88003e2240c0 3802489346 C Bi:2:004:2 0 18 = 70000200 0000000a 00000000 3a000000 0000
ffff88005ba87840 3802489356 S Bi:2:004:2 -115 13 <
ffff88005ba87840 3802489388 C Bi:2:004:2 0 13 = 55534253 17000000 00000000 00
ffff88005ba87840 3802489785 S Bo:2:004:1 -115 31 = 55534243 18000000 00000000 00000600 00000000 00000000 00000000 000000
ffff88005ba87840 3802489804 C Bo:2:004:1 0 31 >
ffff88005ba87840 3802489833 S Bi:2:004:2 -115 13 <
ffff88005ba87840 3802489871 C Bi:2:004:2 0 13 = 55534253 18000000 00000000 01
ffff88005ba87840 3802489882 S Bo:2:004:1 -115 31 = 55534243 19000000 12000000 80000603 00000012 00000000 00000000 000000
ffff88005ba87840 3802489911 C Bo:2:004:1 0 31 >
ffff88004d119900 3802489920 S Bi:2:004:2 -115 18 <
ffff88004d119900 3802489975 C Bi:2:004:2 0 18 = 70000200 0000000a 00000000 3a000000 0000
ffff88005ba87840 3802489984 S Bi:2:004:2 -115 13 <
ffff88005ba87840 3802490017 C Bi:2:004:2 0 13 = 55534253 19000000 00000000 00
ffff88005ba87840 3802490216 S Bo:2:004:1 -115 31 = 55534243 1a000000 00000000 00000600 00000000 00000000 00000000 000000
ffff88005ba87840 3802490239 C Bo:2:004:1 0 31 >
ffff88005ba87840 3802490246 S Bi:2:004:2 -115 13 <
ffff88005ba87840 3802490374 C Bi:2:004:2 0 13 = 55534253 1a000000 00000000 01
ffff88005ba87840 3802490384 S Bo:2:004:1 -115 31 = 55534243 1b000000 12000000 80000603 00000012 00000000 00000000 000000
ffff88005ba87840 3802490419 C Bo:2:004:1 0 31 >
ffff88004d10c6c0 3802490428 S Bi:2:004:2 -115 18 <
ffff88004d10c6c0 3802490505 C Bi:2:004:2 0 18 = 70000200 0000000a 00000000 3a000000 0000
ffff88005ba87840 3802490523 S Bi:2:004:2 -115 13 <
ffff88005ba87840 3802490550 C Bi:2:004:2 0 13 = 55534253 1b000000 00000000 00
ffff88005ba87840 3802493789 S Bo:2:004:1 -115 31 = 55534243 1c000000 00000000 00000600 00000000 00000000 00000000 000000
ffff88005ba87840 3802493811 C Bo:2:004:1 0 31 >
ffff88005ba87840 3802493830 S Bi:2:004:2 -115 13 <
ffff88005ba87840 3802493891 C Bi:2:004:2 0 13 = 55534253 1c000000 00000000 01
ffff88005ba87840 3802493902 S Bo:2:004:1 -115 31 = 55534243 1d000000 12000000 80000603 00000012 00000000 00000000 000000
ffff88005ba87840 3802493942 C Bo:2:004:1 0 31 >
ffff88005b9970c0 3802493960 S Bi:2:004:2 -115 18 <
ffff88005b9970c0 3802493998 C Bi:2:004:2 0 18 = 70000200 0000000a 00000000 3a000000 0000
ffff88005ba87840 3802494008 S Bi:2:004:2 -115 13 <
ffff88005ba87840 3802494044 C Bi:2:004:2 0 13 = 55534253 1d000000 00000000 00
ffff88005ba87840 3802494405 S Bo:2:004:1 -115 31 = 55534243 1e000000 00000000 00000600 00000000 00000000 00000000 000000
ffff88005ba87840 3802494426 C Bo:2:004:1 0 31 >
ffff88005ba87840 3802494534 S Bi:2:004:2 -115 13 <
ffff88005ba87840 3802494547 C Bi:2:004:2 0 13 = 55534253 1e000000 00000000 01
ffff88005ba87840 3802494557 S Bo:2:004:1 -115 31 = 55534243 1f000000 12000000 80000603 00000012 00000000 00000000 000000
ffff88005ba87840 3802494589 C Bo:2:004:1 0 31 >
ffff88003deb0c00 3802494612 S Bi:2:004:2 -115 18 <
ffff88003deb0c00 3802494654 C Bi:2:004:2 0 18 = 70000200 0000000a 00000000 3a000000 0000
ffff88005ba87840 3802494667 S Bi:2:004:2 -115 13 <
ffff88005ba87840 3802494689 C Bi:2:004:2 0 13 = 55534253 1f000000 00000000 00
ffff88005ba87840 3804956878 S Bo:2:004:1 -115 31 = 55534243 20000000 00000000 00000600 00000000 00000000 00000000 000000
ffff88005ba87840 3804956936 C Bo:2:004:1 0 31 >
ffff88005ba87840 3804956959 S Bi:2:004:2 -115 13 <
ffff88005ba87840 3804957028 C Bi:2:004:2 0 13 = 55534253 20000000 00000000 01
ffff88005ba87840 3804957092 S Bo:2:004:1 -115 31 = 55534243 21000000 12000000 80000603 00000012 00000000 00000000 000000
ffff88005ba87840 3804957113 C Bo:2:004:1 0 31 >
ffff88004d189900 3804957126 S Bi:2:004:2 -115 18 <
ffff88004d189900 3804957188 C Bi:2:004:2 0 18 = 70000200 0000000a 00000000 3a000000 0000
ffff88005ba87840 3804957265 S Bi:2:004:2 -115 13 <
ffff88005ba87840 3804957285 C Bi:2:004:2 0 13 = 55534253 21000000 00000000 00
ffff88005ba87840 3807004997 S Bo:2:004:1 -115 31 = 55534243 22000000 00000000 00000600 00000000 00000000 00000000 000000
ffff88005ba87840 3807005076 C Bo:2:004:1 0 31 >
ffff88005ba87840 3807005212 S Bi:2:004:2 -115 13 <
ffff88005ba87840 3807005276 C Bi:2:004:2 0 13 = 55534253 22000000 00000000 01
ffff88005ba87840 3807005349 S Bo:2:004:1 -115 31 = 55534243 23000000 12000000 80000603 00000012 00000000 00000000 000000
ffff88005ba87840 3807005432 C Bo:2:004:1 0 31 >
ffff880050e99840 3807005501 S Bi:2:004:2 -115 18 <
ffff880050e99840 3807005576 C Bi:2:004:2 0 18 = 70000200 0000000a 00000000 3a000000 0000
ffff88005ba87840 3807005645 S Bi:2:004:2 -115 13 <
ffff88005ba87840 3807005723 C Bi:2:004:2 0 13 = 55534253 23000000 00000000 00
ffff88005ba87840 3809053189 S Bo:2:004:1 -115 31 = 55534243 24000000 00000000 00000600 00000000 00000000 00000000 000000
ffff88005ba87840 3809053266 C Bo:2:004:1 0 31 >
ffff88005ba87840 3809053277 S Bi:2:004:2 -115 13 <
ffff88005ba87840 3809053404 C Bi:2:004:2 0 13 = 55534253 24000000 00000000 01
ffff88005ba87840 3809053473 S Bo:2:004:1 -115 31 = 55534243 25000000 12000000 80000603 00000012 00000000 00000000 000000
ffff88005ba87840 3809053541 C Bo:2:004:1 0 31 >
ffff88005ba936c0 3809053577 S Bi:2:004:2 -115 18 <
ffff88005ba936c0 3809053611 C Bi:2:004:2 0 18 = 70000200 0000000a 00000000 3a000000 0000
ffff88005ba87840 3809053638 S Bi:2:004:2 -115 13 <
ffff88005ba87840 3809053704 C Bi:2:004:2 0 13 = 55534253 25000000 00000000 00
ffff88005ba87840 3811101216 S Bo:2:004:1 -115 31 = 55534243 26000000 00000000 00000600 00000000 00000000 00000000 000000
ffff88005ba87840 3811101297 C Bo:2:004:1 0 31 >
ffff88005ba87840 3811101334 S Bi:2:004:2 -115 13 <
ffff88005ba87840 3811101459 C Bi:2:004:2 0 13 = 55534253 26000000 00000000 01
ffff88005ba87840 3811101514 S Bo:2:004:1 -115 31 = 55534243 27000000 12000000 80000603 00000012 00000000 00000000 000000
ffff88005ba87840 3811101581 C Bo:2:004:1 0 31 >
ffff88005b9dfb40 3811101627 S Bi:2:004:2 -115 18 <
ffff88005b9dfb40 3811101694 C Bi:2:004:2 0 18 = 70000200 0000000a 00000000 3a000000 0000
ffff88005ba87840 3811101765 S Bi:2:004:2 -115 13 <
ffff88005ba87840 3811101832 C Bi:2:004:2 0 13 = 55534253 27000000 00000000 00
ffff88005ba87840 3813149204 S Bo:2:004:1 -115 31 = 55534243 28000000 00000000 00000600 00000000 00000000 00000000 000000
ffff88005ba87840 3813149295 C Bo:2:004:1 0 31 >
ffff88005ba87840 3813149333 S Bi:2:004:2 -115 13 <
ffff88005ba87840 3813149414 C Bi:2:004:2 0 13 = 55534253 28000000 00000000 01
ffff88005ba87840 3813149483 S Bo:2:004:1 -115 31 = 55534243 29000000 12000000 80000603 00000012 00000000 00000000 000000
ffff88005ba87840 3813149549 C Bo:2:004:1 0 31 >
ffff88005bbedf00 3813149572 S Bi:2:004:2 -115 18 <
ffff88005bbedf00 3813149617 C Bi:2:004:2 0 18 = 70000200 0000000a 00000000 3a000000 0000
ffff88005ba87840 3813149660 S Bi:2:004:2 -115 13 <
ffff88005ba87840 3813149720 C Bi:2:004:2 0 13 = 55534253 29000000 00000000 00
ffff88005ba87840 3815197018 S Bo:2:004:1 -115 31 = 55534243 2a000000 00000000 00000600 00000000 00000000 00000000 000000
ffff88005ba87840 3815197114 C Bo:2:004:1 0 31 >
ffff88005ba87840 3815197290 S Bi:2:004:2 -115 13 <
ffff88005ba87840 3815197350 C Bi:2:004:2 0 13 = 55534253 2a000000 00000000 01
ffff88005ba87840 3815197400 S Bo:2:004:1 -115 31 = 55534243 2b000000 12000000 80000603 00000012 00000000 00000000 000000
ffff88005ba87840 3815197466 C Bo:2:004:1 0 31 >
ffff88004d2329c0 3815197543 S Bi:2:004:2 -115 18 <
ffff88004d2329c0 3815197625 C Bi:2:004:2 0 18 = 70000200 0000000a 00000000 3a000000 0000
ffff88005ba87840 3815197702 S Bi:2:004:2 -115 13 <
ffff88005ba87840 3815197767 C Bi:2:004:2 0 13 = 55534253 2b000000 00000000 00
ffff88005ba87840 3817244984 S Bo:2:004:1 -115 31 = 55534243 2c000000 00000000 00000600 00000000 00000000 00000000 000000
ffff88005ba87840 3817245049 C Bo:2:004:1 0 31 >
ffff88005ba87840 3817245194 S Bi:2:004:2 -115 13 <
ffff88005ba87840 3817245242 C Bi:2:004:2 0 13 = 55534253 2c000000 00000000 01
ffff88005ba87840 3817245277 S Bo:2:004:1 -115 31 = 55534243 2d000000 12000000 80000603 00000012 00000000 00000000 000000
ffff88005ba87840 3817245336 C Bo:2:004:1 0 31 >
ffff88004d0b8900 3817245424 S Bi:2:004:2 -115 18 <
ffff88004d0b8900 3817245481 C Bi:2:004:2 0 18 = 70000200 0000000a 00000000 3a000000 0000
ffff88005ba87840 3817245513 S Bi:2:004:2 -115 13 <
ffff88005ba87840 3817245566 C Bi:2:004:2 0 13 = 55534253 2d000000 00000000 00
ffff88005ba87840 3819292927 S Bo:2:004:1 -115 31 = 55534243 2e000000 00000000 00000600 00000000 00000000 00000000 000000
ffff88005ba87840 3819292977 C Bo:2:004:1 0 31 >
ffff88005ba87840 3819293054 S Bi:2:004:2 -115 13 <
ffff88005ba87840 3819293095 C Bi:2:004:2 0 13 = 55534253 2e000000 00000000 01
ffff88005ba87840 3819293106 S Bo:2:004:1 -115 31 = 55534243 2f000000 12000000 80000603 00000012 00000000 00000000 000000
ffff88005ba87840 3819293130 C Bo:2:004:1 0 31 >
ffff880050d05540 3819293144 S Bi:2:004:2 -115 18 <
ffff880050d05540 3819293224 C Bi:2:004:2 0 18 = 70000200 0000000a 00000000 3a000000 0000
ffff88005ba87840 3819293277 S Bi:2:004:2 -115 13 <
ffff88005ba87840 3819293311 C Bi:2:004:2 0 13 = 55534253 2f000000 00000000 00
ffff88005ba87840 3821341216 S Bo:2:004:1 -115 31 = 55534243 30000000 00000000 00000600 00000000 00000000 00000000 000000
ffff88005ba87840 3821341324 C Bo:2:004:1 0 31 >
ffff88005ba87840 3821341394 S Bi:2:004:2 -115 13 <
ffff88005ba87840 3821341461 C Bi:2:004:2 0 13 = 55534253 30000000 00000000 01
ffff88005ba87840 3821341496 S Bo:2:004:1 -115 31 = 55534243 31000000 12000000 80000603 00000012 00000000 00000000 000000
ffff88005ba87840 3821341538 C Bo:2:004:1 0 31 >
ffff88004d100c00 3821341581 S Bi:2:004:2 -115 18 <
ffff88004d100c00 3821341642 C Bi:2:004:2 0 18 = 70000200 0000000a 00000000 3a000000 0000
ffff88005ba87840 3821341762 S Bi:2:004:2 -115 13 <
ffff88005ba87840 3821341850 C Bi:2:004:2 0 13 = 55534253 31000000 00000000 00
ffff88005ba87840 3823388845 S Bo:2:004:1 -115 31 = 55534243 32000000 00000000 00000600 00000000 00000000 00000000 000000
ffff88005ba87840 3823388917 C Bo:2:004:1 0 31 >
ffff88005ba87840 3823388959 S Bi:2:004:2 -115 13 <
ffff88005ba87840 3823389037 C Bi:2:004:2 0 13 = 55534253 32000000 00000000 01
ffff88005ba87840 3823389056 S Bo:2:004:1 -115 31 = 55534243 33000000 12000000 80000603 00000012 00000000 00000000 000000
ffff88005ba87840 3823389075 C Bo:2:004:1 0 31 >
ffff880050ccb6c0 3823389088 S Bi:2:004:2 -115 18 <
ffff880050ccb6c0 3823389194 C Bi:2:004:2 0 18 = 70000200 0000000a 00000000 3a000000 0000
ffff88005ba87840 3823389207 S Bi:2:004:2 -115 13 <
ffff88005ba87840 3823389233 C Bi:2:004:2 0 13 = 55534253 33000000 00000000 00
ffff88005ba87840 3825437006 S Bo:2:004:1 -115 31 = 55534243 34000000 00000000 00000600 00000000 00000000 00000000 000000
ffff88005ba87840 3825437089 C Bo:2:004:1 0 31 >
ffff88005ba87840 3825437146 S Bi:2:004:2 -115 13 <
ffff88005ba87840 3825437212 C Bi:2:004:2 0 13 = 55534253 34000000 00000000 01
ffff88005ba87840 3825437289 S Bo:2:004:1 -115 31 = 55534243 35000000 12000000 80000603 00000012 00000000 00000000 000000
ffff88005ba87840 3825437354 C Bo:2:004:1 0 31 >
ffff88005bb89780 3825437372 S Bi:2:004:2 -115 18 <
ffff88005bb89780 3825437401 C Bi:2:004:2 0 18 = 70000200 0000000a 00000000 3a000000 0000
ffff88005ba87840 3825437416 S Bi:2:004:2 -115 13 <
ffff88005ba87840 3825437451 C Bi:2:004:2 0 13 = 55534253 35000000 00000000 00
ffff88005ba87840 3827484916 S Bo:2:004:1 -115 31 = 55534243 36000000 00000000 00000600 00000000 00000000 00000000 000000
ffff88005ba87840 3827484973 C Bo:2:004:1 0 31 >
ffff88005ba87840 3827484996 S Bi:2:004:2 -115 13 <
ffff88005ba87840 3827485131 C Bi:2:004:2 0 13 = 55534253 36000000 00000000 01
ffff88005ba87840 3827485177 S Bo:2:004:1 -115 31 = 55534243 37000000 12000000 80000603 00000012 00000000 00000000 000000
ffff88005ba87840 3827485212 C Bo:2:004:1 0 31 >
ffff88005bb89780 3827485220 S Bi:2:004:2 -115 18 <
ffff88005bb89780 3827485292 C Bi:2:004:2 0 18 = 70000200 0000000a 00000000 3a000000 0000
ffff88005ba87840 3827485336 S Bi:2:004:2 -115 13 <
ffff88005ba87840 3827485355 C Bi:2:004:2 0 13 = 55534253 37000000 00000000 00
ffff88005ba87840 3829532967 S Bo:2:004:1 -115 31 = 55534243 38000000 00000000 00000600 00000000 00000000 00000000 000000
ffff88005ba87840 3829533058 C Bo:2:004:1 0 31 >
ffff88005ba87840 3829533109 S Bi:2:004:2 -115 13 <
ffff88005ba87840 3829533207 C Bi:2:004:2 0 13 = 55534253 38000000 00000000 01
ffff88005ba87840 3829533251 S Bo:2:004:1 -115 31 = 55534243 39000000 12000000 80000603 00000012 00000000 00000000 000000
ffff88005ba87840 3829533304 C Bo:2:004:1 0 31 >
ffff880050d3c540 3829533324 S Bi:2:004:2 -115 18 <
ffff880050d3c540 3829533408 C Bi:2:004:2 0 18 = 70000200 0000000a 00000000 3a000000 0000
ffff88005ba87840 3829533455 S Bi:2:004:2 -115 13 <
ffff88005ba87840 3829533522 C Bi:2:004:2 0 13 = 55534253 39000000 00000000 00
ffff88005ba87840 3831580967 S Bo:2:004:1 -115 31 = 55534243 3a000000 00000000 00000600 00000000 00000000 00000000 000000
ffff88005ba87840 3831581020 C Bo:2:004:1 0 31 >
ffff88005ba87840 3831581039 S Bi:2:004:2 -115 13 <
ffff88005ba87840 3831581163 C Bi:2:004:2 0 13 = 55534253 3a000000 00000000 01
ffff88005ba87840 3831581225 S Bo:2:004:1 -115 31 = 55534243 3b000000 12000000 80000603 00000012 00000000 00000000 000000
ffff88005ba87840 3831581266 C Bo:2:004:1 0 31 >
ffff88005bb89a80 3831581283 S Bi:2:004:2 -115 18 <
ffff88005bb89a80 3831581303 C Bi:2:004:2 0 18 = 70000200 0000000a 00000000 3a000000 0000
ffff88005ba87840 3831581318 S Bi:2:004:2 -115 13 <
ffff88005ba87840 3831581428 C Bi:2:004:2 0 13 = 55534253 3b000000 00000000 00
ffff88005ba87840 3833629096 S Bo:2:004:1 -115 31 = 55534243 3c000000 00000000 00000600 00000000 00000000 00000000 000000
ffff88005ba87840 3833629190 C Bo:2:004:1 0 31 >
ffff88005ba87840 3833629224 S Bi:2:004:2 -115 13 <
ffff88005ba87840 3833629386 C Bi:2:004:2 0 13 = 55534253 3c000000 00000000 01
ffff88005ba87840 3833629453 S Bo:2:004:1 -115 31 = 55534243 3d000000 12000000 80000603 00000012 00000000 00000000 000000
ffff88005ba87840 3833629476 C Bo:2:004:1 0 31 >
ffff88005bb89a80 3833629512 S Bi:2:004:2 -115 18 <
ffff88005bb89a80 3833629703 C Bi:2:004:2 0 18 = 70000200 0000000a 00000000 3a000000 0000
ffff88005ba87840 3833629781 S Bi:2:004:2 -115 13 <
ffff88005ba87840 3833629846 C Bi:2:004:2 0 13 = 55534253 3d000000 00000000 00
ffff88005ba87840 3835677008 S Bo:2:004:1 -115 31 = 55534243 3e000000 00000000 00000600 00000000 00000000 00000000 000000
ffff88005ba87840 3835677089 C Bo:2:004:1 0 31 >
ffff88005ba87840 3835677148 S Bi:2:004:2 -115 13 <
ffff88005ba87840 3835677342 C Bi:2:004:2 0 13 = 55534253 3e000000 00000000 01
ffff88005ba87840 3835677414 S Bo:2:004:1 -115 31 = 55534243 3f000000 12000000 80000603 00000012 00000000 00000000 000000
ffff88005ba87840 3835677481 C Bo:2:004:1 0 31 >
ffff88005bb89780 3835677501 S Bi:2:004:2 -115 18 <
ffff88005bb89780 3835677682 C Bi:2:004:2 0 18 = 70000200 0000000a 00000000 3a000000 0000
ffff88005ba87840 3835677754 S Bi:2:004:2 -115 13 <
ffff88005ba87840 3835677818 C Bi:2:004:2 0 13 = 55534253 3f000000 00000000 00
ffff88005ba87840 3837725015 S Bo:2:004:1 -115 31 = 55534243 40000000 00000000 00000600 00000000 00000000 00000000 000000
ffff88005ba87840 3837725096 C Bo:2:004:1 0 31 >
ffff88005ba87840 3837725160 S Bi:2:004:2 -115 13 <
ffff88005ba87840 3837725358 C Bi:2:004:2 0 13 = 55534253 40000000 00000000 01
ffff88005ba87840 3837725377 S Bo:2:004:1 -115 31 = 55534243 41000000 12000000 80000603 00000012 00000000 00000000 000000
ffff88005ba87840 3837725440 C Bo:2:004:1 0 31 >
ffff88005bb89780 3837725492 S Bi:2:004:2 -115 18 <
ffff88005bb89780 3837725555 C Bi:2:004:2 0 18 = 70000200 0000000a 00000000 3a000000 0000
ffff88005ba87840 3837725647 S Bi:2:004:2 -115 13 <
ffff88005ba87840 3837725714 C Bi:2:004:2 0 13 = 55534253 41000000 00000000 00
ffff88005ba87840 3839772848 S Bo:2:004:1 -115 31 = 55534243 42000000 00000000 00000600 00000000 00000000 00000000 000000
ffff88005ba87840 3839772923 C Bo:2:004:1 0 31 >
ffff88005ba87840 3839773134 S Bi:2:004:2 -115 13 <
ffff88005ba87840 3839773191 C Bi:2:004:2 0 13 = 55534253 42000000 00000000 01
ffff88005ba87840 3839773237 S Bo:2:004:1 -115 31 = 55534243 43000000 12000000 80000603 00000012 00000000 00000000 000000
ffff88005ba87840 3839773302 C Bo:2:004:1 0 31 >
ffff88005bb89780 3839773380 S Bi:2:004:2 -115 18 <
ffff88005bb89780 3839773486 C Bi:2:004:2 0 18 = 70000200 0000000a 00000000 3a000000 0000
ffff88005ba87840 3839773557 S Bi:2:004:2 -115 13 <
ffff88005ba87840 3839773630 C Bi:2:004:2 0 13 = 55534253 43000000 00000000 00
ffff88005ba87840 3841821071 S Bo:2:004:1 -115 31 = 55534243 44000000 00000000 00000600 00000000 00000000 00000000 000000
ffff88005ba87840 3841821147 C Bo:2:004:1 0 31 >
ffff88005ba87840 3841821197 S Bi:2:004:2 -115 13 <
ffff88005ba87840 3841821348 C Bi:2:004:2 0 13 = 55534253 44000000 00000000 01
ffff88005ba87840 3841821364 S Bo:2:004:1 -115 31 = 55534243 45000000 12000000 80000603 00000012 00000000 00000000 000000
ffff88005ba87840 3841821403 C Bo:2:004:1 0 31 >
ffff88005bb89780 3841821431 S Bi:2:004:2 -115 18 <
ffff88005bb89780 3841821703 C Bi:2:004:2 0 18 = 70000200 0000000a 00000000 3a000000 0000
ffff88005ba87840 3841821740 S Bi:2:004:2 -115 13 <
ffff88005ba87840 3841821764 C Bi:2:004:2 0 13 = 55534253 45000000 00000000 00
ffff88005ba87840 3843869056 S Bo:2:004:1 -115 31 = 55534243 46000000 00000000 00000600 00000000 00000000 00000000 000000
ffff88005ba87840 3843869137 C Bo:2:004:1 0 31 >
ffff88005ba87840 3843869184 S Bi:2:004:2 -115 13 <
ffff88005ba87840 3843869411 C Bi:2:004:2 0 13 = 55534253 46000000 00000000 01
ffff88005ba87840 3843869479 S Bo:2:004:1 -115 31 = 55534243 47000000 12000000 80000603 00000012 00000000 00000000 000000
ffff88005ba87840 3843869567 C Bo:2:004:1 0 31 >
ffff880050e69840 3843869636 S Bi:2:004:2 -115 18 <
ffff880050e69840 3843869721 C Bi:2:004:2 0 18 = 70000200 0000000a 00000000 3a000000 0000
ffff88005ba87840 3843869793 S Bi:2:004:2 -115 13 <
ffff88005ba87840 3843869857 C Bi:2:004:2 0 13 = 55534253 47000000 00000000 00
ffff88005ba87840 3845916951 S Bo:2:004:1 -115 31 = 55534243 48000000 00000000 00000600 00000000 00000000 00000000 000000
ffff88005ba87840 3845917006 C Bo:2:004:1 0 31 >
ffff88005ba87840 3845917059 S Bi:2:004:2 -115 13 <
ffff88005ba87840 3845917206 C Bi:2:004:2 0 13 = 55534253 48000000 00000000 01
ffff88005ba87840 3845917221 S Bo:2:004:1 -115 31 = 55534243 49000000 12000000 80000603 00000012 00000000 00000000 000000
ffff88005ba87840 3845917290 C Bo:2:004:1 0 31 >
ffff880050c266c0 3845917305 S Bi:2:004:2 -115 18 <
ffff880050c266c0 3845917396 C Bi:2:004:2 0 18 = 70000200 0000000a 00000000 3a000000 0000
ffff88005ba87840 3845917454 S Bi:2:004:2 -115 13 <
ffff88005ba87840 3845917470 C Bi:2:004:2 0 13 = 55534253 49000000 00000000 00
ffff88005ba87840 3847965055 S Bo:2:004:1 -115 31 = 55534243 4a000000 00000000 00000600 00000000 00000000 00000000 000000
ffff88005ba87840 3847965129 C Bo:2:004:1 0 31 >
ffff88005ba87840 3847965151 S Bi:2:004:2 -115 13 <
ffff88005ba87840 3847965386 C Bi:2:004:2 0 13 = 55534253 4a000000 00000000 01
ffff88005ba87840 3847965458 S Bo:2:004:1 -115 31 = 55534243 4b000000 12000000 80000603 00000012 00000000 00000000 000000
ffff88005ba87840 3847965522 C Bo:2:004:1 0 31 >
ffff880050c26900 3847965562 S Bi:2:004:2 -115 18 <
ffff880050c26900 3847965685 C Bi:2:004:2 0 18 = 70000200 0000000a 00000000 3a000000 0000
ffff88005ba87840 3847965757 S Bi:2:004:2 -115 13 <
ffff88005ba87840 3847965821 C Bi:2:004:2 0 13 = 55534253 4b000000 00000000 00
ffff88005ba87840 3850012945 S Bo:2:004:1 -115 31 = 55534243 4c000000 00000000 00000600 00000000 00000000 00000000 000000
ffff88005ba87840 3850012979 C Bo:2:004:1 0 31 >
ffff88005ba87840 3850013023 S Bi:2:004:2 -115 13 <
ffff88005ba87840 3850013196 C Bi:2:004:2 0 13 = 55534253 4c000000 00000000 01
ffff88005ba87840 3850013218 S Bo:2:004:1 -115 31 = 55534243 4d000000 12000000 80000603 00000012 00000000 00000000 000000
ffff88005ba87840 3850013234 C Bo:2:004:1 0 31 >
ffff880050c26b40 3850013247 S Bi:2:004:2 -115 18 <
ffff880050c26b40 3850013628 C Bi:2:004:2 0 18 = 70000200 0000000a 00000000 3a000000 0000
ffff88005ba87840 3850013681 S Bi:2:004:2 -115 13 <
ffff88005ba87840 3850013695 C Bi:2:004:2 0 13 = 55534253 4d000000 00000000 00
ffff88005ba87840 3852061017 S Bo:2:004:1 -115 31 = 55534243 4e000000 00000000 00000600 00000000 00000000 00000000 000000
ffff88005ba87840 3852061098 C Bo:2:004:1 0 31 >
ffff88005ba87840 3852061160 S Bi:2:004:2 -115 13 <
ffff88005ba87840 3852061346 C Bi:2:004:2 0 13 = 55534253 4e000000 00000000 01
ffff88005ba87840 3852061420 S Bo:2:004:1 -115 31 = 55534243 4f000000 12000000 80000603 00000012 00000000 00000000 000000
ffff88005ba87840 3852061486 C Bo:2:004:1 0 31 >
ffff880050c26e40 3852061500 S Bi:2:004:2 -115 18 <
ffff880050c26e40 3852061679 C Bi:2:004:2 0 18 = 70000200 0000000a 00000000 3a000000 0000
ffff88005ba87840 3852061727 S Bi:2:004:2 -115 13 <
ffff88005ba87840 3852061753 C Bi:2:004:2 0 13 = 55534253 4f000000 00000000 00
ffff88005ba87840 3854109008 S Bo:2:004:1 -115 31 = 55534243 50000000 00000000 00000600 00000000 00000000 00000000 000000
ffff88005ba87840 3854109100 C Bo:2:004:1 0 31 >
ffff88005ba87840 3854109152 S Bi:2:004:2 -115 13 <
ffff88005ba87840 3854109343 C Bi:2:004:2 0 13 = 55534253 50000000 00000000 01
ffff88005ba87840 3854109390 S Bo:2:004:1 -115 31 = 55534243 51000000 12000000 80000603 00000012 00000000 00000000 000000
ffff88005ba87840 3854109458 C Bo:2:004:1 0 31 >
ffff880050c26d80 3854109501 S Bi:2:004:2 -115 18 <
ffff880050c26d80 3854109680 C Bi:2:004:2 0 18 = 70000200 0000000a 00000000 3a000000 0000
ffff88005ba87840 3854109741 S Bi:2:004:2 -115 13 <
ffff88005ba87840 3854109803 C Bi:2:004:2 0 13 = 55534253 51000000 00000000 00
ffff88005ba87840 3856160820 S Bo:2:004:1 -115 31 = 55534243 52000000 00000000 00000600 00000000 00000000 00000000 000000
ffff88005ba87840 3856160842 C Bo:2:004:1 0 31 >
ffff88005ba87840 3856160867 S Bi:2:004:2 -115 13 <
ffff88005ba87840 3856161053 C Bi:2:004:2 0 13 = 55534253 52000000 00000000 01
ffff88005ba87840 3856161063 S Bo:2:004:1 -115 31 = 55534243 53000000 12000000 80000603 00000012 00000000 00000000 000000
ffff88005ba87840 3856161092 C Bo:2:004:1 0 31 >
ffff88004d0ad480 3856161099 S Bi:2:004:2 -115 18 <
ffff88004d0ad480 3856161325 C Bi:2:004:2 0 18 = 70000200 0000000a 00000000 3a000000 0000
ffff88005ba87840 3856161333 S Bi:2:004:2 -115 13 <
ffff88005ba87840 3856161365 C Bi:2:004:2 0 13 = 55534253 53000000 00000000 00
ffff88005ba87840 3858205015 S Bo:2:004:1 -115 31 = 55534243 54000000 00000000 00000600 00000000 00000000 00000000 000000
ffff88005ba87840 3858205037 C Bo:2:004:1 0 31 >
ffff88005ba87840 3858205044 S Bi:2:004:2 -115 13 <
ffff88005ba87840 3858205233 C Bi:2:004:2 0 13 = 55534253 54000000 00000000 01
ffff88005ba87840 3858205274 S Bo:2:004:1 -115 31 = 55534243 55000000 12000000 80000603 00000012 00000000 00000000 000000
ffff88005ba87840 3858205284 C Bo:2:004:1 0 31 >
ffff880050c26180 3858205316 S Bi:2:004:2 -115 18 <
ffff880050c26180 3858205420 C Bi:2:004:2 0 18 = 70000200 0000000a 00000000 3a000000 0000
ffff88005ba87840 3858205460 S Bi:2:004:2 -115 13 <
ffff88005ba87840 3858205469 C Bi:2:004:2 0 13 = 55534253 55000000 00000000 00
ffff88005ba87840 3860252996 S Bo:2:004:1 -115 31 = 55534243 56000000 00000000 00000600 00000000 00000000 00000000 000000
ffff88005ba87840 3860253068 C Bo:2:004:1 0 31 >
ffff88005ba87840 3860253129 S Bi:2:004:2 -115 13 <
ffff88005ba87840 3860253306 C Bi:2:004:2 0 13 = 55534253 56000000 00000000 01
ffff88005ba87840 3860253378 S Bo:2:004:1 -115 31 = 55534243 57000000 12000000 80000603 00000012 00000000 00000000 000000
ffff88005ba87840 3860253445 C Bo:2:004:1 0 31 >
ffff880050c260c0 3860253478 S Bi:2:004:2 -115 18 <
ffff880050c260c0 3860253619 C Bi:2:004:2 0 18 = 70000200 0000000a 00000000 3a000000 0000
ffff88005ba87840 3860253659 S Bi:2:004:2 -115 13 <
ffff88005ba87840 3860253727 C Bi:2:004:2 0 13 = 55534253 57000000 00000000 00
ffff88005ba87840 3862301251 S Bo:2:004:1 -115 31 = 55534243 58000000 00000000 00000600 00000000 00000000 00000000 000000
ffff88005ba87840 3862301318 C Bo:2:004:1 0 31 >
ffff88005ba87840 3862301400 S Bi:2:004:2 -115 13 <
ffff88005ba87840 3862301541 C Bi:2:004:2 0 13 = 55534253 58000000 00000000 01
ffff88005ba87840 3862301593 S Bo:2:004:1 -115 31 = 55534243 59000000 12000000 80000603 00000012 00000000 00000000 000000
ffff88005ba87840 3862301680 C Bo:2:004:1 0 31 >
ffff880050c92900 3862301732 S Bi:2:004:2 -115 18 <
ffff880050c92900 3862301819 C Bi:2:004:2 0 18 = 70000200 0000000a 00000000 3a000000 0000
ffff88005ba87840 3862301844 S Bi:2:004:2 -115 13 <
ffff88005ba87840 3862301936 C Bi:2:004:2 0 13 = 55534253 59000000 00000000 00
ffff88005ba87840 3864349053 S Bo:2:004:1 -115 31 = 55534243 5a000000 00000000 00000600 00000000 00000000 00000000 000000
ffff88005ba87840 3864349136 C Bo:2:004:1 0 31 >
ffff88005ba87840 3864349275 S Bi:2:004:2 -115 13 <
ffff88005ba87840 3864349338 C Bi:2:004:2 0 13 = 55534253 5a000000 00000000 01
ffff88005ba87840 3864349373 S Bo:2:004:1 -115 31 = 55534243 5b000000 12000000 80000603 00000012 00000000 00000000 000000
ffff88005ba87840 3864349412 C Bo:2:004:1 0 31 >
ffff880050c92a80 3864349445 S Bi:2:004:2 -115 18 <
ffff880050c92a80 3864349624 C Bi:2:004:2 0 18 = 70000200 0000000a 00000000 3a000000 0000
ffff88005ba87840 3864349723 S Bi:2:004:2 -115 13 <
ffff88005ba87840 3864349783 C Bi:2:004:2 0 13 = 55534253 5b000000 00000000 00
ffff88005ba87840 3866397214 S Bo:2:004:1 -115 31 = 55534243 5c000000 00000000 00000600 00000000 00000000 00000000 000000
ffff88005ba87840 3866397297 C Bo:2:004:1 0 31 >
ffff88005ba87840 3866397367 S Bi:2:004:2 -115 13 <
ffff88005ba87840 3866397537 C Bi:2:004:2 0 13 = 55534253 5c000000 00000000 01
ffff88005ba87840 3866397593 S Bo:2:004:1 -115 31 = 55534243 5d000000 12000000 80000603 00000012 00000000 00000000 000000
ffff88005ba87840 3866397652 C Bo:2:004:1 0 31 >
ffff880050c92a80 3866397732 S Bi:2:004:2 -115 18 <
ffff880050c92a80 3866397824 C Bi:2:004:2 0 18 = 70000200 0000000a 00000000 3a000000 0000
ffff88005ba87840 3866397885 S Bi:2:004:2 -115 13 <
ffff88005ba87840 3866397944 C Bi:2:004:2 0 13 = 55534253 5d000000 00000000 00
ffff88005ba87840 3868445058 S Bo:2:004:1 -115 31 = 55534243 5e000000 00000000 00000600 00000000 00000000 00000000 000000
ffff88005ba87840 3868445138 C Bo:2:004:1 0 31 >
ffff88005ba87840 3868445280 S Bi:2:004:2 -115 13 <
ffff88005ba87840 3868445338 C Bi:2:004:2 0 13 = 55534253 5e000000 00000000 01
ffff88005ba87840 3868445411 S Bo:2:004:1 -115 31 = 55534243 5f000000 12000000 80000603 00000012 00000000 00000000 000000
ffff88005ba87840 3868445488 C Bo:2:004:1 0 31 >
ffff880050e6a540 3868445561 S Bi:2:004:2 -115 18 <
ffff880050e6a540 3868445666 C Bi:2:004:2 0 18 = 70000200 0000000a 00000000 3a000000 0000
ffff88005ba87840 3868445711 S Bi:2:004:2 -115 13 <
ffff88005ba87840 3868445811 C Bi:2:004:2 0 13 = 55534253 5f000000 00000000 00
ffff88005ba87840 3870493226 S Bo:2:004:1 -115 31 = 55534243 60000000 00000000 00000600 00000000 00000000 00000000 000000
ffff88005ba87840 3870493308 C Bo:2:004:1 0 31 >
ffff88005ba87840 3870493379 S Bi:2:004:2 -115 13 <
ffff88005ba87840 3870493454 C Bi:2:004:2 0 13 = 55534253 60000000 00000000 01
ffff88005ba87840 3870493533 S Bo:2:004:1 -115 31 = 55534243 61000000 12000000 80000603 00000012 00000000 00000000 000000
ffff88005ba87840 3870493597 C Bo:2:004:1 0 31 >
ffff880050e6a540 3870493677 S Bi:2:004:2 -115 18 <
ffff880050e6a540 3870493753 C Bi:2:004:2 0 18 = 70000200 0000000a 00000000 3a000000 0000
ffff88005ba87840 3870493823 S Bi:2:004:2 -115 13 <
ffff88005ba87840 3870493900 C Bi:2:004:2 0 13 = 55534253 61000000 00000000 00
ffff88005ba87840 3872541231 S Bo:2:004:1 -115 31 = 55534243 62000000 00000000 00000600 00000000 00000000 00000000 000000
ffff88005ba87840 3872541315 C Bo:2:004:1 0 31 >
ffff88005ba87840 3872541336 S Bi:2:004:2 -115 13 <
ffff88005ba87840 3872541364 C Bi:2:004:2 0 13 = 55534253 62000000 00000000 01
ffff88005ba87840 3872541379 S Bo:2:004:1 -115 31 = 55534243 63000000 12000000 80000603 00000012 00000000 00000000 000000
ffff88005ba87840 3872541406 C Bo:2:004:1 0 31 >
ffff880050e6a540 3872541438 S Bi:2:004:2 -115 18 <
ffff880050e6a540 3872541478 C Bi:2:004:2 0 18 = 70000200 0000000a 00000000 3a000000 0000
ffff88005ba87840 3872541500 S Bi:2:004:2 -115 13 <
ffff88005ba87840 3872541525 C Bi:2:004:2 0 13 = 55534253 63000000 00000000 00
ffff88005ba87840 3874589204 S Bo:2:004:1 -115 31 = 55534243 64000000 00000000 00000600 00000000 00000000 00000000 000000
ffff88005ba87840 3874589286 C Bo:2:004:1 0 31 >
ffff88005ba87840 3874589380 S Bi:2:004:2 -115 13 <
ffff88005ba87840 3874589461 C Bi:2:004:2 0 13 = 55534253 64000000 00000000 01
ffff88005ba87840 3874589573 S Bo:2:004:1 -115 31 = 55534243 65000000 12000000 80000603 00000012 00000000 00000000 000000
ffff88005ba87840 3874589647 C Bo:2:004:1 0 31 >
ffff880050e6ae40 3874589753 S Bi:2:004:2 -115 18 <
ffff880050e6ae40 3874589829 C Bi:2:004:2 0 18 = 70000200 0000000a 00000000 3a000000 0000
ffff88005ba87840 3874589933 S Bi:2:004:2 -115 13 <
ffff88005ba87840 3874590012 C Bi:2:004:2 0 13 = 55534253 65000000 00000000 00
ffff88007843ab40 3875628978 C Ii:2:001:1 0:2048 1 = 02
ffff88007843ab40 3875628991 S Ii:2:001:1 -115:2048 4 <
ffff88004d0ad480 3875629002 S Ci:2:001:0 s a3 00 0000 0001 0004 4 <
ffff88004d0ad480 3875629011 C Ci:2:001:0 0 4 = 00010100
ffff88004d0ad480 3875629014 S Co:2:001:0 s 23 01 0010 0001 0000 0
ffff88004d0ad480 3875629019 C Co:2:001:0 0 0
ffff88004d0ad480 3875631228 S Ci:2:001:0 s a3 00 0000 0001 0004 4 <
ffff88004d0ad480 3875631251 C Ci:2:001:0 0 4 = 00010000
ffff88007843ab40 3875652863 C Ii:2:001:1 0:2048 1 = 02
ffff88007843ab40 3875652871 S Ii:2:001:1 -115:2048 4 <
ffff88004d0ad480 3875660837 S Ci:2:001:0 s a3 00 0000 0001 0004 4 <
ffff88004d0ad480 3875660851 C Ci:2:001:0 0 4 = 01010100
ffff88004d0ad480 3875660885 S Co:2:001:0 s 23 01 0010 0001 0000 0
ffff88004d0ad480 3875660892 C Co:2:001:0 0 0
ffff88004d0ad480 3875692864 S Ci:2:001:0 s a3 00 0000 0001 0004 4 <
ffff88004d0ad480 3875692881 C Ci:2:001:0 0 4 = 01010000
ffff88004d0ad480 3875724841 S Ci:2:001:0 s a3 00 0000 0001 0004 4 <
ffff88004d0ad480 3875724853 C Ci:2:001:0 0 4 = 01010000
ffff88004d0ad480 3875756823 S Ci:2:001:0 s a3 00 0000 0001 0004 4 <
ffff88004d0ad480 3875756834 C Ci:2:001:0 0 4 = 01010000
ffff88004d0ad480 3875788824 S Ci:2:001:0 s a3 00 0000 0001 0004 4 <
ffff88004d0ad480 3875788835 C Ci:2:001:0 0 4 = 01010000
ffff88004d0ad480 3875788909 S Co:2:001:0 s 23 03 0004 0001 0000 0
ffff88004d0ad480 3875788918 C Co:2:001:0 0 0
ffff88004d0ad480 3875844830 S Ci:2:001:0 s a3 00 0000 0001 0004 4 <
ffff88004d0ad480 3875844844 C Ci:2:001:0 0 4 = 03051000
ffff88004d0ad480 3875900840 S Co:2:001:0 s 23 01 0014 0001 0000 0
ffff88004d0ad480 3875900853 C Co:2:001:0 0 0
ffff88004d0ad480 3875900924 S Ci:2:000:0 s 80 06 0100 0000 0040 64 <
ffff88004d0ad480 3875901043 C Ci:2:000:0 0 18 = 12010002 e0000040 d118244e 31020203 0401
ffff88004d0ad480 3875901059 S Co:2:001:0 s 23 03 0004 0001 0000 0
ffff88004d0ad480 3875901070 C Co:2:001:0 0 0
ffff88004d0ad480 3875956830 S Ci:2:001:0 s a3 00 0000 0001 0004 4 <
ffff88004d0ad480 3875956844 C Ci:2:001:0 0 4 = 03051000
ffff88004d0ad480 3876012874 S Co:2:001:0 s 23 01 0014 0001 0000 0
ffff88004d0ad480 3876012885 C Co:2:001:0 0 0
ffff88004d0ad480 3876028833 S Ci:2:005:0 s 80 06 0100 0000 0012 18 <
ffff88004d0ad480 3876028971 C Ci:2:005:0 0 18 = 12010002 e0000040 d118244e 31020203 0401
ffff88004d0ad480 3876028996 S Ci:2:005:0 s 80 06 0200 0000 0009 9 <
ffff88004d0ad480 3876029047 C Ci:2:005:0 0 9 = 09026200 03010080 fa
ffff88004d0ad480 3876029055 S Ci:2:005:0 s 80 06 0200 0000 0062 98 <
ffff88004d0ad480 3876029212 C Ci:2:005:0 0 98 = 09026200 03010080 fa080b00 02e00103 07090400 0001e001 03050524 00100105
ffff88004d0ada80 3876029242 S Ci:2:005:0 s 80 06 0300 0000 00ff 255 <
ffff88004d0ada80 3876029329 C Ci:2:005:0 0 4 = 04030904
ffff88004d0ada80 3876029342 S Ci:2:005:0 s 80 06 0303 0409 00ff 255 <
ffff88004d0ada80 3876029436 C Ci:2:005:0 0 16 = 10034e00 65007800 75007300 20005300
ffff88004d0ada80 3876029453 S Ci:2:005:0 s 80 06 0302 0409 00ff 255 <
ffff88004d0ada80 3876029547 C Ci:2:005:0 0 16 = 10035300 61006d00 73007500 6e006700
ffff88004d0ada80 3876029564 S Ci:2:005:0 s 80 06 0304 0409 00ff 255 <
ffff88004d0ada80 3876029698 C Ci:2:005:0 0 34 = 22033300 33003300 34003400 33003600 38004300 31003100 33003000 30004500
ffff88004d0ade40 3876030058 S Co:2:005:0 s 00 09 0001 0000 0000 0
ffff88004d0ade40 3876030285 C Co:2:005:0 0 0
ffff88004d0add80 3876030329 S Ci:2:005:0 s 80 06 0305 0409 00ff 255 <
ffff88004d0add80 3876030429 C Ci:2:005:0 0 58 = 3a035200 4e004400 49005300 20004300 6f006d00 6d007500 6e006900 63006100
ffff88004d0add80 3876030503 S Co:2:005:0 s 21 43 000e 0000 0000 0
ffff88004d0add80 3876030552 C Co:2:005:0 -32 0
ffff88004d0add80 3876030562 S Co:2:005:0 s 21 00 0000 0000 0018 24 = 02000000 18000000 01000000 01000000 00000000 00080000
ffff88004d0add80 3876030686 C Co:2:005:0 0 24 >
ffff88004d0add80 3876030701 S Ci:2:005:0 s a1 01 0000 0000 0401 1025 <
ffff88004d0add80 3876030791 C Ci:2:005:0 0 52 = 02000080 34000000 01000000 00000000 01000000 00000000 01000000 00000000
ffff88004d0add80 3876030800 S Co:2:005:0 s 21 00 0000 0000 001c 28 = 04000000 1c000000 02000000 02020100 00000000 14000000 00000000
ffff88004d0add80 3876030894 C Co:2:005:0 0 28 >
ffff88004d0add80 3876030903 S Ci:2:005:0 s a1 01 0000 0000 0401 1025 <
ffff88004d0add80 3876030987 C Ci:2:005:0 0 28 = 04000080 1c000000 02000000 00000000 04000000 10000000 00000000
ffff88004d0add80 3876030994 S Co:2:005:0 s 21 00 0000 0000 004c 76 = 04000000 4c000000 03000000 01010101 30000000 14000000 00000000 00000000
ffff88004d0add80 3876031074 C Co:2:005:0 0 76 >
ffff88004d0add80 3876031081 S Ci:2:005:0 s a1 01 0000 0000 0401 1025 <
ffff88004d0add80 3876031170 C Ci:2:005:0 0 30 = 04000080 1e000000 03000000 00000000 06000000 10000000 52f572ae 7ce6
ffff88004d0add80 3876031177 S Co:2:005:0 s 21 00 0000 0000 0020 32 = 05000000 20000000 04000000 0e010100 04000000 14000000 00000000 2d000000
ffff88004d0add80 3876031248 C Co:2:005:0 0 32 >
ffff88004d0add80 3876031254 S Ci:2:005:0 s a1 01 0000 0000 0401 1025 <
ffff88004d0add80 3876031336 C Ci:2:005:0 0 16 = 05000080 10000000 04000000 00000000
ffff88004d0ad3c0 3876031640 S Ci:2:005:0 s 80 06 0306 0409 00ff 255 <
ffff88004d0ad3c0 3876031726 C Ci:2:005:0 0 40 = 28035200 4e004400 49005300 20004500 74006800 65007200 6e006500 74002000
ffff88004d0ad600 3876031914 S Ci:2:001:0 s a3 00 0000 0001 0004 4 <
ffff88004d0ad600 3876031922 C Ci:2:001:0 0 4 = 03050000
ffff880050e1c6c0 3876364940 S Ci:2:005:0 s 80 06 0300 0000 0004 4 <
ffff880050e1c6c0 3876365179 C Ci:2:005:0 0 4 = 04030904
ffff880050e1c6c0 3876365255 S Ci:2:005:0 s 80 06 0302 0409 00fe 254 <
ffff880050e1c6c0 3876365350 C Ci:2:005:0 0 16 = 10035300 61006d00 73007500 6e006700
ffff880050e69e40 3876365481 S Ci:2:005:0 s 80 06 0300 0000 0004 4 <
ffff880050e69e40 3876365555 C Ci:2:005:0 0 4 = 04030904
ffff880050e69e40 3876365636 S Ci:2:005:0 s 80 06 0303 0409 00fe 254 <
ffff880050e69e40 3876365707 C Ci:2:005:0 0 16 = 10034e00 65007800 75007300 20005300
ffff880050e69e40 3876365794 S Ci:2:005:0 s 80 06 0300 0000 0004 4 <
ffff880050e69e40 3876365891 C Ci:2:005:0 0 4 = 04030904
ffff880050e69e40 3876365976 S Ci:2:005:0 s 80 06 0304 0409 00fe 254 <
ffff880050e69e40 3876366041 C Ci:2:005:0 0 34 = 22033300 33003300 34003400 33003600 38004300 31003100 33003000 30004500
ffff880050e69e40 3876366121 S Ci:2:005:0 s 80 06 0300 0000 0004 4 <
ffff880050e69e40 3876366203 C Ci:2:005:0 0 4 = 04030904
ffff880050e69e40 3876366288 S Ci:2:005:0 s 80 06 0307 0409 00fe 254 <
ffff880050e69e40 3876366395 C Ci:2:005:0 0 12 = 0c035200 4e004400 49005300
ffff880050e69e40 3876366454 S Ci:2:005:0 s 80 06 0300 0000 0004 4 <
ffff880050e69e40 3876366536 C Ci:2:005:0 0 4 = 04030904
ffff880050e69e40 3876366662 S Ci:2:005:0 s 80 06 0305 0409 00fe 254 <
ffff880050e69e40 3876366765 C Ci:2:005:0 0 58 = 3a035200 4e004400 49005300 20004300 6f006d00 6d007500 6e006900 63006100
ffff880050e69e40 3876366861 S Ci:2:005:0 s 80 06 0300 0000 0004 4 <
ffff880050e69e40 3876367000 C Ci:2:005:0 0 4 = 04030904
ffff880050e69e40 3876367093 S Ci:2:005:0 s 80 06 0306 0409 00fe 254 <
ffff880050e69e40 3876367201 C Ci:2:005:0 0 40 = 28035200 4e004400 49005300 20004500 74006800 65007200 6e006500 74002000
ffff880050e69e40 3876367355 S Ci:2:005:0 s 80 06 0600 0000 000a 10 <
ffff880050e69e40 3876367475 C Ci:2:005:0 0 10 = 0a060002 e0000040 0100
ffff880050e69e40 3876367541 S Ci:2:005:0 s 80 06 0a00 0000 0004 4 <
ffff880050e69e40 3876367671 C Ci:2:005:0 -32 0
ffff880050e69e40 3876367757 S Ci:2:005:0 s 80 00 0000 0000 0002 2 <
ffff880050e69e40 3876367902 C Ci:2:005:0 0 2 = 0100
ffff88004d0add80 3876392851 S Ii:2:005:3 -115:256 8 <
ffff880050cc9240 3876392872 S Bi:2:005:5 -115 2048 <
ffff880050cc9300 3876392875 S Bi:2:005:5 -115 2048 <
ffff880050cc93c0 3876392876 S Bi:2:005:5 -115 2048 <
ffff880050cc9480 3876392877 S Bi:2:005:5 -115 2048 <
ffff880050cc9540 3876392878 S Bi:2:005:5 -115 2048 <
ffff880050cc9600 3876392879 S Bi:2:005:5 -115 2048 <
ffff880050cc96c0 3876392880 S Bi:2:005:5 -115 2048 <
ffff880050cc9780 3876392881 S Bi:2:005:5 -115 2048 <
ffff880050cc9840 3876392882 S Bi:2:005:5 -115 2048 <
ffff880050cc9900 3876392883 S Bi:2:005:5 -115 2048 <
ffff880050cc99c0 3876392885 S Bi:2:005:5 -115 2048 <
ffff880050cc9a80 3876392886 S Bi:2:005:5 -115 2048 <
ffff880050cc9b40 3876392887 S Bi:2:005:5 -115 2048 <
ffff880050cc9c00 3876392888 S Bi:2:005:5 -115 2048 <
ffff880050cc9cc0 3876392889 S Bi:2:005:5 -115 2048 <
ffff880050cc9d80 3876392890 S Bi:2:005:5 -115 2048 <
ffff880078728cc0 3876392895 S Bi:2:005:5 -115 2048 <
ffff880050cc9240 3876392896 C Bi:2:005:5 0 134 = 01000000 86000000 24000000 5a000000 00000000 00000000 00000000 00000000
ffff880050e12e40 3876392897 S Bi:2:005:5 -115 2048 <
ffff880050e12c00 3876392899 S Bi:2:005:5 -115 2048 <
ffff880050cc9240 3876392901 S Bi:2:005:5 -115 2048 <
ffff880050e12d80 3876392904 S Bi:2:005:5 -115 2048 <
ffff88003e2e8f00 3876392909 S Bi:2:005:5 -115 2048 <
ffff88003e2e83c0 3876392911 S Bi:2:005:5 -115 2048 <
ffff88003e2e8000 3876392912 S Bi:2:005:5 -115 2048 <
ffff88003e2e8480 3876392914 S Bi:2:005:5 -115 2048 <
ffff88003e2e8540 3876392916 S Bi:2:005:5 -115 2048 <
ffff88003e2e8300 3876392918 S Bi:2:005:5 -115 2048 <
ffff88003e2e86c0 3876392920 S Bi:2:005:5 -115 2048 <
ffff88003e2e8cc0 3876392921 S Bi:2:005:5 -115 2048 <
ffff88003e2e8240 3876392922 S Bi:2:005:5 -115 2048 <
ffff88003e2e8b40 3876392923 S Bi:2:005:5 -115 2048 <
ffff88003e2e8d80 3876392970 S Bi:2:005:5 -115 2048 <
ffff88003e2e8c00 3876392971 S Bi:2:005:5 -115 2048 <
ffff88006490f180 3876392973 S Bi:2:005:5 -115 2048 <
ffff88006490fd80 3876392975 S Bi:2:005:5 -115 2048 <
ffff880066182a80 3876392976 S Bi:2:005:5 -115 2048 <
ffff880066182180 3876392978 S Bi:2:005:5 -115 2048 <
ffff880066182e40 3876392979 S Bi:2:005:5 -115 2048 <
ffff880066182840 3876392980 S Bi:2:005:5 -115 2048 <
ffff88005b807300 3876392981 S Bi:2:005:5 -115 2048 <
ffff8800662f9180 3876392983 S Bi:2:005:5 -115 2048 <
ffff8800662f9c00 3876392984 S Bi:2:005:5 -115 2048 <
ffff8800662f9900 3876392987 S Bi:2:005:5 -115 2048 <
ffff8800662f9f00 3876392988 S Bi:2:005:5 -115 2048 <
ffff880050fda9c0 3876392989 S Bi:2:005:5 -115 2048 <
ffff880050fd2240 3876404811 S Bo:2:005:4 -115 134 = 01000000 86000000 24000000 5a000000 00000000 00000000 00000000 00000000
ffff880050fd2240 3876404845 C Bo:2:005:4 0 134 >
ffff880050cc9300 3876414925 C Bi:2:005:5 0 122 = 01000000 7a000000 24000000 4e000000 00000000 00000000 00000000 00000000
ffff880050cc9300 3876414933 S Bi:2:005:5 -115 2048 <
ffff88004d0add80 3876420109 C Ii:2:005:3 0:256 8 = 01000000 00000000
ffff88004d0add80 3876420119 S Ii:2:005:3 -115:256 8 <
ffff88005ba879c0 3876433056 S Bo:2:005:4 -115 386 = 01000000 82010000 24000000 56010000 00000000 00000000 00000000 00000000
ffff88005ba879c0 3876433091 C Bo:2:005:4 0 386 >
ffff880050cc93c0 3876434409 C Bi:2:005:5 0 86 = 01000000 56000000 24000000 2a000000 00000000 00000000 00000000 00000000
ffff880050cc93c0 3876434414 S Bi:2:005:5 -115 2048 <
ffff88004d0add80 3876452132 C Ii:2:005:3 0:256 8 = 01000000 00000000
ffff88004d0add80 3876452139 S Ii:2:005:3 -115:256 8 <
ffff88004d0add80 3876484108 C Ii:2:005:3 0:256 8 = 01000000 00000000
ffff88004d0add80 3876484114 S Ii:2:005:3 -115:256 8 <
ffff88004d0add80 3876516160 C Ii:2:005:3 0:256 8 = 01000000 00000000
ffff88004d0add80 3876516169 S Ii:2:005:3 -115:256 8 <
ffff88004d1db900 3876688803 S Bo:2:005:4 -115 134 = 01000000 86000000 24000000 5a000000 00000000 00000000 00000000 00000000
ffff88004d1db900 3876688834 C Bo:2:005:4 0 134 >
ffff880050cf6a80 3876884811 S Bo:2:005:4 -115 122 = 01000000 7a000000 24000000 4e000000 00000000 00000000 00000000 00000000
ffff880050cf6a80 3876884838 C Bo:2:005:4 0 122 >
ffff880050cc9480 3877419062 C Bi:2:005:5 0 114 = 01000000 72000000 24000000 46000000 00000000 00000000 00000000 00000000
ffff880050cc9480 3877419071 S Bi:2:005:5 -115 2048 <
ffff880050cc9540 3877438375 C Bi:2:005:5 0 86 = 01000000 56000000 24000000 2a000000 00000000 00000000 00000000 00000000
ffff880050cc9540 3877438388 S Bi:2:005:5 -115 2048 <
ffff880050fdacc0 3877884942 S Bo:2:005:4 -115 134 = 01000000 86000000 24000000 5a000000 00000000 00000000 00000000 00000000
ffff880050fda480 3877884955 S Bo:2:005:4 -115 114 = 01000000 72000000 24000000 46000000 00000000 00000000 00000000 00000000
ffff880050fdacc0 3877884977 C Bo:2:005:4 0 134 >
ffff880050fda480 3877885015 C Bo:2:005:4 0 114 >
ffff880050fda0c0 3877892825 S Bo:2:005:4 -115 134 = 01000000 86000000 24000000 5a000000 00000000 00000000 00000000 00000000
ffff880050fda0c0 3877892850 C Bo:2:005:4 0 134 >
ffff880050fda6c0 3877968832 S Bo:2:005:4 -115 154 = 01000000 9a000000 24000000 6e000000 00000000 00000000 00000000 00000000
ffff880050fda6c0 3877968862 C Bo:2:005:4 0 154 >
ffff880050fda300 3877985432 S Bo:2:005:4 -115 151 = 01000000 97000000 24000000 6b000000 00000000 00000000 00000000 00000000
ffff880050fda300 3877985465 C Bo:2:005:4 0 151 >
ffff880050fda3c0 3878096926 S Bo:2:005:4 -115 134 = 01000000 86000000 24000000 5a000000 00000000 00000000 00000000 00000000
ffff880050fda3c0 3878096997 C Bo:2:005:4 0 134 >
ffff880050fda900 3878156051 S Bo:2:005:4 -115 369 = 01000000 71010000 24000000 45010000 00000000 00000000 00000000 00000000
ffff880050fda900 3878156092 C Bo:2:005:4 0 369 >
ffff88005ba93d80 3878214435 S Bo:2:005:4 -115 221 = 01000000 dd000000 24000000 b1000000 00000000 00000000 00000000 00000000
ffff88005ba93d80 3878214471 C Bo:2:005:4 0 221 >
ffff88004d1659c0 3878406984 S Bo:2:005:4 -115 369 = 01000000 71010000 24000000 45010000 00000000 00000000 00000000 00000000
ffff88004d1659c0 3878407071 C Bo:2:005:4 0 369 >
ffff880050cc9600 3878442237 C Bi:2:005:5 0 86 = 01000000 56000000 24000000 2a000000 00000000 00000000 00000000 00000000
ffff880050cc9600 3878442259 S Bi:2:005:5 -115 2048 <
ffff88004d165c00 3878657745 S Bo:2:005:4 -115 369 = 01000000 71010000 24000000 45010000 00000000 00000000 00000000 00000000
ffff88004d165c00 3878657802 C Bo:2:005:4 0 369 >
ffff88004d165a80 3878858407 S Bo:2:005:4 -115 351 = 01000000 5f010000 24000000 33010000 00000000 00000000 00000000 00000000
ffff88004d165a80 3878858466 C Bo:2:005:4 0 351 >
ffff880050cc96c0 3878938534 C Bi:2:005:5 0 106 = 01000000 6a000000 24000000 3e000000 00000000 00000000 00000000 00000000
ffff880050cc96c0 3878938560 S Bi:2:005:5 -115 2048 <
ffff880050cc9780 3878939007 C Bi:2:005:5 0 395 = 01000000 8b010000 24000000 5f010000 00000000 00000000 00000000 00000000
ffff880050cc9780 3878939027 S Bi:2:005:5 -115 2048 <
ffff880050cf69c0 3878939152 S Bo:2:005:4 -115 386 = 01000000 82010000 24000000 56010000 00000000 00000000 00000000 00000000
ffff880050cf69c0 3878939186 C Bo:2:005:4 0 386 >
ffff880050cc9840 3878948779 C Bi:2:005:5 0 405 = 01000000 95010000 24000000 69010000 00000000 00000000 00000000 00000000
ffff880050cc9840 3878948800 S Bi:2:005:5 -115 2048 <
ffff880050cf6600 3878956803 S Bo:2:005:4 -115 98 = 01000000 62000000 24000000 36000000 00000000 00000000 00000000 00000000
ffff880050cf6600 3878956847 C Bo:2:005:4 0 98 >
ffff880050cf6cc0 3878986391 S Bo:2:005:4 -115 151 = 01000000 97000000 24000000 6b000000 00000000 00000000 00000000 00000000
ffff880050cf6cc0 3878986440 C Bo:2:005:4 0 151 >
ffff880050cf6b40 3879052592 S Bo:2:005:4 -115 131 = 01000000 83000000 24000000 57000000 00000000 00000000 00000000 00000000
ffff880050cf6b40 3879052637 C Bo:2:005:4 0 131 >
ffff880050cf6300 3879223203 S Bo:2:005:4 -115 408 = 01000000 98010000 24000000 6c010000 00000000 00000000 00000000 00000000
ffff880050cf6300 3879223295 C Bo:2:005:4 0 408 >
ffff880050cf66c0 3879281507 S Bo:2:005:4 -115 201 = 01000000 c9000000 24000000 9d000000 00000000 00000000 00000000 00000000
ffff880050cf66c0 3879281569 C Bo:2:005:4 0 201 >
ffff88003e0fd780 3879376806 S Bo:2:005:4 -115 98 = 01000000 62000000 24000000 36000000 00000000 00000000 00000000 00000000
ffff88003e0fd780 3879376835 C Bo:2:005:4 0 98 >
ffff880050fdaa80 3879443175 S Bo:2:005:4 -115 291 = 01000000 23010000 24000000 f7000000 00000000 00000000 00000000 00000000
ffff880050fdaa80 3879443237 C Bo:2:005:4 0 291 >
ffff880050fdaf00 3879474402 S Bo:2:005:4 -115 408 = 01000000 98010000 24000000 6c010000 00000000 00000000 00000000 00000000
ffff880050fdaf00 3879474462 C Bo:2:005:4 0 408 >
ffff880050fda480 3879762766 S Bo:2:005:4 -115 408 = 01000000 98010000 24000000 6c010000 00000000 00000000 00000000 00000000
ffff880050fda480 3879762832 C Bo:2:005:4 0 408 >
ffff880050dbbd80 3879949563 S Bo:2:005:4 -115 384 = 01000000 80010000 24000000 54010000 00000000 00000000 00000000 00000000
ffff880050dbbd80 3879949593 C Bo:2:005:4 0 384 >
ffff880066291f00 3880054229 S Bo:2:005:4 -115 131 = 01000000 83000000 24000000 57000000 00000000 00000000 00000000 00000000
ffff880066291f00 3880054273 C Bo:2:005:4 0 131 >
ffff8800662916c0 3880079504 S Bo:2:005:4 -115 351 = 01000000 5f010000 24000000 33010000 00000000 00000000 00000000 00000000
ffff8800662916c0 3880079621 C Bo:2:005:4 0 351 >
ffff88004d10fd80 3880526824 S Bo:2:005:4 -115 287 = 01000000 1f010000 24000000 f3000000 00000000 00000000 00000000 00000000
ffff88004d10fd80 3880526865 C Bo:2:005:4 0 287 >
ffff88005bbf9cc0 3880986727 S Bo:2:005:4 -115 151 = 01000000 97000000 24000000 6b000000 00000000 00000000 00000000 00000000
ffff88005bbf9cc0 3880986800 C Bo:2:005:4 0 151 >
ffff88005bbf9180 3881170436 S Bo:2:005:4 -115 384 = 01000000 80010000 24000000 54010000 00000000 00000000 00000000 00000000
ffff88005bbf9180 3881170496 C Bo:2:005:4 0 384 >
ffff880050cc9900 3881434529 C Bi:2:005:5 0 114 = 01000000 72000000 24000000 46000000 00000000 00000000 00000000 00000000
ffff880050cc9900 3881434553 S Bi:2:005:5 -115 2048 <
ffff88004d0973c0 3881665383 S Bo:2:005:4 -115 291 = 01000000 23010000 24000000 f7000000 00000000 00000000 00000000 00000000
ffff88004d0973c0 3881665422 C Bo:2:005:4 0 291 >
ffff88004d15ccc0 3881892880 S Bo:2:005:4 -115 114 = 01000000 72000000 24000000 46000000 00000000 00000000 00000000 00000000
ffff88004d15ccc0 3881892968 C Bo:2:005:4 0 114 >
ffff88004d1a39c0 3882060943 S Bo:2:005:4 -115 131 = 01000000 83000000 24000000 57000000 00000000 00000000 00000000 00000000
ffff88004d1a39c0 3882060986 C Bo:2:005:4 0 131 >
ffff88004d1a3e40 3882300646 S Bo:2:005:4 -115 351 = 01000000 5f010000 24000000 33010000 00000000 00000000 00000000 00000000
ffff88004d1a3e40 3882300688 C Bo:2:005:4 0 351 >
ffff88006e3539c0 3882748541 S Bo:2:005:4 -115 287 = 01000000 1f010000 24000000 f3000000 00000000 00000000 00000000 00000000
ffff88006e3539c0 3882748581 C Bo:2:005:4 0 287 >
ffff880050cc90c0 3883391779 S Bo:2:005:4 -115 384 = 01000000 80010000 24000000 54010000 00000000 00000000 00000000 00000000
ffff880050cc90c0 3883391838 C Bo:2:005:4 0 384 >
ffff880050cc99c0 3883949995 C Bi:2:005:5 0 86 = 01000000 56000000 24000000 2a000000 00000000 00000000 00000000 00000000
ffff880050cc99c0 3883950004 S Bi:2:005:5 -115 2048 <
ffff88004d22e840 3883952808 S Bo:2:005:4 -115 86 = 01000000 56000000 24000000 2a000000 00000000 00000000 00000000 00000000
ffff88004d22e840 3883952825 C Bo:2:005:4 0 86 >
ffff880050cc9a80 3884293732 C Bi:2:005:5 0 134 = 01000000 86000000 24000000 5a000000 00000000 00000000 00000000 00000000
ffff880050cc9a80 3884293755 S Bi:2:005:5 -115 2048 <
ffff880050d9bf00 3884987875 S Bo:2:005:4 -115 151 = 01000000 97000000 24000000 6b000000 00000000 00000000 00000000 00000000
ffff880050d9bf00 3884987920 C Bo:2:005:4 0 151 >
ffff880050cc9b40 3885449936 C Bi:2:005:5 0 114 = 01000000 72000000 24000000 46000000 00000000 00000000 00000000 00000000
ffff880050cc9b40 3885449965 S Bi:2:005:5 -115 2048 <
ffff88003e177a80 3885900856 S Bo:2:005:4 -115 114 = 01000000 72000000 24000000 46000000 00000000 00000000 00000000 00000000
ffff88003e177a80 3885901087 C Bo:2:005:4 0 114 >
ffff88004d227900 3886055341 S Bo:2:005:4 -115 131 = 01000000 83000000 24000000 57000000 00000000 00000000 00000000 00000000
ffff88004d227900 3886055397 C Bo:2:005:4 0 131 >
ffff88004d15cf00 3892991582 S Bo:2:005:4 -115 151 = 01000000 97000000 24000000 6b000000 00000000 00000000 00000000 00000000
ffff88004d15cf00 3892991614 C Bo:2:005:4 0 151 >
ffff88005bbedc00 3894057073 S Bo:2:005:4 -115 131 = 01000000 83000000 24000000 57000000 00000000 00000000 00000000 00000000
ffff88005bbedc00 3894057107 C Bo:2:005:4 0 131 >
ffff880050cc5d80 3909007470 S Bo:2:005:4 -115 151 = 01000000 97000000 24000000 6b000000 00000000 00000000 00000000 00000000
ffff880050cc5d80 3909007514 C Bo:2:005:4 0 151 >
ffff880050cc5c00 3910058890 S Bo:2:005:4 -115 131 = 01000000 83000000 24000000 57000000 00000000 00000000 00000000 00000000
ffff880050cc5c00 3910058921 C Bo:2:005:4 0 131 >
ffff88004d22fc00 3941011786 S Bo:2:005:4 -115 151 = 01000000 97000000 24000000 6b000000 00000000 00000000 00000000 00000000
ffff88004d22fc00 3941011812 C Bo:2:005:4 0 151 >
ffff88004d22f900 3942060225 S Bo:2:005:4 -115 131 = 01000000 83000000 24000000 57000000 00000000 00000000 00000000 00000000
ffff88004d22f900 3942060252 C Bo:2:005:4 0 131 >
