ffff880050e1c6c0 3876364945 S Ci:2:005:0 s 80 06 0300 0000 0004 4 <
ffff880050e1c6c0 3876365181 C Ci:2:005:0 0 4 = 04030904
ffff880050e1c6c0 3876365260 S Ci:2:005:0 s 80 06 0302 0409 00fe 254 <
ffff880050e1c6c0 3876365351 C Ci:2:005:0 0 16 = 10035300 61006d00 73007500 6e006700
ffff880050e69e40 3876365487 S Ci:2:005:0 s 80 06 0300 0000 0004 4 <
ffff880050e69e40 3876365557 C Ci:2:005:0 0 4 = 04030904
ffff880050e69e40 3876365642 S Ci:2:005:0 s 80 06 0303 0409 00fe 254 <
ffff880050e69e40 3876365709 C Ci:2:005:0 0 16 = 10034e00 65007800 75007300 20005300
ffff880050e69e40 3876365800 S Ci:2:005:0 s 80 06 0300 0000 0004 4 <
ffff880050e69e40 3876365893 C Ci:2:005:0 0 4 = 04030904
ffff880050e69e40 3876365980 S Ci:2:005:0 s 80 06 0304 0409 00fe 254 <
ffff880050e69e40 3876366043 C Ci:2:005:0 0 34 = 22033300 33003300 34003400 33003600 38004300 31003100 33003000 30004500
ffff880050e69e40 3876366125 S Ci:2:005:0 s 80 06 0300 0000 0004 4 <
ffff880050e69e40 3876366205 C Ci:2:005:0 0 4 = 04030904
ffff880050e69e40 3876366292 S Ci:2:005:0 s 80 06 0307 0409 00fe 254 <
ffff880050e69e40 3876366397 C Ci:2:005:0 0 12 = 0c035200 4e004400 49005300
ffff880050e69e40 3876366458 S Ci:2:005:0 s 80 06 0300 0000 0004 4 <
ffff880050e69e40 3876366538 C Ci:2:005:0 0 4 = 04030904
ffff880050e69e40 3876366672 S Ci:2:005:0 s 80 06 0305 0409 00fe 254 <
ffff880050e69e40 3876366768 C Ci:2:005:0 0 58 = 3a035200 4e004400 49005300 20004300 6f006d00 6d007500 6e006900 63006100
ffff880050e69e40 3876366865 S Ci:2:005:0 s 80 06 0300 0000 0004 4 <
ffff880050e69e40 3876367003 C Ci:2:005:0 0 4 = 04030904
ffff880050e69e40 3876367101 S Ci:2:005:0 s 80 06 0306 0409 00fe 254 <
ffff880050e69e40 3876367203 C Ci:2:005:0 0 40 = 28035200 4e004400 49005300 20004500 74006800 65007200 6e006500 74002000
ffff880050e69e40 3876367365 S Ci:2:005:0 s 80 06 0600 0000 000a 10 <
ffff880050e69e40 3876367478 C Ci:2:005:0 0 10 = 0a060002 e0000040 0100
ffff880050e69e40 3876367544 S Ci:2:005:0 s 80 06 0a00 0000 0004 4 <
ffff880050e69e40 3876367674 C Ci:2:005:0 -32 0
ffff880050e69e40 3876367765 S Ci:2:005:0 s 80 00 0000 0000 0002 2 <
ffff880050e69e40 3876367904 C Ci:2:005:0 0 2 = 0100
ffff88004d0add80 3876392856 S Ii:2:005:3 -115:256 8 <
ffff880050cc9240 3876392873 S Bi:2:005:5 -115 2048 <
ffff880050cc9300 3876392876 S Bi:2:005:5 -115 2048 <
ffff880050cc93c0 3876392877 S Bi:2:005:5 -115 2048 <
ffff880050cc9480 3876392878 S Bi:2:005:5 -115 2048 <
ffff880050cc9540 3876392879 S Bi:2:005:5 -115 2048 <
ffff880050cc9600 3876392880 S Bi:2:005:5 -115 2048 <
ffff880050cc96c0 3876392881 S Bi:2:005:5 -115 2048 <
ffff880050cc9780 3876392882 S Bi:2:005:5 -115 2048 <
ffff880050cc9840 3876392882 S Bi:2:005:5 -115 2048 <
ffff880050cc9900 3876392883 S Bi:2:005:5 -115 2048 <
ffff880050cc99c0 3876392885 S Bi:2:005:5 -115 2048 <
ffff880050cc9a80 3876392886 S Bi:2:005:5 -115 2048 <
ffff880050cc9b40 3876392887 S Bi:2:005:5 -115 2048 <
ffff880050cc9c00 3876392888 S Bi:2:005:5 -115 2048 <
ffff880050cc9cc0 3876392889 S Bi:2:005:5 -115 2048 <
ffff880050cc9d80 3876392890 S Bi:2:005:5 -115 2048 <
ffff880078728cc0 3876392895 S Bi:2:005:5 -115 2048 <
ffff880050cc9240 3876392896 C Bi:2:005:5 0 134 = 01000000 86000000 24000000 5a000000 00000000 00000000 00000000 00000000
ffff880050e12e40 3876392898 S Bi:2:005:5 -115 2048 <
ffff880050e12c00 3876392899 S Bi:2:005:5 -115 2048 <
ffff880050cc9240 3876392901 S Bi:2:005:5 -115 2048 <
ffff880050e12d80 3876392904 S Bi:2:005:5 -115 2048 <
ffff88003e2e8f00 3876392910 S Bi:2:005:5 -115 2048 <
ffff88003e2e83c0 3876392911 S Bi:2:005:5 -115 2048 <
ffff88003e2e8000 3876392913 S Bi:2:005:5 -115 2048 <
ffff88003e2e8480 3876392914 S Bi:2:005:5 -115 2048 <
ffff88003e2e8540 3876392917 S Bi:2:005:5 -115 2048 <
ffff88003e2e8300 3876392919 S Bi:2:005:5 -115 2048 <
ffff88003e2e86c0 3876392920 S Bi:2:005:5 -115 2048 <
ffff88003e2e8cc0 3876392921 S Bi:2:005:5 -115 2048 <
ffff88003e2e8240 3876392922 S Bi:2:005:5 -115 2048 <
ffff88003e2e8b40 3876392923 S Bi:2:005:5 -115 2048 <
ffff88003e2e8d80 3876392970 S Bi:2:005:5 -115 2048 <
ffff88003e2e8c00 3876392972 S Bi:2:005:5 -115 2048 <
ffff88006490f180 3876392973 S Bi:2:005:5 -115 2048 <
ffff88006490fd80 3876392975 S Bi:2:005:5 -115 2048 <
ffff880066182a80 3876392977 S Bi:2:005:5 -115 2048 <
ffff880066182180 3876392978 S Bi:2:005:5 -115 2048 <
ffff880066182e40 3876392979 S Bi:2:005:5 -115 2048 <
ffff880066182840 3876392980 S Bi:2:005:5 -115 2048 <
ffff88005b807300 3876392982 S Bi:2:005:5 -115 2048 <
ffff8800662f9180 3876392983 S Bi:2:005:5 -115 2048 <
ffff8800662f9c00 3876392985 S Bi:2:005:5 -115 2048 <
ffff8800662f9900 3876392987 S Bi:2:005:5 -115 2048 <
ffff8800662f9f00 3876392988 S Bi:2:005:5 -115 2048 <
ffff880050fda9c0 3876392989 S Bi:2:005:5 -115 2048 <
ffff880050fd2240 3876404812 S Bo:2:005:4 -115 134 = 01000000 86000000 24000000 5a000000 00000000 00000000 00000000 00000000
ffff880050fd2240 3876404846 C Bo:2:005:4 0 134 >
ffff880050cc9300 3876414929 C Bi:2:005:5 0 122 = 01000000 7a000000 24000000 4e000000 00000000 00000000 00000000 00000000
ffff880050cc9300 3876414934 S Bi:2:005:5 -115 2048 <
ffff88004d0add80 3876420115 C Ii:2:005:3 0:256 8 = 01000000 00000000
ffff88004d0add80 3876420119 S Ii:2:005:3 -115:256 8 <
ffff88005ba879c0 3876433059 S Bo:2:005:4 -115 386 = 01000000 82010000 24000000 56010000 00000000 00000000 00000000 00000000
ffff88005ba879c0 3876433092 C Bo:2:005:4 0 386 >
ffff880050cc93c0 3876434412 C Bi:2:005:5 0 86 = 01000000 56000000 24000000 2a000000 00000000 00000000 00000000 00000000
ffff880050cc93c0 3876434415 S Bi:2:005:5 -115 2048 <
ffff88004d0add80 3876452136 C Ii:2:005:3 0:256 8 = 01000000 00000000
ffff88004d0add80 3876452139 S Ii:2:005:3 -115:256 8 <
ffff88004d0add80 3876484112 C Ii:2:005:3 0:256 8 = 01000000 00000000
ffff88004d0add80 3876484114 S Ii:2:005:3 -115:256 8 <
ffff88004d0add80 3876516166 C Ii:2:005:3 0:256 8 = 01000000 00000000
ffff88004d0add80 3876516170 S Ii:2:005:3 -115:256 8 <
ffff88004d1db900 3876688806 S Bo:2:005:4 -115 134 = 01000000 86000000 24000000 5a000000 00000000 00000000 00000000 00000000
ffff88004d1db900 3876688834 C Bo:2:005:4 0 134 >
ffff880050cf6a80 3876884813 S Bo:2:005:4 -115 122 = 01000000 7a000000 24000000 4e000000 00000000 00000000 00000000 00000000
ffff880050cf6a80 3876884839 C Bo:2:005:4 0 122 >
ffff880050cc9480 3877419067 C Bi:2:005:5 0 114 = 01000000 72000000 24000000 46000000 00000000 00000000 00000000 00000000
ffff880050cc9480 3877419071 S Bi:2:005:5 -115 2048 <
ffff880050cc9540 3877438384 C Bi:2:005:5 0 86 = 01000000 56000000 24000000 2a000000 00000000 00000000 00000000 00000000
ffff880050cc9540 3877438388 S Bi:2:005:5 -115 2048 <
ffff880050fdacc0 3877884943 S Bo:2:005:4 -115 134 = 01000000 86000000 24000000 5a000000 00000000 00000000 00000000 00000000
ffff880050fda480 3877884955 S Bo:2:005:4 -115 114 = 01000000 72000000 24000000 46000000 00000000 00000000 00000000 00000000
ffff880050fdacc0 3877884978 C Bo:2:005:4 0 134 >
ffff880050fda480 3877885015 C Bo:2:005:4 0 114 >
ffff880050fda0c0 3877892827 S Bo:2:005:4 -115 134 = 01000000 86000000 24000000 5a000000 00000000 00000000 00000000 00000000
ffff880050fda0c0 3877892850 C Bo:2:005:4 0 134 >
ffff880050fda6c0 3877968834 S Bo:2:005:4 -115 154 = 01000000 9a000000 24000000 6e000000 00000000 00000000 00000000 00000000
ffff880050fda6c0 3877968863 C Bo:2:005:4 0 154 >
ffff880050fda300 3877985433 S Bo:2:005:4 -115 151 = 01000000 97000000 24000000 6b000000 00000000 00000000 00000000 00000000
ffff880050fda300 3877985465 C Bo:2:005:4 0 151 >
ffff880050fda3c0 3878096927 S Bo:2:005:4 -115 134 = 01000000 86000000 24000000 5a000000 00000000 00000000 00000000 00000000
ffff880050fda3c0 3878096997 C Bo:2:005:4 0 134 >
ffff880050fda900 3878156052 S Bo:2:005:4 -115 369 = 01000000 71010000 24000000 45010000 00000000 00000000 00000000 00000000
ffff880050fda900 3878156097 C Bo:2:005:4 0 369 >
ffff88005ba93d80 3878214436 S Bo:2:005:4 -115 221 = 01000000 dd000000 24000000 b1000000 00000000 00000000 00000000 00000000
ffff88005ba93d80 3878214472 C Bo:2:005:4 0 221 >
ffff88004d1659c0 3878406986 S Bo:2:005:4 -115 369 = 01000000 71010000 24000000 45010000 00000000 00000000 00000000 00000000
ffff88004d1659c0 3878407072 C Bo:2:005:4 0 369 >
ffff880050cc9600 3878442245 C Bi:2:005:5 0 86 = 01000000 56000000 24000000 2a000000 00000000 00000000 00000000 00000000
ffff880050cc9600 3878442259 S Bi:2:005:5 -115 2048 <
ffff88004d165c00 3878657746 S Bo:2:005:4 -115 369 = 01000000 71010000 24000000 45010000 00000000 00000000 00000000 00000000
ffff88004d165c00 3878657803 C Bo:2:005:4 0 369 >
ffff88004d165a80 3878858408 S Bo:2:005:4 -115 351 = 01000000 5f010000 24000000 33010000 00000000 00000000 00000000 00000000
ffff88004d165a80 3878858466 C Bo:2:005:4 0 351 >
ffff880050cc96c0 3878938545 C Bi:2:005:5 0 106 = 01000000 6a000000 24000000 3e000000 00000000 00000000 00000000 00000000
ffff880050cc96c0 3878938560 S Bi:2:005:5 -115 2048 <
ffff880050cc9780 3878939014 C Bi:2:005:5 0 395 = 01000000 8b010000 24000000 5f010000 00000000 00000000 00000000 00000000
ffff880050cc9780 3878939027 S Bi:2:005:5 -115 2048 <
ffff880050cf69c0 3878939156 S Bo:2:005:4 -115 386 = 01000000 82010000 24000000 56010000 00000000 00000000 00000000 00000000
ffff880050cf69c0 3878939187 C Bo:2:005:4 0 386 >
ffff880050cc9840 3878948786 C Bi:2:005:5 0 405 = 01000000 95010000 24000000 69010000 00000000 00000000 00000000 00000000
ffff880050cc9840 3878948800 S Bi:2:005:5 -115 2048 <
ffff880050cf6600 3878956804 S Bo:2:005:4 -115 98 = 01000000 62000000 24000000 36000000 00000000 00000000 00000000 00000000
ffff880050cf6600 3878956849 C Bo:2:005:4 0 98 >
ffff880050cf6cc0 3878986392 S Bo:2:005:4 -115 151 = 01000000 97000000 24000000 6b000000 00000000 00000000 00000000 00000000
ffff880050cf6cc0 3878986440 C Bo:2:005:4 0 151 >
ffff880050cf6b40 3879052593 S Bo:2:005:4 -115 131 = 01000000 83000000 24000000 57000000 00000000 00000000 00000000 00000000
ffff880050cf6b40 3879052638 C Bo:2:005:4 0 131 >
ffff880050cf6300 3879223205 S Bo:2:005:4 -115 408 = 01000000 98010000 24000000 6c010000 00000000 00000000 00000000 00000000
ffff880050cf6300 3879223296 C Bo:2:005:4 0 408 >
ffff880050cf66c0 3879281508 S Bo:2:005:4 -115 201 = 01000000 c9000000 24000000 9d000000 00000000 00000000 00000000 00000000
ffff880050cf66c0 3879281569 C Bo:2:005:4 0 201 >
ffff88003e0fd780 3879376809 S Bo:2:005:4 -115 98 = 01000000 62000000 24000000 36000000 00000000 00000000 00000000 00000000
ffff88003e0fd780 3879376836 C Bo:2:005:4 0 98 >
ffff880050fdaa80 3879443177 S Bo:2:005:4 -115 291 = 01000000 23010000 24000000 f7000000 00000000 00000000 00000000 00000000
ffff880050fdaa80 3879443237 C Bo:2:005:4 0 291 >
ffff880050fdaf00 3879474404 S Bo:2:005:4 -115 408 = 01000000 98010000 24000000 6c010000 00000000 00000000 00000000 00000000
ffff880050fdaf00 3879474463 C Bo:2:005:4 0 408 >
ffff880050fda480 3879762767 S Bo:2:005:4 -115 408 = 01000000 98010000 24000000 6c010000 00000000 00000000 00000000 00000000
ffff880050fda480 3879762832 C Bo:2:005:4 0 408 >
ffff880050dbbd80 3879949565 S Bo:2:005:4 -115 384 = 01000000 80010000 24000000 54010000 00000000 00000000 00000000 00000000
ffff880050dbbd80 3879949594 C Bo:2:005:4 0 384 >
ffff880066291f00 3880054235 S Bo:2:005:4 -115 131 = 01000000 83000000 24000000 57000000 00000000 00000000 00000000 00000000
ffff880066291f00 3880054273 C Bo:2:005:4 0 131 >
ffff8800662916c0 3880079507 S Bo:2:005:4 -115 351 = 01000000 5f010000 24000000 33010000 00000000 00000000 00000000 00000000
ffff8800662916c0 3880079625 C Bo:2:005:4 0 351 >
ffff88004d10fd80 3880526828 S Bo:2:005:4 -115 287 = 01000000 1f010000 24000000 f3000000 00000000 00000000 00000000 00000000
ffff88004d10fd80 3880526870 C Bo:2:005:4 0 287 >
ffff88005bbf9cc0 3880986734 S Bo:2:005:4 -115 151 = 01000000 97000000 24000000 6b000000 00000000 00000000 00000000 00000000
ffff88005bbf9cc0 3880986801 C Bo:2:005:4 0 151 >
ffff88005bbf9180 3881170446 S Bo:2:005:4 -115 384 = 01000000 80010000 24000000 54010000 00000000 00000000 00000000 00000000
ffff88005bbf9180 3881170498 C Bo:2:005:4 0 384 >
ffff880050cc9900 3881434543 C Bi:2:005:5 0 114 = 01000000 72000000 24000000 46000000 00000000 00000000 00000000 00000000
ffff880050cc9900 3881434553 S Bi:2:005:5 -115 2048 <
ffff88004d0973c0 3881665387 S Bo:2:005:4 -115 291 = 01000000 23010000 24000000 f7000000 00000000 00000000 00000000 00000000
ffff88004d0973c0 3881665422 C Bo:2:005:4 0 291 >
ffff88004d15ccc0 3881892890 S Bo:2:005:4 -115 114 = 01000000 72000000 24000000 46000000 00000000 00000000 00000000 00000000
ffff88004d15ccc0 3881892969 C Bo:2:005:4 0 114 >
ffff88004d1a39c0 3882060947 S Bo:2:005:4 -115 131 = 01000000 83000000 24000000 57000000 00000000 00000000 00000000 00000000
ffff88004d1a39c0 3882060986 C Bo:2:005:4 0 131 >
ffff88004d1a3e40 3882300650 S Bo:2:005:4 -115 351 = 01000000 5f010000 24000000 33010000 00000000 00000000 00000000 00000000
ffff88004d1a3e40 3882300689 C Bo:2:005:4 0 351 >
ffff88006e3539c0 3882748547 S Bo:2:005:4 -115 287 = 01000000 1f010000 24000000 f3000000 00000000 00000000 00000000 00000000
ffff88006e3539c0 3882748581 C Bo:2:005:4 0 287 >
ffff880050cc90c0 3883391787 S Bo:2:005:4 -115 384 = 01000000 80010000 24000000 54010000 00000000 00000000 00000000 00000000
ffff880050cc90c0 3883391839 C Bo:2:005:4 0 384 >
ffff880050cc99c0 3883949999 C Bi:2:005:5 0 86 = 01000000 56000000 24000000 2a000000 00000000 00000000 00000000 00000000
ffff880050cc99c0 3883950004 S Bi:2:005:5 -115 2048 <
ffff88004d22e840 3883952809 S Bo:2:005:4 -115 86 = 01000000 56000000 24000000 2a000000 00000000 00000000 00000000 00000000
ffff88004d22e840 3883952826 C Bo:2:005:4 0 86 >
ffff880050cc9a80 3884293740 C Bi:2:005:5 0 134 = 01000000 86000000 24000000 5a000000 00000000 00000000 00000000 00000000
ffff880050cc9a80 3884293755 S Bi:2:005:5 -115 2048 <
ffff880050d9bf00 3884987884 S Bo:2:005:4 -115 151 = 01000000 97000000 24000000 6b000000 00000000 00000000 00000000 00000000
ffff880050d9bf00 3884987921 C Bo:2:005:4 0 151 >
ffff880050cc9b40 3885449947 C Bi:2:005:5 0 114 = 01000000 72000000 24000000 46000000 00000000 00000000 00000000 00000000
ffff880050cc9b40 3885449965 S Bi:2:005:5 -115 2048 <
ffff88003e177a80 3885900865 S Bo:2:005:4 -115 114 = 01000000 72000000 24000000 46000000 00000000 00000000 00000000 00000000
ffff88003e177a80 3885901092 C Bo:2:005:4 0 114 >
ffff88004d227900 3886055349 S Bo:2:005:4 -115 131 = 01000000 83000000 24000000 57000000 00000000 00000000 00000000 00000000
ffff88004d227900 3886055398 C Bo:2:005:4 0 131 >
ffff88004d15cf00 3892991585 S Bo:2:005:4 -115 151 = 01000000 97000000 24000000 6b000000 00000000 00000000 00000000 00000000
ffff88004d15cf00 3892991614 C Bo:2:005:4 0 151 >
ffff88005bbedc00 3894057075 S Bo:2:005:4 -115 131 = 01000000 83000000 24000000 57000000 00000000 00000000 00000000 00000000
ffff88005bbedc00 3894057108 C Bo:2:005:4 0 131 >
ffff880050cc5d80 3909007478 S Bo:2:005:4 -115 151 = 01000000 97000000 24000000 6b000000 00000000 00000000 00000000 00000000
ffff880050cc5d80 3909007514 C Bo:2:005:4 0 151 >
ffff880050cc5c00 3910058893 S Bo:2:005:4 -115 131 = 01000000 83000000 24000000 57000000 00000000 00000000 00000000 00000000
ffff880050cc5c00 3910058921 C Bo:2:005:4 0 131 >
ffff88004d22fc00 3941011787 S Bo:2:005:4 -115 151 = 01000000 97000000 24000000 6b000000 00000000 00000000 00000000 00000000
ffff88004d22fc00 3941011812 C Bo:2:005:4 0 151 >
ffff88004d22f900 3942060227 S Bo:2:005:4 -115 131 = 01000000 83000000 24000000 57000000 00000000 00000000 00000000 00000000
ffff88004d22f900 3942060252 C Bo:2:005:4 0 131 >
